"URL","Title","Description","Region"
"http://www.huffingtonpost.com/wray-herbert/the-high-costs-of-status_b_6303150.html","The High Costs of Status Seeking","One idea is what's called the social rank hypothesis. This simply means that in unequal societies, the have-nots are more likely to engage in unfavorable social comparisons, and this preoccupation with status and hierarchy boosts competition ...","Los Angeles, California cityNdx: 1"
"http://www.huffingtonpost.com/2014/12/16/how-to-wear-burgundy-lipstick_n_6317332.html","Yes, Everyone Can Wear Winter's Go-To Lipstick Shade. Trust Us.","It's time to put the bright red lipstick down. Don't get us wrong, we love a bold red lip, especially when we see stars like Taylor Swift running around town wearing the hue. But this season's lipstick color is so good, you're going to want to break ...","Los Angeles, California cityNdx: 1"
"http://www.thedailybeast.com/articles/2014/11/10/i-saw-nuclear-armageddon-sitting-on-my-desk.html","I Saw Nuclear Armageddon Sitting on My Desk","Oppenheimer's work at Los Alamos in the 1940s had given the U.S. nuclear dominance. And now, after 60 years, the disgraceful falsity of .... There was far less sense that military rank was aligned with social rank. My immediate chief was a Lieutenant ...","Los Angeles, California cityNdx: 1"
"http://www.dailymail.co.uk/sciencetech/article-2993259/Social-status-boosts-health-fertility-HYENAS-Privileged-females-clan-live-longer-pups.html","Social status boosts health and fertility - even in HYENAS: Privileged females ...","Researchers studying spotted hyenas in Kenya found that high-ranking members of a clan live longer, are healthier and even have more offspring. The discovery was made by analysing the lengths of telomeres - caps at the end of each strand of DNA&nbsp;...","Los Angeles, California cityNdx: 1"
"http://www.dailymail.co.uk/femail/article-2995876/Meet-ORIGINAL-fashion-blogger-flamboyant-16th-century-accountant-painted-outfits-40-years-published-world-s-style-book.html","16th century accountant painted his outfits for 40 years for world's first ...","Fascinated by clothes, the flamboyant dresser began recording his appearance on parchment paper in 1520, during a time when strict laws governed the kinds of fabrics each social rank and station could wear. He initially commissioned 35 images to&nbsp;...","Los Angeles, California cityNdx: 1"
"http://www.dailymail.co.uk/sciencetech/article-2821921/England-s-oldest-laws-DIGITISED-Medieval-manuscript-predating-Magna-Carta-available-online.html","Textus Roffensis, England's oldest laws are now available online","Compensations are arranged according to social rank, descending from king to slave. The initial provisions of the code offer protection to the church. Though the latter were probably innovations, much of the remainder of the code may be derived from ...","Los Angeles, California cityNdx: 1"
"http://www.dailymail.co.uk/news/article-2811460/Is-keeping-Joneses-making-ill-Trying-compete-socially-makes-people-stressed.html","Trying to compete socially makes people more stressed, study says","People with low incomes are more prone to ill health due to the stress associated with 'keeping up with the Joneses' rather than their lack of money, according to Scottish researchers. The research team found that simply having low pay or not enough ...","Los Angeles, California cityNdx: 1"
"http://www.huffingtonpost.com/2014/09/02/pw-picks-books-of-the-wee_28_n_5752864.html","PW Picks: Books of the Week, September 1, 2014","First published in Publisher's Weekly: This week, new Tana French, new Elena Ferrante, and the history of rock 'n' roll in 10 songs. Close.. Best New Books Out This Week. 1 of 13... 'The Emerald Light in the Air' by Donald Antrim (FSG). The seven&nbsp;...","Los Angeles, California cityNdx: 1"
"http://www.huffingtonpost.com/brian-kil/pitching-and-closing_b_5644580.html","Pitching and Closing: The Business Handbook to Tech","He led business development in two venture-backed startups (Aviary and Dwolla) and, most recently, co-founded SocialRank. Ellen, 25, is herself a corporate expat in the startup scene. A Brown University alumnus and former investment banker, Ellen&nbsp;...","Los Angeles, California cityNdx: 1"
"http://www.redlandsdailyfacts.com/government-and-politics/20140726/redlands-has-restrictions-but-urban-farming-is-en-trend","Redlands places limits on urban farming","According to a study conducted by the U.S. Department of Agriculture in 2010, less than 1 percent of city dwellers in Los Angeles, Denver, Miami and New York City owned urban chickens. About 4 percent of people surveyed said they planned to own urban&nbsp;...","Los Angeles, California cityNdx: 1"
"http://mashable.com/2014/05/15/spoonrocket-funding/","SpoonRocket Raises $11 Million to Deliver Healthy Meals in 10 Minutes","While Steven Hsiao and Anson Tsui were in their senior year of college at the University of California, Berkeley, in 2009, they decided to start a delivery service for Vietnamese and Mexican food. They sourced fresh ingredients, prepared the meals and&nbsp;...","Los Angeles, California cityNdx: 1"
"http://www.huffingtonpost.com/2014/05/08/queen-latifah-mother-scleroderma_n_5288960.html","Queen Latifah Opens Up About Helping Her Mother Battle Autoimmune Disease ...","Before she was boasting the highest daytime television premiere with the debut episode of The Queen Latifah Show last September, Queen Latifah contemplated relocating to Los Angeles for the syndicated talk show to cater to her mother's medical needs.","Los Angeles, California cityNdx: 1"
"http://news.sciencemag.org/archaeology/2013/12/thousand-year-graveyard","The Thousand-Year Graveyard","He gave a presentation in the church and flashed a slide about a news story about a plague-infected squirrel that closed campgrounds near Los Angeles. Killer squirrels are coming! .... By comparing the teeth and bones of urban nobles with those of ...","Los Angeles, California cityNdx: 1"
"http://www.huffingtonpost.com/2014/08/15/hate-wearing-lipstick_n_5674952.html","The Best Alternatives For Anyone Who Hates Wearing Lipstick","We get it. Wearing lipstick is tricky. True, there are some really excellent lipsticks out there, but there are also plenty with super-drying formulas or ones that bleed all over your face. Luckily, HuffPost Live makeup artist Kari Bauce is a pro in ...","Los Angeles, California cityNdx: 1"
"http://thenextweb.com/insider/2014/01/15/handybook-acquires-demand-cleaning-service-exec-help-expand-west-california/","Handybook Acquires Exec To Help It Expand West To California","However, it wound up shifting its business and abandoning its on-demand errand service to focus entirely on cleaning. The company currently operates in San Francisco, Seattle, San Diego, Los Angeles, New York, Boston, Chicago, and Washington, DC.","Los Angeles, California cityNdx: 1"
"http://www.huffingtonpost.com/2014/05/26/china-superpower_n_5394203.html","9 Ways China Could Blow It","... is vulnerable to Thomas Piketty-type attacks, on the theory that even though the income gap is growing, income growth at the bottom is rising (just not as quickly). That may be true, but perceptions matter, especially in a society obsessed with ...","Los Angeles, California cityNdx: 1"
"http://www.wrestlezone.com/news/502269-total-divas-season-3-details","Press Release: E! Reveals Total Divas Season 3 Story Line Details for Bryan ...","Los Angeles, CA, August 13, 2014  E!, WWE and Bunim-Murray Productions will once again shadow WWE Divas The Bella Twins (Nikki and Brie Bella), Natalya (Nattie), Naomi (Trinity), Cameron (Ariane) and rookies Eva Marie and Summer Rae ...","Los Angeles, California cityNdx: 1"
"http://abcnews.go.com/Technology/wolves-howl-love-scientists/story?id=20109765","Why do Wolves Howl? Love, Scientists Say","... Vienna, set out to determine if the howl of a wolf is an involuntary cry caused by stress or a conscious result of separation from a companion that is particularly important, either because of social rank within the pack or genuine affection for a ...","Los Angeles, California cityNdx: 1"
"http://thenextweb.com/insider/2014/01/21/howaboutwe-couples-celebrates-one-year-anniversary-launch-los-angeles/","HowAboutWe for Couples Launches in Los Angeles","Online dating startup HowAboutWe is marking the one-year launch anniversary of its Couples service by releasing some metrics about its performance thus far. The company says that it has helped users spend more than 56,739 hours together, the equivalent&nbsp;...","Los Angeles, California cityNdx: 1"
"http://www.huffingtonpost.com/leora-tanenbaum/does-judaism-need-gender_b_5556150.html","Does Judaism Need Gender?","Women were exempted from certain mitzvot because being religiously and communally obligated was a status symbol -- the religious and public spheres were valued more than the private and domestic spheres -- and men were of a higher social rank than&nbsp;...","Los Angeles, California cityNdx: 1"
"http://thenextweb.com/insider/2014/02/12/disney-teams-techstars-launch-accelerator-program-media-entertainment-startups/","Disney and Techstars Launches Media and Entertainment Accelerator","As mentioned earlier, Disney will kick off its accelerator program on June 30 in Los Angeles. However, it's not the only media-focused program in town. It will also have to contend with Warner Bros. Media Camp, now in its second year. But Mayer isn't ...","Los Angeles, California cityNdx: 1"
"http://thenextweb.com/apps/2014/01/16/location-based-service-banjo-overhauls-mobile-apps-display-social-posts-sorted-live-events/","Banjo Overhauls Its Mobile Apps To Display Social Posts By Live Events","... publicly sharing across various social networks in locations around the world. Today, the app gets more specific  it displays results based on location and the event taking place there (e.g. the Winter Olympics in Sochi, the Golden Globes in Los ...","Los Angeles, California cityNdx: 1"
"http://www.wrestlezone.com/news/481133-press-release-e-network-touts-the-major-success-of-total-divas-season-2-finale","Press Release: E! Network Touts the Major Success of Total Divas Season 2 Finale","Los Angeles, CA, June 2, 2014  E!'s hit series Total Divas powered to a season high with its season 2 finale episode garnering a whopping 1.55 Million Total Viewers as well as netting nearly 1 Million Adults 18-49 (961,000) and impressive numbers in ...","Los Angeles, California cityNdx: 1"
"http://www.broadwayworld.com/los-angeles/article/BWW-Reviews-LADY-WINDERMERES-FAN-Returns-to-Clark-Library-Grounds-by-Popular-Demand-20140728","BWW Reviews: Chalk Rep's LADY WINDERMERE'S FAN Returns to Clark Library ...","The William Andrews Clark Memorial Library is located at 2520 Cimarron St., Los Angeles, CA 90018 and houses the pre-eminent collection of Oscar Wilde materials in the world, including a typed copy of Lady Windermere's Fan with Wilde's handwritten ...","Los Angeles, California cityNdx: 1"
"http://newsroom.ucla.edu/releases/cool-middle-school-kids-bully-242868","'Cool' kids in middle school bully more, UCLA psychologists report","The psychologists studied 1,895 ethnically diverse students from 99 classes at 11 Los Angeles middle schools. They conducted surveys at three points: during ... Like middle school students, Juvonen noted, non-human primates also use aggression to ...","Los Angeles, California cityNdx: 1"
"http://thenextweb.com/insider/2013/11/13/flightcar-opens-shop-los-angeles-launches-web-app-airport-car-sharing-service/","FlightCar Expands to Los Angeles And Launches A Web App","Y Combinator alumnus FlightCar is expanding its operations with the launch of its third city location. The company today announced that Los Angeles would join Boston and San Francisco as cities where the company is bringing its airport car sharing service.","Los Angeles, California cityNdx: 1"
"http://thenextweb.com/insider/2013/11/16/ridesharing-company-sidecar-drops-donation-model-place-payments-california-riders/","Sidecar Drops Its Donation Model In Favor of Payments, Only in California","... process regulators have put in place that will further ensure that the company is operating legally. Although it operates in six cities across the United States, this new payment model only affects rides in California, specifically San Francisco ...","Los Angeles, California cityNdx: 1"
"http://tvbythenumbers.zap2it.com/2014/08/13/season-three-of-es-total-divas-premieres-sunday-september-7th-at-9pm/292955/","Season Three of E!'s 'Total Divas' Premieres Sunday September 7th at 9PM","Los Angeles, CA, August 13, 2014  E!, WWE and Bunim-Murray Productions will once again shadow WWE Divas The Bella Twins (Nikki and Brie Bella), Natalya (Nattie), Naomi (Trinity), Cameron (Ariane) and rookies Eva Marie and Summer Rae ...","Los Angeles, California cityNdx: 1"
"http://www.huffingtonpost.com/2014/02/03/ombre-lip_n_4653219.html","Why You Should Try Ombre Lips... And 3 Tricks To Making It Look Perfect","The ombre trend that we first fell in love with started with our hair -- let's just say we paid lots of money to get Rachel Bilson and Jessica Alba's multi-shade styles. But ombre is now taking over another part of our bodies. These days, it's all ...","Los Angeles, California cityNdx: 1"
"http://mashable.com/2013/07/08/icracked/","iCracked is Banking on Your Cracked iPhone Screen","AJ Forsythe, 25, and Anthony Martin, 26, first met during their freshman year at California Polytechnic State University. AJ admired Anthony's entrepreneurial spirit; he had started a peer-to-peer textbook rental company in Santa Barbara. Forsythe's ...","Los Angeles, California cityNdx: 1"
"http://www.huffingtonpost.com/vala-afshar/the-top-100-best-and-most_b_3713875.html","The Top 100 Best And Most Collaborative US Colleges [INFOGRAPHIC]","A recent Harvard Business Review post suggested that higher education is being disrupted by 'digital natives', including K-12 institutions that are becoming more mobile and social. The changing landscape and the explosive growth of mobile and social&nbsp;...","Los Angeles, California cityNdx: 1"
"http://thenextweb.com/insider/2013/07/12/lyft-founders-sell-zimride-their-carpooling-startup-to-enterprise-rent-a-cars-parent-company/","Lyft Founders Sell Carpooling Startup Zimride To Enterprise Rent-A-Car","Zimride says that it is being used in corporate and college environments (130 universities, in fact), including Facebook and at the University of California, Los Angeles (UCLA). Contrary to its other product, Lyft, Zimride is useful when you're dealing ...","Los Angeles, California cityNdx: 1"
"http://thenextweb.com/insider/2014/01/29/howaboutwe-acquires-nerve-com-launches-new-lifestyle-media-network/","HowAboutWe Expands Into Lifestyle Media After Acquiring Nerve.com","The new media company will be independent of HowAboutWe's subscription services, HowAboutWe Dating and HowAboutWe for Couples, which recently marked its one-year anniversary and launched in Los Angeles. Nerve.com co-founder Rufus Griscom&nbsp;...","Los Angeles, California cityNdx: 1"
"http://tvbythenumbers.zap2it.com/2014/06/02/es-hit-series-total-divas-powers-to-a-season-high-in-total-viewers-for-finale-at-9pm/269656/","E!'s Hit Series 'Total Divas' Powers to a Season High in Total Viewers for ...","Los Angeles, CA, June 2, 2014  E!'s hit series Total Divas powered to a season high with its season 2 finale episode garnering a whopping 1.55 Million Total Viewers as well as netting nearly 1 Million Adults 18-49 (961,000) and impressive numbers in ...","Los Angeles, California cityNdx: 1"
"https://reason.com/archives/2013/07/17/4-reasons-to-reject-federal-charges-agai","4 Reasons to Reject Federal Charges Against George Zimmerman","After a Florida jury acquitted George Zimmerman in the death of Trayvon Martin on Saturday, President Obama appealed for calm. I know this case has elicited strong passions, he said. And in the wake of the verdict, I know those passions may be ...","Los Angeles, California cityNdx: 1"
"http://mashable.com/2013/06/14/thesuitest/","TheSuitest Helps You Find the Best Deals on Upscale Hotel Rooms","How much should you pay for a 500-square-foot room in Los Angeles, California? How does your room compare to other rooms in the same city that are the same size with similar amenities? These are just some of the questions that TheSuitest helps you&nbsp;...","Los Angeles, California cityNdx: 1"
"http://thenextweb.com/insider/2013/09/06/san-francisco-launches-entrepreneur-in-residence-program-to-get-startups-to-help-solve-city-problems/","San Francisco's New Program Enlists Startups To Tackle City Problems","San Francisco officials will select 3 to 5 teams from amongst all the applicants and the program will run from October 2013 to February 2014. It is the first in the nation and, if it runs successfully, there are plans to expand it to other cities ...","Los Angeles, California cityNdx: 1"
"http://thenextweb.com/insider/2013/01/30/lyft-cpuc-interim-agreement-and-expansion-to-los-angeles/","Lyft expands to LA after signing agreement with California regulators to make ...","Starting January 31, Lyft will be operating in its second city: Los Angeles. Last November, Lyft was issued a cease and desist letter from the CPUC and fined $20,000 for operating unlicensed charter-party businesses. The company opposed the citation&nbsp;...","Los Angeles, California cityNdx: 1"
"http://thenextweb.com/insider/2013/08/19/taskrabbit-begins-servicing-5-new-cities-as-it-inches-closer-to-1-25m-new-users-in-2013/","TaskRabbit begins servicing 5 new cities as it inches closer to 1.25M new ...","The new cities join a growing number of places around the US that the company currently services, including Austin, Boston, Chicago, Los Angeles, Portland, New York City, and the San Francisco Bay Area. It also revealed that it's on track to sign up 1 ...","Los Angeles, California cityNdx: 1"
"http://www.huffingtonpost.com/2013/08/16/guys-lipstick-women_n_3765360.html","Here's What Guys Actually Think About Lipstick","Like many makeup-obsessed women, we're huge fans of lipstick. But we sometimes wonder if the men in our lives are as jazzed about the bold face paint as we are. A 2012 study found that waitresses who wore lipstick got higher tips from men, and ...","Los Angeles, California cityNdx: 1"
"http://www.huffingtonpost.com/2013/08/14/red-lipstick-celebrities_n_3755838.html","The Stars Who Taught Us How To Wear Red Lipstick","Nothing makes us feel sexier than wearing red lipstick. It's amazing how something that's packaged in a tiny tube can bring about a sense of grandeur. (It's way more affordable than a pair of red-bottom Christian Louboutin heels.) Since the 1940s, red ...","Los Angeles, California cityNdx: 1"
"http://thenextweb.com/google/2013/08/02/youtube-says-it-will-bring-its-creative-studio-space-to-new-york-city-in-2014/","YouTube To Open Its Creative Studio Space In NYC In 2014","Naturally since it's in NYC, the space is going to be much smaller than its other US facility in Los Angeles, which is 41,000 square feet and in a hangar formerly owned by Howard Hughes' airplane company. For those that aren't familiar, YouTube's ...","Los Angeles, California cityNdx: 1"
"http://thenextweb.com/insider/2013/02/13/turner-media-camp-expands-to-los-angeles/","Warner Bros brings Turner's Media Camp to LA to accelerate media startups","Turner Broadcasting's Media Camp is bringing its accelerator to Los Angeles, its second city, and is now accepting applications for its next batch of companies. After its inaugural year that saw it mentor six San Francisco startups in the media ...","Los Angeles, California cityNdx: 1"
"http://www.businessinsider.com.au/silicon-alley-100-2014-2014-8","SA 100 2014: The Coolest People In New York City Tech","New York City has become home to some of the tech industry's most promising companies, including Etsy, MongoDB, and Vice Media. So we created the Silicon Alley 100 to celebrate people who did the coolest things in the past 365 days. What does it mean&nbsp;...","Los Angeles, California cityNdx: 1"
"http://thenextweb.com/insider/2013/04/08/la-tech-studio-science-hires-former-iac-corp-and-mahalo-exec-jason-rapp-as-its-managing-director/","LA Tech Studio Science Hires Former IAC and Mahalo Exec Jason Rapp As Its ...","Los Angeles-based tech studio and incubator Science, Inc. has hired former IAC corporation senior executive Jason Rapp as its Managing Director. In this capacity, he will aid in researching new opportunities for the firm's portfolio companies while ...","Los Angeles, California cityNdx: 1"
"http://www.huffingtonpost.com/2014/07/28/lipstick-history-facts_n_2791887.html","9 Things You Should Know For National Lipstick Day","Society has a long-running love/hate relationship with lipstick, and vacillating perceptions of the women (and men) who wear it. Numerous governments over the centuries, including the British Parliament, have gone so far as to attempt to ban the makeup.","Los Angeles, California cityNdx: 1"
"http://thenextweb.com/insider/2013/10/30/online-errand-running-platform-taskrabbit-expands-denver-miami-phoenix-san-diego/","TaskRabbit Launches Service In Denver, Miami, Phoenix, and San Diego","These locations were on top of others like Austin, Boston, Chicago, Los Angeles, Portland, New York City, and the San Francisco Bay Area. TaskRabbit says it's not done growing yet either. It's planning on opening up service in London, its first ...","Los Angeles, California cityNdx: 1"
"http://thenextweb.com/insider/2013/01/09/sidecar-expanding-service-to-16-new-cities-in-united-states/","SideCar to bring its ridesharing service to 16 US cities, including LA, NYC ...","On its roadmap, the company is seeking to set a foothold in 16 new cities, with plans to open up shop in Atlanta, Austin, Boston, Chicago, Washington, DC, Honolulu, Las Vegas, Miami, New York City, Philadelphia, San Diego, Los Angles, and others. City ...","Los Angeles, California cityNdx: 1"
"http://thenextweb.com/insider/2013/06/20/turner-broadcasting-names-the-5-startups-participating-in-its-second-sf-based-media-camp-accelerator/","Turner Media Camp Reveals The 5 Startups Joining Its SF Accelerator","Balaji Gopinath, VP of Emerging Technology for the broadcasting company says: Having graduated our first class last summer and launching Media Camp with Warner Bros. in Los Angeles this spring, we are even more poised to bring together startups and&nbsp;...","Los Angeles, California cityNdx: 1"
"http://www.stltoday.com/entertainment/arts-and-theatre/reviews/my-fair-lady-ends-summer-in-high-style/article_46199547-af02-5042-91b8-a86c1132e78d.html","'My Fair Lady' ends summer in high style","I like to think of three musicals as more than my favorites. It seems to me that they are standard bearers, shows that should be regularly staged not only because they are beautiful but because they stand as a precious reminder, to audiences and ...","Chicago, Illinois cityNdx: 2"
"http://www.futurity.org/how-the-brain-keeps-track-of-who%E2%80%99s-number-1/","How the brain keeps track of who's number 1","The study, published in the journal Neuron, provides clues as to how this information is stored in memory and also reveals that you can tell a lot about how good somebody is likely to be at judging social rank by looking at the structure of their brain ...","Chicago, Illinois cityNdx: 2"
"http://www.nature.com/news/monkey-genetics-track-social-status-1.10400","Monkey genetics track social status","At the start of the study, all the animals had a medium social rank, judged by the access they got to food, water and grooming. The researchers divided the monkeys into ten new groups, where their social ranks changed. Typically, the first animal ...","Chicago, Illinois cityNdx: 2"
"http://thenextweb.com/insider/2013/05/16/kleiner-perkins-design-fellows-program/","Kleiner Perkins Reveals Its 2013 Design Fellows Program Participants","Venture capital firm Kleiner Perkins Caufield &amp; Byers announced today the 12 college students who have been admitted into its Design Fellows program. This is the first batch for this program and each individual has been paired with one of the firm's ...","Chicago, Illinois cityNdx: 2"
"http://www.theatlantic.com/politics/archive/2012/02/studies-conservatives-are-from-mars-liberals-are-from-venus/252416/","Studies: Conservatives Are From Mars, Liberals Are From Venus","On key questions and statements in this category, liberals scored high, conservatives low: I believe peace is extremely important; Understanding, appreciation, and protection for the welfare of all people and for nature; One of the worst things a ...","Chicago, Illinois cityNdx: 2"
"http://www.stltoday.com/news/opinion/columns/kevin-horrigan/horrigan-the-fashion-forward-guy-offers-tips-on-socks-appeal/article_81f66eb3-6bec-5f8c-b940-11e4cd16a273.html","Horrigan: The Fashion-Forward guy offers tips on socks appeal","A: Garbarino writes that top-drawer Brits have long had a penchant for standout socks, brandishing them as identifiers of social rank, sporting endeavors and private club membership. The FFG ... Q: But all my friends wear the same kind of socks that ...","Chicago, Illinois cityNdx: 2"
"http://abcnews.go.com/Health/castration-men-live-longer-eunuchs-studied-korean-records/story?id=17310420","Eunuchs May Hold Key to Longevity","... a new study has found. The study of over 80 eunuchs from the Chosun Dynasty, which ruled in Korea from 1392 to 1897, looked at the world's only known record of eunuchs' lives and compared them to genealogical records of other men of similar social ...","Chicago, Illinois cityNdx: 2"
