"URL","Title","Description","Region"
"http://www.startribune.com/male-gamers-who-dis-women-online-are-biggest-losers/318437521/","Male gamers who dis women online are biggest losers, study finds","... to maintain their dominant social status, Kasumovic writes, the increase in hostility toward a woman by lower-status males may be an attempt to disregard a female's performance and suppress her disturbance on the hierarchy to retain their social ...","World wide"
"http://techcrunch.com/2015/07/16/good-st-for-teams/","Good St. Makes It Easy For Startups (And Other Businesses) To Support Charities","We obviously recognize that this is not a complete corporate or social responsibility program, Teplow said, but he suggested that it's a way to cultivate a culture of giving. Startups already using Good St. for Teams include SocialRank, Casper ...","World wide"
"http://thenextweb.com/socialmedia/2015/04/22/socialranks-instagram-analytics-are-a-secret-weapon-to-find-out-more-about-your-followers/","SocialRank's Instagram analytics are a secret weapon to find out more about ...","SocialRank is trying to help you understand who those people are and what interests them. According to the startup's CEO Alex Taub, it's working to put the 'people' piece of the puzzle back into the marketing stack. In the case of Instagram, that ...","New York, New York cityNdx: 0"
"http://thenextweb.com/socialmedia/2015/03/10/socialranks-tech-media-index-reveals-the-secrets-behind-twitter-success/","SocialRank's updated Tech Media Index reveals the secrets behind Twitter success","Social Rank's indexes let you compare the number of followers each account has, the level of engagement they receive and the number of verified followers they've notched up. annoationstechmedia. There is a significant new addition  the company's now&nbsp;...","New York, New York cityNdx: 0"
"http://www.slate.com/blogs/xx_factor/2015/07/21/new_study_shows_losing_male_gamers_attack_female_counterparts.html","Literal Losers Are More Likely to Lash Out at Female Gamers","The researchers, Michael Kasumovic of University of New South Wales and Jeffrey Kuznekoff of Miami University, found that lower-skilled players were more hostile towards a female-voiced teammate, especially when performing poorly.  Higher-skilled&nbsp;...","New York, New York cityNdx: 0"
"http://wtop.com/health/2015/07/is-bullying-genetic/","Is Bullying Genetic?","(NEW YORK)  Conventional wisdom has it that bullies are made, not born, but that might not be the case. A new Canadian study finds bullying behavior could also be genetic, linked to a genetic trait that causes some people to seek social status and ...","New York, New York cityNdx: 0"
"http://gothamist.com/2015/05/24/aggressive_parenting_wife_bonuses_p.php","Aggressive Parenting, Wife Bonuses &amp; Pill-Popping: The Weird Lives Of Upper ...","Martin became more determined when a friend's mother told her she had seen the wife of a super-famous New York comedian throw a hissy fit at Hermes until she got the Birkin she wanted. So Martin's husband agreed to buy her one: a 35-centimeter bag&nbsp;...","New York, New York cityNdx: 0"
"http://www.forbes.com/sites/alextaub/2015/07/16/trackmydown-com-adds-transparency-to-the-down-industry/","TrackMyDown.com Adds Transparency To The Down Industry","Millennials are making decisions based just as much on social responsibility and innovation as they are on quality and price. For the first time, this generation is putting equal weight on what a brand or company is doing to what they are selling ...","New York, New York cityNdx: 0"
"http://www.forbes.com/sites/alextaub/2015/06/18/major-contributor-to-open-source-technologies-julian-shapiro-pulls-back-the-curtains-on-saas-usage/","Major Contributor To Open Source Technologies, Julian Shapiro, Pulls Back the ...","Julian Shapiro is a leading web developer and a major contributor to open source technologies. He is the creator of Velocity.js, the most popular open source Web animation engine that powers the user interface animations for WhatsApp, Tumblr, Yahoo!,&nbsp;...","New York, New York cityNdx: 0"
"http://mic.com/articles/122605/female-gamers-harrassment","New Study Finds Men Who Harass Women Online Are Literally Losers","Michael Kasumovic of the University of New South Wales in Australia, and Jeffrey Kuznekoff of Miami University in Ohio hypothesized when women enter and disrupt a male-dominated hierarchy, it leads to hostile behavior from poor performing males who ...","New York, New York cityNdx: 0"
"http://www.forbes.com/sites/alextaub/2015/07/02/homepolish-is-here-to-help-you-design-your-home-or-office/","Homepolish: The Startup Turning the Interior Design Industry Upside Down","In late 2012 Will Nathan, a former tech M&amp;A investment banker-turned-BuzzFeed-coder had trouble finding a savvy, straightforward, and talented interior designer for his new Chelsea apartment. Through a friend he met Noa Santos, a Stanford-educated,&nbsp;...","New York, New York cityNdx: 0"
"http://www.heritage.org/research/reports/2015/05/poverty-and-welfare-in-the-american-founding","Poverty and Welfare in the American Founding","... in his telling, of the Founding era and after. A historian of Founding-era welfare in New York State agrees: Local communities attempted as best they could to assist their destitute neighbors, balancing compassion with economy, benevolence with ...","New York, New York cityNdx: 0"
"http://www.wsj.com/articles/the-gift-of-living-with-the-not-gifted-1428103079","The Gift of Living With the Not Gifted","But gradually the discomfort melts away, and the residents draw you into their world, unhindered by politeness or social rank. That's the point of the place: to understand what it means to be human in all its imperfect forms, and to mark human dignity ...","New York, New York cityNdx: 0"
"http://venturebeat.com/2015/07/10/and-now-for-some-personal-news/","And now for some personal news ","You are no doubt familiar with (and perhaps tired of) the farewell post, the one announcing some personal news on a choice social media platform. It is the thing that anyone who's anyone, or who thinks they are someone, writes when they leave the ...","New York, New York cityNdx: 0"
"http://www.huffingtonpost.com/jennifer-raff/the-promise-of-paleoepige_b_7627610.html","The Promise of Paleo-Epigenetics","This research is still very new but we are already finding out, for example, that nutrition, stress, and social rank can have significant phenotypic effects, and that these effects can even be passed on from parent to offspring across several ...","New York, New York cityNdx: 0"
"http://opinionator.blogs.nytimes.com/2015/02/13/dr-marcys-march/","Dr. Marcy's March","He held deep commitments to the men of the 35th but viewed slaves with a combination of paternalism and pity, and at times he showed affinity for Southerners of comparable social rank. Marcy's writings simultaneously revealed the nobility of the Union&nbsp;...","New York, New York cityNdx: 0"
"http://www.forbes.com/sites/alextaub/2015/04/16/greycork-is-cutting-out-the-middleman-and-selling-furniture-made-in-the-usa-directly-to-customers/","Greycork Is Cutting Out The Middleman And Selling Furniture Made In The USA ...","As anyone who has ever bought furniture from Ikea can attest, buying and assembling furniture is a stressful process that hasn't caught up to our more transient lifestyles. I recently moved to a new apartment in NYC and my wife and I were looking to ...","New York, New York cityNdx: 0"
"http://www.huffingtonpost.com/matthew-dennison/the-woman-behind-virginia_b_7636610.html","The Forgotten Life Of The Woman Who Inspired Virginia Woolf","It is to her credit that this only child of dysfunctional parents grew up ultimately to value not social rank but the role of the artist. For all her awareness of class, Vita longed throughout her life to be a writer. Among the defining moments of her ...","New York, New York cityNdx: 0"
"http://venturebeat.com/2014/05/13/socialrank-now-helps-you-steal-your-competitors-most-engaged-followers/","SocialRank now helps you steal your competitor's most engaged followers","The firm, which launched with two billion-dollar companies on board, has since amassed 5,000 new users. On top of its funding round, New York-based SocialRank is launching a new product which enables brands to track their competitor's most engaged&nbsp;...","New York, New York cityNdx: 0"
"http://www.futurity.org/hyenas-social-networks-922882/","Hyenas buddy up to friends of friends","Individual traits, such as sex and social rank, and environmental effects, such as the amount of rainfall and the abundance of prey, also matter, but the ability of individuals to form and maintain social bonds in triads was key. Hyenas can ... In ...","New York, New York cityNdx: 0"
"https://www.foreignaffairs.com/articles/india/2015-05-22/when-bride-be-bride-buy","When a Bride-to-Be Is a Bride to Buy","One khap told the New York Times at that time, Women maintain a family's honor. Not men. If she cannot keep her honor, it is solely her fault. With the rise in sexual violence toward women, families seek to marry girls off as soon as possible to ...","New York, New York cityNdx: 0"
"http://www.forbes.com/sites/alextaub/2015/04/30/datacapable-uses-twitter-data-to-help-utility-companies-resolve-power-outages-quickly/","DataCapable Uses Twitter Data To Help Utility Companies Resolve Power Outages ...","When faced with a power outage, most people do what is both logical and natural: immediately turn to social media. Unfortunately, most power companies don't know you've had an outage until you call them, which involves finding their number and ...","New York, New York cityNdx: 0"
"http://www.cincinnati.com/story/news/2015/05/15/vintage-fashion-revolution-old-new/27383261/","The vintage fashion revolution: what's old is new","In many societies - including America - the lower classes try to emulate the styles of wealthy, in hopes of raising their own social rank. Today, that often means imitating figures on television and film. The fashion you see on TV and movies ...","New York, New York cityNdx: 0"
"http://qz.com/409254/why-did-men-stop-wearing-high-heels-anyway/","Why did men stop wearing high heels, anyway?","Director Denis Villeneuve declared that he and actors Josh Brolin and Benicio del Toro would wear high heels to the May 19 premiere of their new movie, Sicario, in protest of the sexist, archaic dress code. during the 68th annual Cannes Film ... Del ...","New York, New York cityNdx: 0"
"http://www.adweek.com/socialtimes/the-most-and-least-engaged-brands-on-twitter/617045","Who Are The Most (and Least) Engaged Brands on Twitter?","Engagement is an increasingly important metric for determining the value of social marketing. Pageviews, user signups, and other vague metrics don't provide enough insight into how a brand, service, or network is doing. SocialRank has compiled a list ...","New York, New York cityNdx: 0"
"http://www.forbes.com/sites/alextaub/2015/02/09/audicus-cuts-out-the-middleman-and-sells-affordable-hearing-aids-directly-to-people-in-need/","Audicus Cuts Out The Middleman And Sells Affordable Hearing Aids Directly To ...","Patrick Freuler always had an interest in health care, and remained focused even when he studied aerospace engineering at MIT and in finance at McKinsey and Bain private equity. While working in private equity, Freuler did research on a large hearing ...","New York, New York cityNdx: 0"
"http://www.forbes.com/sites/alextaub/2015/02/19/campus-job-helps-college-students-get-jobs/","Campus Job Helps College Students Get Jobs","It has been a few years since I graduated from college but from what I remember in my experience, colleges don't do the best job at helping students figure out what they want to do post-college. The focus is more on what majors and courses to take, not ...","New York, New York cityNdx: 0"
"http://www.washingtontimes.com/news/2015/apr/26/book-review-american-beliefs-what-keeps-a-big-coun/?page=all","BOOK REVIEW: 'American Beliefs: What Keeps a Big Country and a Diverse People ...","This is not a new book (it came out in 1999), but it will remain fresh as long as there are readers who care about the sources of our nation's particular qualities. The author sums it up as culture, which he writes, may be thought of as a set of ...","New York, New York cityNdx: 0"
"http://www.seacoastonline.com/article/20150512/NEWS/150519708","YORK LIBRARY COL","When visitors and new patrons remark how impressive the collection is in its breadth and quality, we respond with gratitude (and a bit of pride) by saying Our donors make it all possible! Their remarkable generosity, along with that of our volunteers ...","New York, New York cityNdx: 0"
"http://www.forbes.com/sites/alextaub/2015/01/22/move-guides-helping-companies-move-employees-around-the-world/","MOVE Guides: Helping Companies Move Employees Around The World","After graduating from Yale and having spent much of her life as a national elite gymnast in the US, Brynne Herbert started her career in investment banking. She worked at Lehman Brothers and Standard Chartered Bank throughout Asia and India, and during&nbsp;...","New York, New York cityNdx: 0"
"http://blogs.artvoice.com/avdaily/2015/07/09/trend-spot-asian-flare/","Trend Spot: Asian Flare","During the Qing Dynasty (1644  1911 AD), the higher a person's social rank or the richer one was, the more embroideries and borders there were on his attires.' This summer you will see the Asian influence with these traditional styles mixed with ...","New York, New York cityNdx: 0"
"http://www.ibtimes.com.au/sore-losers-study-finds-poor-performing-male-gamers-turn-sexist-abusive-better-female-gamers-online","Sore Losers: Study Finds 'Poor-Performing' Male Gamers Turn Sexist, Abusive To ...","Gamers play Call of Duty: Modern Warfare 2, at a pre-release event held in New York November 9, 2009. Activision Blizzard Inc's hugely anticipated Call of Duty: Modern Warfare 2 video game went on sale early Tuesday morning, welcomed by eager fans&nbsp;...","New York, New York cityNdx: 0"
"http://elitedaily.com/news/study-shows-men-who-harass-women-online-losers/1131025/","Study Shows Men Who Harass Women On The Web Are Straight-Up 'Losers'","Researchers analyzed the behaviors and play patterns of 163 games of Halo 3, a team-based shooter video game. They found the most successful players  the winners, so to speak  tended to treat their female peers with kindness and respect.","New York, New York cityNdx: 0"
"https://www.commentarymagazine.com/article/the-united-states-of-diversity/","The United States of Diversity","By the time of the Revolution, they had spread throughout New England and into the eastern part of New York and had become known as Yankees. From the south of England came the Cavaliers, who had lost out during the English Civil War, .... Their ...","New York, New York cityNdx: 0"
"http://www.forbes.com/sites/alextaub/2014/12/18/mogul-is-building-a-digital-hub-for-women/","MOGUL Is Building A Digital Hub For Women","When Tiffany Pham first moved to America, she did not know a word of English. By watching films, reading books, and listening to the radio she learned how to speak the language. Thus began her appreciation of how media is a powerful tool for learning ...","New York, New York cityNdx: 0"
"http://www.rfa.org/english/news/korea/relatives-03232015172926.html","North Korean Officials, Businessmen Bankroll Poor Flight-Risk Relatives","Membership in the exclusive North Korean Workers' Party is highly sought after and provides North Koreans with opportunities for employment in public office and to rise in social rank. According to Chu, background checks on ... New York-based Human ...","New York, New York cityNdx: 0"
"http://www.virtueonline.org/christian-consideration-john-clare-english-poet-1793-1864","A Christian Consideration of John Clare - English Poet (1793 - 1864)","His first love, Mary Joyce, was denied to him as a partner, an issue of social rank, and over the years she loomed in his mind as a radiant goddess. His family grew large and he anguished over adequate provision for his wife ... The 'free will' of ...","New York, New York cityNdx: 0"
"http://www.washingtonpost.com/posteverything/wp/2015/01/30/how-sorority-culture-contributes-to-the-campus-rape-problem/","How sorority culture contributes to the campus rape problem","The escorts are determined by votes; the votes are often swayed by the groups' social rank. I once heard a sorority woman say that ... (And it's not, as The New York Times opined last week, to move the parties to sorority houses.) The solution is to ...","New York, New York cityNdx: 0"
"http://thenextweb.com/apps/2015/03/11/filta-lets-you-search-twitter-users-you-follow/","Filta lets you search Twitter users you follow","It's useful for when you're traveling to a new city and want to meet up with people there, or if you're looking to hire people of a specific discipline. Although not ... Unfortunately, Filta doesn't search people who follow you, the way SocialRank does ...","New York, New York cityNdx: 0"
"http://www.futurity.org/hyenas-telomeres-aging-874052/","Hyenas at top of social ladder live longer","This work shows, for the first time, the effects of social rank on telomere length in wild mammals, Lewin says. This enhances our understanding of how social and ecological variables may contribute to age-related declines of hyenas, and in organisms ...","New York, New York cityNdx: 0"
"http://www.dailymail.co.uk/sciencetech/article-3176023/Cockerels-follow-strict-pecking-order-dawn-calls-dominant-roosters-crow-announce-arrival-morning.html","Cockerels follow strict pecking order on dawn calls","... started to crow first, followed by its subordinates, in descending order of social rank.' Since the period of the Indus Valley Civilization (around 2600-1800BC), the 'cock-a-doodle-do' of a rooster has been seen as an announcement of the start of a ...","New York, New York cityNdx: 0"
"http://tvbythenumbers.zap2it.com/2015/03/06/amc-is-februarys-number-1-cable-network-in-adults-18-49-men-18-49-men-18-34-in-primetime/372089/","AMC is February's Number 1 Cable Network in Adults 18-49, Men 18-49 &amp; Men 18 ...","NEW YORK, NY  March 6, 2015  Thanks to strong performances by The Walking Dead, Better Call Saul and Talking Dead, AMC was the #1 cable network in primetime in several key demos  adults 18-49, adults 18-34, men 18-49 and men 18-34  in ...","New York, New York cityNdx: 0"
"http://www.telegraph.co.uk/women/womens-life/11612589/Meet-the-Manhattan-mothers-who-think-they-deserve-a-wife-bonus.html","Meet the Manhattan mothers who think they deserve a 'wife bonus'","And New York, unlike London, has a very flexible and mobile class system, so it makes sense that these women deserve a 'bonus' or an infusion of cash, because they're tirelessly working on the social rank of the couple. Of course, shades of this will ...","New York, New York cityNdx: 0"
"http://www.advocate.com/arts-entertainment/art/photography/2015/04/14/photos-becoming-visible-peru","PHOTOS: Becoming Visible in Peru","And yet, as Lima remains a classist society, the members of the 'upper' classes  particularly those established by social rank, or those embracing the obligatory silence demanded by a social standing through familial lineage  maintain a far less ...","New York, New York cityNdx: 0"
"http://thenextweb.com/twitter/2014/07/30/socialrank-now-lets-analyze-twitter-followers-based-location-keywords/","SocialRank now lets you analyze your Twitter followers based on location and ...","If the MLS is planning an exclusive event with US footballer Clint Dempsey in New York for 100 fans, SocialRank would enable it to drill down and find soccer fans in the area who are already following, or actively engage with, the MLS account on ...","New York, New York cityNdx: 0"
"http://www.huffingtonpost.com/2015/01/20/indie-lipstick-brands_n_6504286.html","The Indie Lipstick Brands You Need To Know Right Now","As beauty fanatics here at HuffPost Style, it's easy for us to name our favorite lipsticks in rapid succession. While we often name the latest colors from MAC and drugstore champion Wet N Wild, there are some lesser-known lines that make us want to ...","New York, New York cityNdx: 0"
"http://countryfancast.com/jerrod-niemann-talks-inspiration-with-his-fans/","Jerrod Niemann Talks Inspiration with his Fans!","Jerrod Niemann has recently been sharing some thoughts and fun facts about himself via YouTube, with his fans. The videos are a part of a promotion for Jam In the Valley, a three day country festival in Varysburg New York, which Jerrod will be ...","New York, New York cityNdx: 0"
"http://www.huffingtonpost.com/gursimran-sandhu/indian-divorce-mom-saved-life_b_6574426.html","When My Indian Mom Divorced My Dad, She Became an Outcast. It Also Saved Her Life.","As my mom struggled through the divorce, her career took a hit. Her new single mom status, coupled with her focus on children, made her a poor candidate for partner at her law firm. She was finally on her own but every single aspect of her life ...","New York, New York cityNdx: 0"
"http://larouchepub.com/other/2015/4219manhattan_v_va_slave_power.html","Manhattan's Struggle for Human Freedom Against the Slave Power of Virginia","Even before the inauguration of Washington, stretching back to the Constitutional Convention and earlier, the philosophy and policy of what would become this 1789 New York Administration was ruthlessly and bloodily opposed by the Slave Interests of the ...","New York, New York cityNdx: 0"
"http://www.huffingtonpost.com/2014/12/16/money-power-mental-health_n_6297946.html","The Real Connection Between Ambition And Mental Health","We're a culture that tends to define success in terms of money and power. But finding other ways to measure self-worth isn't just intrinsically worthwhile -- it could help prevent a troubling mental health diagnosis. How one views social status ...","New York, New York cityNdx: 0"
"http://globalguerrillas.typepad.com/globalguerrillas/2015/02/isis-isnt-the-problem-saudi-arabia-is.html","ISIS isn't the long term problem, Saudi Arabia is","To the politicians in DC and financiers in New York, Saudi Arabia is an island of stability in a sea of chaos. A reliable ally, willing to keep the oil flowing, year in and year out. A place that's not vulnerable to the instability that routinely guts ...","New York, New York cityNdx: 0"
"http://www.archdaily.com/585374/justin-shubow-the-profession-has-lost-its-way","Justin Shubow: The Profession Has Lost Its Way","Architecture is suffering a crisis of confidence, stated Shubow in his recent Forbes article. It is never easy to admit that one is mistaken, still worse that one's god has failed. It is all the harder when one's false worldview has been the ...","New York, New York cityNdx: 0"
"http://countryfancast.com/fantastic-news-trisha-yearwood/","Fantastic News for Trisha Yearwood!!","Trisha Yearwood's third cookbook is being met with praise as it lands itself on the New York Times Bestsellers List. The book takes a turn toward the healthy with recipes that highlight her balanced lifestyle between indulgence and discipline without ...","New York, New York cityNdx: 0"
"http://www.livescience.com/48912-hammerhead-shark-migration.html","Map of Endangered Shark's Wanderings Could Aid Conservation","A young hammerhead's 10.5-month journey through the Gulf of California reveals that the endangered shark often swam outside of protected areas, according to a new research that suggests key areas where protection could help the species survive.","New York, New York cityNdx: 0"
"https://reason.com/archives/2015/05/20/reason-roundtable-reform-conservatism-fr","Reason Roundtable: Is Reform Conservatism a Friend or Foe of Limited Government?","... are competent to run the mediating corporate-government institutions Mr. Levin recommends. Requiring vows of asceticism as a condition of social rank is not new. .... Editorial &amp; Production Offices. 5737 Mesmer Ave. Los Angeles, CA 90230 (310) 391 ...","Los Angeles, California cityNdx: 1"
"http://phys.org/news/2015-06-daddy-youre-gorilla-doesnt.html","Who's your daddy? If you're a gorilla, it doesn't matter","The authors of the study, from the University of California, Los Angeles (UCLA) - now with Lincoln Park Zoo in Chicago - the Dian Fossey Gorilla Fund International (Atlanta USA) and the Max Planck Institute for Evolutionary Anthropology (Leipzig ...","Los Angeles, California cityNdx: 1"
"http://au.idigitaltimes.com/study-men-who-harass-women-online-are-mostly-losers-103934","Study: Men Who Harass Women Online Are Mostly Losers","... rely on aggression to maintain their dominant social status, the increase in hostility towards a woman by lower-status males may be an attempt to disregard a female's performance and suppress her disturbance on the hierarchy to retain their social ...","Los Angeles, California cityNdx: 1"
"http://www.dailymail.co.uk/femail/article-2990862/Bad-news-man-new-book-brain-doctor-reveals-baby-blues-useful-moody-good-you.html","In a new book says baby blues can be useful and being moody is good for you","This means we're programmed, regardless of our own wealth, to seek out men with money, power and social rank and who will share it  in other words, those with resources who'll stick around to help with child-rearing. But even more powerful is the&nbsp;...","Los Angeles, California cityNdx: 1"
