"URL","Title","Description","Region"
"http://www.huffingtonpost.com/paul-spector-md/point-and-shoot-the-antis_b_8125224.html","Point and Shoot: The Antisocial Media","Similarly, in medieval times there was no self apart from the social rank and role assigned by God as birth rite. Family and gender defined destiny. The son of a blacksmith would be a blacksmith. It was unthinkable that he would aspire to anything else.","World wide"
"http://www.deccanherald.com/content/500949/hyenas-their-own-facebook-algorithm.html","Hyenas and their own Facebook algorithm ability","Scientists remark that although there are other factors such as sex, the social rank and environment effects like amount of rainfall that influence their social structure, the triadic closure is the most important. In hyenas, female members are ...","World wide"
"http://allafrica.com/stories/201509141928.html","Afrikaans Must Not Fall","Binding together government and citizen within one public legal order disregards ethnic differences, racial differences, religious differences, language differences, differences in economic position and social rank, family differences and differences ...","World wide"
"http://www.fastcompany.com/3045199/tech-forecast/most-valuable-followers-how-socialrank-wants-your-brand-to-get-closer-to-its-a","Most Valuable Followers: How SocialRank Wants Your Brand To Get Closer To Its ...","Your Internet megaphone calls out to everyonebut you have no idea who you are talking to. Sure, you could inspect your followers' Twitter bios by hand, or even take a sample size and extrapolate. But this is the age of Big Data. All the information ...","World wide"
"http://www.broadwayworld.com/chicago/article/Savoyaires-Present-Gilbert-Sullivans-HMS-PINAFORE-20150912","Savoyaires Present Gilbert &amp; Sullivan's H.M.S. PINAFORE","A hilarious satire of society's perennial obsessions with class divisions and social rank, H.M.S Pinafore is subtitled The Lass That Loved a Sailor. The lass -- Josephine, daughter of the high-born captain of the H.M.S. Pinafore -- is engaged to ...","World wide"
"http://techcrunch.com/2015/01/13/socialrank-index/","The SocialRank Index Shows Companies How They Stack Up On Social Media","Social media analytics startup SocialRank released a new tool earlier today called the SocialRank Index  aimed at tracking and aggregating the performance of the biggest brands in the world. This seems like a natural evolution of SocialRank, which ...","World wide"
"http://www.billboard.com/articles/business/6495121/socialrank-data-metrics-startup-launches-snapshot-music-index","SocialRank, Data Metrics Startup, Launches Snapshot Music Index","SocialRank, a relatively new social data metrics company that analyzes Twitter accounts to provide easily digestible insights into its followers and engagement rates, today launched its Music Index, inspired by the Billboard 200 albums chart. Using ...","World wide"
"http://www.livescience.com/52028-animal-sex-hyenas.html","Animal Sex: How Hyenas Do It","Since males can only gain in rank after a higher-ranking male dies (they do not fight for rank), females may use their social rank as a kind of index for persistence and fitness, Gunther said. Mating among spotted hyenas doesn't coincide with specific ...","World wide"
"http://www.businessinsider.com/socialrank-index-proves-tech-media-rules-twitter-2015-1","Here's Proof That Tech Media Rules Twitter","Last week, social analytics company SocialRank released a Global Brands Index that charts the success of major corporate brands on Twitter. The index displays engagement data, competitor tracking, and calculates the quality of a brand's followers.","World wide"
"https://student.societyforscience.org/article/top-rooster-announces-dawn","Top rooster announces the dawn","social order or social rank The system of values, practices, institutions and rules that guide the behaviors of an integrated group of people or animals. subordinate Someone or something that is lower in rank, based on power, importance, value or some ...","World wide"
"http://foreignpolicy.com/2015/08/20/10-best-books-about-how-the-plains-indians-adapted-their-mode-of-warfare-2/","10 best books about how the Plains Indians adapted their mode of warfare","Mishkin focused on the Kiowa, showing how the horse altered social rank and warfare. Colin G. Calloway, One Vast Winter Count: The Native American West before Lewis and Clark (Nebraska, 2003). I am a 'big picture' guy when it comes to history; for me ...","World wide"
"http://www.huffingtonpost.com/loren-ridinger/instagram-marketing-in-20_b_7991118.html","Instagram Marketing in 2016 -- 10 Tools for Instagram You Need Now!","Social Rank is another Instagram analytics platform worth investigating. Find details on your followers based upon their location or their engagement rate. Sort followers according to activities they're interested in or whether they have a verified ...","World wide"
"http://www.bustle.com/articles/107702-honest-puberty-video-from-the-huffington-post-nails-what-you-thought-puberty-would-be-like-versus","Honest Puberty Video From The Huffington Post Nails What You Thought Puberty ...","Hello, tweens and ex-tweens! Since the moment your mom gave you a book about your changing body in lieu of actually telling you how to pronounce menstruation, you probably had a weird idea about what to expect from puberty. You might have put the&nbsp;...","World wide"
"http://pressnetwork.de/tag/social-rank/","Social Rank .","bildet die Position einer gewhlten Domain in der Rangfolge aller Domains gemessen an Signalen aus sozialen Netzwerken fr das entsprechende Land ab. Hat zum Beispiel eine Domain einen Social Rank von 2, bedeutet dies, dass die Domain im&nbsp;...","World wide"
"http://www.bustle.com/articles/95139-5-crazy-ancient-shoe-trends-that-wont-be-inspiring-your-style-anytime-soon","5 Crazy Ancient Shoe Trends That Won't Be Inspiring Your Style Anytime Soon","Today, our shoe choices are as endless as they are (sometimes) practical, but throughout history we've had to keep our toes covered based on social rank and available materials. While we often turn to the past for fashion inspiration (looking at you ...","World wide"
"http://thenextweb.com/twitter/2015/01/22/social-ranks-tech-startup-index-reveals-social-secrets-worlds-valuable-startups/","SocialRank's Tech Startup Index reveals the social secrets of the world's most ...","The latest index tracks 86 companies. It's based on a list of the world's most valuable startups published by Fred Wilson, Willaim Mougayar and the Wall Street Journal. SocialRank filtered the index based on three criteria to include privately-owned ...","World wide"
"http://www.patheos.com/blogs/christiancrier/2015/08/21/what-is-a-concubine-why-was-this-allowed-in-the-old-testament/","What Is A Concubine? Why Was This Allowed In The Old Testament?","The reasons can greatly vary like the person's religious beliefs, they are already married, a social rank status that prohibits their marrying, or even a recognition by others that restricts their marrying. Concubines typically had no rights, even with ...","World wide"
"https://nowtoronto.com/stage/theatre/review-pygmalion/","Review: Pygmalion","In this modern London, the haves and have-nots are as sharply divided as in Shaw's original tale written a century ago, though now they're as much distinguished by race as by social rank. A BBC video during the first scene change, in fact, discusses ...","World wide"
"http://thesheridanpress.com/?p=40879","Celebrate women who serve","Some will argue that men compete in front of women to gain affection or social rank, which could lead to unnecessary risks being taken by soldiers. There will be others who argue that integrating women into the combat ranks will only lead to increases ...","World wide"
"http://koreajoongangdaily.joins.com/news/article/article.aspx?aid=3008856&amp;cloc=etc%7Cjad%7Cgooglenews","A long way to go","About 84 percent of the rich with assets of more than 1 trillion won inherited their good fortune compared with 33 percent among Americans and 12 percent among Japanese, suggesting this country is where riches and social rank are exclusive to a ...","World wide"
"http://www.livemint.com/Companies/Vd0jQszgCUQ7sErG3PHp7H/Unethical-behaviour-of-senior-staff-tells-on-groups-image.html","Unethical behaviour of senior staff tells on group's image","... professor of organizational behaviour and psychology, and graduate research student Takuya Sawaoka, highlight how the social rank of someone who commits moral transgressions affects associated individuals, and they term this the moral spillover effect.","World wide"
"http://thenextweb.com/socialmedia/2015/02/25/socialrank-is-launching-instagram-follower-analytics-and-you-can-get-early-access/","SocialRank is launching Instagram follower analytics and you can get early access","Alex Taub, SocialRank's co-founder, told us the company's aim is become the Hootsuite or Buffer for followers and that it will roll out more tools for understanding your audience on a range of other social sites soon. You can find out more about the ...","World wide"
"http://thenextweb.com/insider/2014/02/25/modern-mast-launches-socialrank-help-find-valuable-engaged-best-twitter-followers/","SocialRank Helps Find Brands' Best Twitter Follower","The idea behind SocialRank started long before Taub and Schonfeld joined Dwolla. Back then, they had developed a service called Most Valuable Follower (MVF) aimed at helping show which follower actually gives legitimate value to a brand's social media&nbsp;...","World wide"
"http://tech.co/socialrank-2-0-launches-simple-free-platform-brands-learn-manage-followers-2014-07","SocialRank 2.0 Launches as a Simple, Free Platform for Brands to Learn About ...","First launched in February of this year, SocialRank  a simple (and free) tool that allows brands to learn who their most valuable followers are  announced today that it has launched SocialRank 2.0, a more comprehensive version of its initial product.","World wide"
"http://www.hollywoodreporter.com/news/media-investors-back-twitter-analytics-703529","Media Investors Back Twitter Analytics Startup SocialRank","Twitter analytics startup SocialRank is getting the support of some big media backers. The New York firm announced on its blog that it has raised more than $1 million in seed funding from investors that include Shari Redstone's Advancit Capital (which ...","World wide"
"http://venturebeat.com/2014/03/21/this-company-wants-to-build-a-klout-thats-actually-valuable/","This company wants to build a Klout that's actually valuable","And yet, the end goals of Klout and SocialRank are quite similar: SocialRank's long term goal, Taub shares, is to build a platform for brands and individuals to communicate. Klout's original goal was to bring influencers and brands together via ...","World wide"
"https://gigaom.com/2014/04/17/two-months-in-twitter-data-miner-socialrank-introduces-analytics-dashboard/","Two months in, Twitter data miner SocialRank introduces Analytics Dashboard","Twitter analytics are a difficult game  earlier this week, Twitter bought data reseller Gnip to gain access to its massive firehose of data. Perhaps that's why the initial success of SocialRank, a two-month old startup created by former Dwolla ...","World wide"
"http://www.fredzone.org/socialrank-tout-pour-analyser-son-compte-twitter-039","SocialRank : tout pour analyser son compte Twitter","Twitter propose un outil de statistiques relativement complet qui permet de prendre un peu de recul sur l'activit associe  son compte, mais il existe aussi pas mal de services web spcialiss. SocialRank fait partie de ces derniers, bien sr, et il ...","World wide"
"http://www.valuewalk.com/2014/02/most-valuable-twitter-follower/","Who's Your Most Valuable Twitter Follower? Find Out With 'SocialRank'","SocialRank helps marketers identify three types of follower: most valuable, most engaged, and their best follower. In order to determine the most valuable follower status, the site uses an algorithm that considers, among other items, the total follower ...","World wide"
"http://www.blogdumoderateur.com/socialrank-analyse-twitter/","SocialRank : analyser son compte Twitter et reprer les followers importants","Si vous tes  la recherche d'un autre outil pour analyser vos followers, vous pourriez tre intress par SocialRank. En quelques clics, on obtient le classement de nos followers les plus importants et les plus engags. Des statistiques lies  l ...","World wide"
"http://venturebeat.com/2015/01/15/heres-a-breakdown-of-the-worlds-biggest-tech-brands-on-twitter/","Here's a breakdown of the world's biggest tech brands on Twitter","SocialRank is a startup hell-bent on helping brands keep tabs on their most valuable fans. But, with the recent launch of the SocialRank Index, the company now enables social media-wise brands to see how they stack up to the competition. To do this ...","World wide"
"http://www.businessinsider.com/social-media-bubble-2015-6","We are in the middle of a giant social media bubble","For the past 10 years brands have been building massive audiences on social media networks ranging from Facebook, Twitter, Instagram, Pinterest, Tumblr, Snapchat, and more. Brands have collectively spent billions to build these audiences, with mostly ...","World wide"
"http://www.bbc.co.uk/news/science-environment-17663133","Social rank 'linked to immunity'","A study of rhesus macaque monkeys may have solved a long-standing puzzle on a link between social rank and health. A study of 10 social groups of macaque females showed that the activity level of an individual's immune genes was an accurate predictor&nbsp;...","World wide"
"http://www.refinery29.com/2014/04/66828/socialrank-twitter-verified-followers","Are You A Big Deal On Twitter? Here's How To Find Out","Earlier this year, we told you about SocialRank, the brand new start-up from Alex Taub and Michael Schonfeld, whose goal it was to help you rank your most valuable and engaged Twitter followers based on some very specific data. Brands in particular&nbsp;...","World wide"
"http://wwwhatsnew.com/2015/04/22/socialrank-ya-nos-permite-analizar-y-encontrar-a-nuestros-mejores-seguidores-en-instagram/","SocialRank ya nos permite analizar y encontrar a nuestros mejores seguidores en Instagram","Hasta ahora SocialRank nos serva para encontrar a los seguidores de Twitter ms influentes, una funcin que se ampla ahora a instagram. Despus de identificarnos con nuestra cuenta, tendremos que esperar algunos minutos para que el sistema analice&nbsp;...","World wide"
"http://wwwhatsnew.com/2015/02/25/socialrank-presente-su-nueva-herramienta-de-analitica-de-seguidores-para-instagram/","SocialRank presenta su nueva herramienta de analticas de seguidores para Instagram","SocialRank quiere convertirse en una plataforma centralizada para facilitar la comprensin y el conocimiento sobre los propios seguidores de los que se disponen a travs de las conocidas plataformas sociales, siendo por ello por lo que acaban de ...","World wide"
"http://tech.qq.com/a/20150311/008634.htm","SocialRank","SocialRank1，（Tech Start Up Index），Instagram ，SocialRank ...","World wide"
"http://qz.com/471064/marc-andreessen-has-become-a-benchmark-for-building-an-influential-twitter-following/","Marc Andreessen has become a benchmark for building an influential Twitter ...","Noticing this pattern, the company got Andreessen's OK to make @pmarca the default account on SocialRank to demonstrate a new feature called Market Intel, which lets users drill down on a Twitter account's followers by location, bio keywords, and ...","World wide"
"http://news.nationalpost.com/health/provocative-new-study-finds-bullies-have-highest-self-esteem-social-status-lowest-rates-of-depression","Provocative new study finds bullies have highest self esteem, social status ...","A just-published Canadian study has added heft to a provocative new theory about bullying: that the behaviour is literally in the genes, an inherited trait that actually helps build social rank and sex appeal. If accepted, the hypothesis rooted in ...","World wide"
"http://news.nationalgeographic.com/2015/08/150808-animals-bonobos-apes-evolution-speech","Bonobo Baby Talk Reveals Roots of Human Language","Males stay with their mothers and share her social rank. (See a graphic of how bonobos are related to us.) That means little Luke, so adorably nestled in his mom's arms, will be a mama's boy for life. Weird Animal Question of the Week answers your ...","World wide"
"http://www.newyorker.com/magazine/2015/07/20/the-sensualist-books-buruma","The Sensualist","Quite literally so: the proper approach to a desired lady was through poems, written on scented paper of the finest quality, delivered by an elegantly dressed go-between of appropriate social rank. More poems would be exchanged as soon as the approach&nbsp;...","World wide"
"http://www.forbes.com/sites/alextaub/2015/07/30/meet-blade-the-startup-that-is-cornering-the-short-distance-aviation-market/","Meet BLADE, The Startup That Is Cornering The Short-Distance Aviation Market","Booking a short flight used to require multiple phone calls, faxing your credit card, and a lot of headache. Granted you first needed to be able to afford it, but booking helicopters- short-distance aviation- was something only accessible to the 1% of ...","World wide"
"http://www.stltoday.com/entertainment/arts-and-theatre/hats-reveal-characters-social-rank-in-my-fair-lady/article_e9425de9-cced-529d-bef1-25805c4672f9.html","Hats reveal characters' social rank in 'My Fair Lady'","The last time that Dorothy Marshall Englis designed the costumes for a production of My Fair Lady at Stages St. Louis, in 1998, I was a little more nave, she says. She and the director, Michael Hamilton, were younger, and our resources were more ...","World wide"
"http://time.com/3965630/men-attack-women-online-losers/","Study Finds That Men Who Attack Women Online Are, Literally, Losers","... to maintain their dominant social status, the increase in hostility towards a woman by lower-status males may be an attempt to disregard a female's performance and suppress her disturbance on the hierarchy to retain their social rank, researchers ...","World wide"
"http://www.today.com/parents/study-bullies-have-higher-self-esteem-social-status-lower-levels-t36271","Study: Bullies have higher self-esteem, social status and lower levels of ...","The study found that bullies enjoy better mental health than the other groups, but whether that is because of the behavior itself or the result of being put in a higher social rank by being a bully is unclear. Research by Wong has found that while ...","World wide"
"http://www.rollingstone.com/tv/news/watch-judd-apatow-skewer-bill-cosby-with-perfect-impression-20150721","Watch Judd Apatow Skewer Bill Cosby With Perfect Impression","Trainwreck director Judd Apatow visited The Tonight Show Starring Jimmy Fallon Monday night to do something he hadn't done in roughly 23 years: Perform stand-up. For the first time since he was 24, Apatow went onstage to do four minutes of comedy, and&nbsp;...","World wide"
"http://news.sciencemag.org/evolution/2015/06/signs-democracy-seen-typically-authoritarian-baboon-society","Signs of democracy seen in typically authoritarian baboon society","But when choosing where to travel, a baboon's social rank or sex is irrelevant, perhaps because the decision affects the entire group. The scientists teased apart the animals' decision-making process by trapping and fitting GPS collars on 25 baboons ...","World wide"
"http://www.wsj.com/articles/barton-swaim-1438359673","Barton Swaim","The entry for class similarly illustrates why the word is both endlessly useful and dangerously vague: It's rarely clear if those who use itmiddle class, working classmean a definable economic category, a relative social rank, a self ...","World wide"
"http://www.forbes.com/sites/drewhendricks/2015/04/23/5-social-and-ad-tech-superstars-making-it-big/","5 Social and Ad Tech Superstars Making It Big","SocialRank is a way to understand and organize your followers based on their varying levels of importance. You simply connect your company's social media accounts to SocialRank and it will scan through them, categorizing your followers and showing who&nbsp;...","World wide"
"http://www.practicalecommerce.com/articles/88626-27-Free-Twitter-Tools-for-Small-Businesses","27 Free Twitter Tools for Small Businesses","SocialRank. SocialRank is a tool to identify, organize, and manage your followers on Twitter and Instagram. Sort your followers by most valuable, most engaged, best followers, most followed followers, and alphabetized. Create custom lists of your ...","World wide"
"http://www.upenn.edu/pennnews/news/making-friends-friends-benefits-hyenas-penn-biologist-finds","Making Friends of Friends Benefits Hyenas, Penn Biologist Finds","Individual traits, such as sex and social rank, and environmental effects, such as the amount of rainfall and the abundance of prey, also matter, but the ability of individuals to form and maintain social bonds in triads was key, according to the study ...","World wide"
"http://opinionator.blogs.nytimes.com/2015/04/27/reclaiming-the-power-of-play/","Reclaiming the Power of Play","First, the human psyche has the form of a camel because it takes on the heavy burden of cultural duties  ethical obligations, social rank, and the weight of tradition. Next, the camel transforms into a lion, which represents the rebellion of the ...","World wide"
"http://www.theguardian.com/music/tomserviceblog/2015/jun/09/beethoven-african-roots-beethoven-was-black","Does Beethoven's music reveal his African roots?","A new album by the group Beethoven Was African aims to prove that the polyrhythms of the composer's music point to west African heritage. But does their quest open up a more important debate in classical music? A new album by the mysterious group&nbsp;...","World wide"
"http://www.bustle.com/articles/98718-men-who-harass-women-online-are-literally-losers-study-finds-plus-4-other-examples-that-prove","Men Who Harass Women Online Are Literally Losers, Study Finds, Plus 4 Other ...","... to maintain their dominant social status, the increase in hostility towards a woman by lower-status males may be an attempt to disregard a female's performance and suppress her disturbance on the hierarchy to retain their social rank, researchers ...","World wide"
"http://www.medicaldaily.com/bullies-have-high-self-esteem-and-sex-appeal-and-they-can-thank-their-genes-345048","Bullies Have High Self-Esteem And Sex Appeal, And They Can Thank Their Genes","Their new study suggests the behavior is not only genetic  that is, biologically hard-wired  it is also helpful in building social rank and sex appeal. The new theory has one foot resting on the tenets of evolutionary psychology and the other on ...","World wide"
"http://www.entrepreneur.com/article/248217","2 Immigrant Entrepreneurs Who Prove the American Dream Endures","Immigrant entrepreneurs are valuable contributors to our communities and to the world. We create jobs, innovate and improve the quality of life for others along the way. Louis Krubich and Robert Haidari are examples of how immigrants can achieve the&nbsp;...","World wide"
"http://www.ft.com/cms/s/0/e9f2300e-3bae-11e5-8613-07d16aad2152.html","Costa Rica's good life Simon Kuper","Almost every Costa Rican village has a football field: grassy, perfect and state-funded. Anyone can use it. Visiting the country last month, I saw boys, girls, middle-aged women and dogs chasing balls around, while chickens pecked among them. All these&nbsp;...","World wide"
"http://news.discovery.com/animals/roosters-crow-in-pecking-order-by-seniority-150723.htm","Roosters Crow in Pecking Order by Seniority","The top-ranking rooster always started to crow first, followed by its subordinates, in descending order of social rank, wrote the Japanese authors of the study. When the top-ranking rooster was physically removed from a group, the second-ranking ...","World wide"
"http://www.forbes.com/sites/alextaub/2015/05/19/looking-to-energize-your-alumni-base-alumnifire-is-here-to-help/","Looking To Energize Your Alumni Base? Alumnifire Is Here To Help","How active are you with your alma mater? For most alumni, the answer is not very. Alumnifire is working to fix that. Alumnifire is a free networking platform for all organizations (from universities to hobby groups to incubator programs) that unlocks ...","World wide"
"http://www.entrepreneur.com/article/248399","As Your Startup Grows You Have More Explaining to Do","One of the most exciting points in any entrepreneurial endeavor is the moment when you have secured outside funding. It's the ultimate validation: someone else believes your idea will work. To get to that point, you've already fine-tuned your business ...","World wide"
"http://flavorwire.com/527875/how-clueless-illuminates-the-timeless-genius-of-austens-emma","How 'Clueless' Illuminates the Timeless Genius of Jane Austen's 'Emma'","... actually has more real-world chops than her self-appointed life coach, Cher Horowitz, most everyone in Austen's Highbury has seen more of existence than Emma has  but they defer to her because of this handsome, clever and rich woman's social ...","World wide"
"http://fusion.net/story/175225/bullies-confidence-depression-study/","Study finds bullies are less depressed, more popular","These findings suggest that being a bully promotes better mental health, whether it is through the bullying behaviors themselves, or as a corollary of being a bully (i.e., being placed higher in the social rank), write the authors in the study. The ...","World wide"
