"URL","Title","Description","Region"
"http://www.brw.com.au/p/leadership/leadership_masterclass_things_you_xc3gXPRUPlLGooEt2nq1EJ","Leadership masterclass: 10 things you need to know to be a better leader","Telstra director Steve Vamos discovered that sometimes, having expertise in an industry can distract leaders from getting the best out of their people. Photo: Rob Homer. Today's leaders were schooled for a different era. One where the pace was slower.","San Diego, California cityNdx: 7"
"http://www.smartcompany.com.au/growth/41822-tech-company-altium-joins-the-offshore-withdrawal.html","Tech company Altium joins the offshore withdrawal","Altium announced overnight its plans to move its operations to San Diego, California in an effort to make it more accessible to its customers and partners. This move to the US will not only allow Altium to be closer to customers in key markets ...","San Diego, California cityNdx: 7"
"http://mobilemarketingmagazine.com/qualcomm-banks-223bn-profit-494bn-revenues/","Qualcomm Banks $2.23bn Profit on $4.94bn in Revenues","The San Diego-based company shipped 152m MSM (Mobile Station Modern) chips during the quarter, representing a 29 per cent increase from the year prior and a 3 per cent from last quarter. During the quarter Qualcomm estimates anywhere from 239 to&nbsp;...","San Diego, California cityNdx: 7"
"http://www.brw.com.au/p/tech-gadgets/the_customer_comes_first_why_crm_CwATHNJjCc3UPf1cIoaN5I","The customer comes first: Why 'CRM' now seems out of place","An ever-increasing number of businesses are reinventing the way they interact with customers by leveraging the investment they have made in marketing technology software. The proliferation of social media and advances in ad tech and big data ...","San Diego, California cityNdx: 7"
"http://www.brw.com.au/p/entrepreneurs/gelatissimo_brothers_taste_sweet_VbN10jzNOUDOOmAgw8slyL","Gelatissimo brothers taste sweet success","Finding the right franchisee is crucial and the brothers Domenico (left) and Marco Lopresti go through an extensive vetting process, including psychometric testing. Photo: Rob Homer. Australian franchise Gelatissimo has opened its seventh gelateria in ...","San Diego, California cityNdx: 7"
"http://blogs.crikey.com.au/planetalking/2013/10/10/collision-prevention-system-failed-on-qantas-a330-in-near-hit/","Collision prevention system failed on Qantas A330 in 'near hit'","However in a detailed and illustrated update on its inquiry the ATSB makes it clear that this was not of itself the cause of the incident and that the full functionality of the TCAS system on the Qantas jet flying in the opposite direction and other ...","San Diego, California cityNdx: 7"
"http://elpais.com/elpais/2014/10/28/ciencia/1414513480_785507.html","Aviso: escuchar esta cancin podra matarte","En realidad, segn subraya Stack, la supuesta asociacin de ciertas obras con el suicidio no es algo nuevo. En una revisin publicada en 2012 en la revista ... gran fbrica de rumores. Un artculo afirma que una versin dulcificada de la cancin, a la ...","San Diego, California cityNdx: 7"
"http://www.brw.com.au/p/tech-gadgets/meet_aussie_start_ups_riding_the_xK9otAgA8oQSobrv57cBeP","Meet 10 Aussie start-ups riding the boom in wearable technology","Spurred on by consumer appetite for sports, health and wellbeing services, Australian start-ups are riding a wave of excitement in wearable technologies that promise to be the next great mobile evolution. It's no coincidence the AFL is the world's most&nbsp;...","Dallas, Texas cityNdx: 8"
"http://www.brw.com.au/p/tech-gadgets/catapault_sports_series_google_analytics_o9PQwXU9fINahIsJdt5S2H","Catapult Sports is 'Google analytics for athletes': wearable technology start ...","Think of Catapult Sports as a start-up a decade in the making because the pioneer of wearable analytics devices for professional sports is reimagining itself as a global, mainstream brand. With recent high-profile investors onboard, the company that ...","Dallas, Texas cityNdx: 8"
"http://www.brw.com.au/p/business/mid-market/end_of_uncertainty_pronto_picks_C7EimlzaHxutniopi4KNAP","End of uncertainty: Pronto picks a post-election win","In the past year, Pronto has opened three new branches in Perth, Adelaide and Dallas, Texas in the United States. It has also doubled the floor space of its research and development centre in Melbourne and launched a new R&amp;D group in Sri Lanka focused&nbsp;...","Dallas, Texas cityNdx: 8"
"http://www.brw.com.au/p/sections/fyi/take_peek_into_the_future_of_retail_ige7knWS62DD5szLpWLEsJ","Take a peek into the future of retail","To take a peek into the future of retail, you could take a flight to Dallas, Texas. That's where JCPenney has opened its remodeled prototype department store, the creation of the retailers' new chief executive Ron Johnson  the former head of Apple's ...","Dallas, Texas cityNdx: 8"
"http://www.brw.com.au/p/tech-gadgets/inside_amazon_robot_human_experiment_0tgLj4mR0MtFuxkT54k4hP","Inside Amazon's robot-human experiment","Fetch Robotics, based in San Jose, California, is developing a robot designed to retrieve products from shelves in a warehouse that was not designed for robots. Amazon's robots may indeed be just the first of many more collaborative robots. I think ...","San Jose, California cityNdx: 9"
"http://www.brw.com.au/p/tech-gadgets/health_tech_investments_hot_google_rmnzJtlpGFGq60NGPzJ1sO","Health tech is hot: Google, Apple lead record six months for investments","IBM has studied public health data at its San Jose research lab. Now, major tech ... on that, too. Mountain View, California, startup TrueVault makes software that helps app developers meet privacy and security standards required by federal health law.","San Jose, California cityNdx: 9"
"http://www.brw.com.au/p/brw-lounge/bitcoin_buyers_fashionable_bitfash_BSdOJrl3KlXUdg0kn5AusN","Bitcoin gets fashionable: Bitfash wants to connect labels like Zara to Bitcoin ...","But this week Bitfash has a zero transaction fee sale in the leadup to the annual bitcoin conference being held on May 17 in San Jose, California. Bitfash co-founder Keyur Kelkar says their idea sprung from the problem that there are a lot of people ...","San Jose, California cityNdx: 9"
"http://www.brw.com.au/p/sections/fyi/apple_confirms_october_event_is_Msjk7Nj0FOynLqHMaCJYFJ","Apple confirms October 23 event. Is it the iPad mini?","Declares CNN: One of the worst-kept secrets in tech has been confirmed: Apple will hold an event on October 23 in San Jose, California, at which the company is widely expect to unveil a smaller, cheaper version of its popular iPad. The release of the&nbsp;...","San Jose, California cityNdx: 9"