"URL","Title","Description","Region"
"http://www.upressonline.com/2015/09/yik-yak-threat-student-speaks-on-controversy/","Yik Yak threat student speaks on controversy","The UP reached out to accused student Emeil Stewart regarding his situation Wednesday evening after police held a news conference and released the police report on the Yik Yak threat case. I didn't want to start the uproar I did, said Stewart about ...","World wide"
"http://www.abcactionnews.com/news/the-app-yik-yak-facing-criticism-after-two-threats-in-less-than-a-month","The app Yik Yak facing criticism after two threats in less than a month","Right now we're looking into a threat of a shooting on a South Florida college campus made by a student through the social media app Yik Yak. Florida Atlantic University students saw the message before it disappeared, saying the man threatened to open ...","World wide"
"http://www.theshorthorn.com/news/student-sells-yik-yak-inspired-t-shirts/article_ce2a082a-5746-11e5-b8cd-ebf85a96fc43.html","Student sells Yik Yak-inspired T-shirts","The term 'stay vigilant' started trending on Yik Yak, an app that allows students to see anonymous posts within a five-mile radius, last week. The term came from MavAlert emails, text messages and posted crime bulletins from UTA Police about the ...","World wide"
"http://www.purdueexponent.org/opinion/article_73e41f70-e519-51f3-8e22-13116b18bd67.html","Yik Yak is not your personal counselor","Yet, more vexing than Sunday's late afternoon low-grade acid trip are those poor souls who seem to have mistaken Yik Yak as a valid substitution for group therapy and relationship counseling. Don't get me wrong, Yik Yak is a beautiful and wonderful thing.","World wide"
"http://www.uloop.com/news/view.php/170372/quotYik-Yakquot-A-Place-to-be-Anonymous-in-Co","Yik Yak: A Place to be Anonymous in College","There is a lot to be found within the confines of the anonymous app Yik Yak. With people able to say whatever they want without any other users knowing the person behind the post, many words are written. Sometimes these words are trivial, such as when&nbsp;...","World wide"
"http://www.usforacle.com/news/view.php/1010446/Anonymous-Yik-Yak-post-implies-threat-ag","Anonymous Yik Yak post implies threat against USF","While many USF students use Yik Yak to inform others of events on campus, post jokes and anonymously complain about teachers, the app was recently used for a much more concerning purpose. A user of the anonymous posting social media app made a&nbsp;...","World wide"
"http://ndsmcobserver.com/2015/09/catholic-yik-yak/","A Catholic Yik Yak","Well, on one level, the feature of the app that allows users to post anonymous prayer intentions that can be up-voted by other users resembles the general Yik-Yak interface. However, while Yik Yak tends to degenerate into insensitive remarks that ...","World wide"
"http://dailytrojan.com/2015/08/19/new-photo-feature-could-allow-positive-evolution-for-yik-yak/","New photo feature could allow positive evolution for Yik Yak","Popular anonymous messaging app Yik Yak has been called many things  chief among them inflammatory, disgusting and downright racist. Certainly, the anonymity of the app has created an odd mixture of humorous-meets-hurtful that can isolate&nbsp;...","World wide"
"http://www.csusignal.com/news/article_ca3eeba5-fb70-5f6c-9c84-20ef1b8fabf5.html","Yik Yak misuse leads to questions of anonymity","The New York Times published an article on March 8 surrounding the failed attempt of Eastern Michigan University to find the students responsible for harassment against a professor through Yik Yak. According to the Times, in 2013 several posts were&nbsp;...","World wide"
"http://www.ibtimes.com/tinder-college-app-friendsy-helps-100000-students-hook-friend-or-date-2067544","Tinder-For-College App Friendsy Helps 100000 Students Hook Up, Friend Or Date","Friendsy's growth follows a trajectory similar to that of Yik Yak, and cofounder Pinsky is not shy about admitting it. Yik Yak, launched in 2013, first expanded to 40 campuses as well and has since grown to more than 2 million users, as of January 2015.","World wide"
"http://www.dailyeasternnews.com/2015/08/24/editorial-cyber-bullying-sexism-dilutes-social-media/","Editorial: Cyber bullying, sexism dilutes social media","Deciding to relax for a bit and eating my supper of animal crackers, I decided to get back on social media. After checking Facebook, Instagram, and Snapchat I decided that I was bored enough to pull up Yik Yak. It had your usual complaints: The ...","World wide"
"https://www.michigandaily.com/section/news/greek-life-responds-meeting","Greek life members disappointed by meeting's structure","Many agreed with Krupiak's statement and did not support the disrespect of the few who were disrupting the speeches with their outbursts of coughing organized over Yik Yak. One member of Greek life told the Daily Krupiak's assertion at the end of the ...","World wide"
"http://www.gwhatchet.com/2015/08/31/from-yik-yak-to-snapchat-gw-turns-to-social-media-to-connect-with-students/","From Yik Yak to Snapchat, GW turns to social media to connect with students","He said staff members monitor any social media platform that the GW community uses on a regular basis, including Yik Yak, a platform where people are able to post anonymous musings. We want to understand what our community is talking about,&nbsp;...","World wide"
"http://techcrunch.com/2015/07/15/yik-yak-introduces-photos-but-no-faces-allowed/","Yik Yak Introduces Photos, But No Faces Allowed","Now defunct competitor Secret wasn't so wise when it shocked its community with a massive redesign that cloned Yik Yak's interface and ditched the full-size photos it was known for. The company is rolling out photos over the next few days, and also ...","World wide"
"http://www.wtsp.com/story/news/local/2015/08/31/usf-police-investigate-shooting-threat/71451762/","USF Police investigate shooting threat","Tampa, Florida -- USF Police are investigating a shooting threat posted on the social media app Yik Yak that included USF Sunday night. Police responded and by the time they got to a possible scene the threat had been removed. They are working with the&nbsp;...","World wide"
"http://www.technicianonline.com/opinion/article_52d197d2-5a94-11e5-b506-8f28e33e117f.html","Walking: yes, it's still an option","If it's raining, take the bus. The bricks are slippery enough to make you trip on sunny days, not to mention when there are puddles covering them. You will surely hydroplane and your public wipeout will probably make YikYak within the next few seconds.","World wide"
"http://www.thesunflower.com/opinion/article_40b3aeee-5a96-11e5-9e70-d752d3383ba3.html","Staff editorial: Police taking steps to get in touch with students","On the popular anonymous mobile application Yik Yak, one person posted: Go walk around the edge [of] campus at night then tell me there is no problem with the safety of campus. Another said, WSU isn't the safest part of Wichita. Through on-campus ...","World wide"
"http://techcrunch.com/2015/05/05/yik-yaks-founders-on-the-value-of-anonymous-apps/","Yik Yak's Founders On The Value Of Anonymous Apps","This morning at TechCrunch Disrupt NY, Yik Yak founders Brooks Buffington and Tyler Droll spoke as to why they believe their anonymous social app has soared while others in the space have instead folded. A sort of hyperlocal anonymous Twitter, Yik Yak&nbsp;...","World wide"
"http://college.usatoday.com/2015/07/24/students-react-to-yik-yak-announcement-of-photo-feature/","Students unimpressed by Yik Yak's new photo feature","On July 15, 2015, the anonymous social media app Yik Yak announced it would allow users to begin posting photos. Yik Yak made the announcement in a blog post. We're moderating photos before they appear in your feed, and there are a few guidelines to&nbsp;...","World wide"
"http://bcheights.com/opinions/2015/new-platform-allows-for-reporting-of-bias-incidents/","New Platform Allows For Reporting Of Bias Incidents","Students can sign on to a Google Form and then anonymously submit details on the observed incident, with the technology allowing students to submit screenshots of content posted on Yik Yak or Twitter that can be interpreted as offensive. Platforms like ...","World wide"
"http://techcrunch.com/2015/03/16/yik-yak-founders-sxsw/","Yik Yak Founders Defend Themselves Against Criticism Over Cyberbullying","Yik Yak co-founders Tyler Droll and Brooks Buffington took the stage today at South by Southwest, where they addressed what they described as the biggest misconceptions about their anonymous, location-based chat app. As Yik Yak's popularity has climbed&nbsp;...","World wide"
"http://readwrite.com/2015/03/30/yik-yak-secret-weapon-outside-silicon-valley-bubble","Yik Yak's Secret Advantage: It's Outside The Silicon Valley Bubble","The two 24-year-old founders of the social app Yik Yak carry themselves cautiously. They leaned back in their chairs during their recent SXSW interview, sporting matching green socks adorned with their yak mascot. They remained very still throughout ...","World wide"
"http://www.roanoke.com/news/crime/blacksburg/student-arrested-after-threatening-virginia-tech-yik-yak-post/article_4743fe59-023c-5b26-bebd-662594f7d6ca.html","Student arrested after threatening Virginia Tech Yik Yak post","A Virginia Tech senior has been arrested after posting a threatening Yik Yak post warning of an upcoming event similar to the April 16, 2007, shootings on the campus. According to Blacksburg police Lt. Mike Albert, Kiung Moon turned himself in at the ...","World wide"
"http://www.cosmopolitan.com/college/news/a40578/yik-yak-is-now-banned-from-the-college-of-idaho/","Colleges Are Starting to Ban Yik Yak on Campus","Want to write vile, offensive, hateful messages to College of Idaho students on Yik Yak? Too bad. The school's student senate banned Yik Yak from campus this semester after seven students filed complaints with the school's campus safety office about ...","World wide"
"http://www.washingtonpost.com/local/crime/feminists-at-mary-washington-say-they-were-threatened-on-yik-yak/2015/05/06/3d8d287a-f34a-11e4-b2f3-af5479e6bbdd_story.html","Feminists at Mary Washington say they were threatened on Yik Yak","A feminist group at the University of Mary Washington is accusing school officials of failing to act on threats against its members  one of whom was killed last month  on the popular and controversial messaging app Yik Yak, an attorney for the ...","World wide"
"http://www.nytimes.com/2015/04/08/business/dealbook/profits-and-ethics-collide-in-nameless-turmoil.html","In Rise of Yik Yak App, Profits and Ethics Collide","These questions come to mind when considering the turmoil caused on college campuses nationwide by Yik Yak, the anonymous messaging service founded in 2013 by Tyler Droll and Brooks Buffington soon after they graduated from Furman University in&nbsp;...","World wide"
"http://www.mlive.com/news/ann-arbor/index.ssf/2015/04/u-m_community_bands_together_a.html","U-M community bands together after suicidal note on Yik Yak","Community members took to the anonymous, location-based social media app Yik Yak and to University of Michigan Diag on Sunday after someone posted about an apparently planned suicide. Although the original post shared overnight Saturday and&nbsp;...","World wide"
"http://www.nbcwashington.com/news/local/Police-Check-Yik-Yak-for-Threats-in-University-of-Mary-Washington-Student-Grace-Manns-Death-305773841.html","Police Check Yik Yak for Threats in University of Mary Washington Student ...","Fredericksburg Police are broadening their investigation into a University of Mary Washington student's death by examining whether she received threats on the social media app Yik Yak, court documents reveal. Members of the UMW group Feminists United&nbsp;...","World wide"
"http://www.foxnews.com/tech/2015/03/20/maker-controversial-yik-yak-app-responds-to-critics/","Maker of controversial Yik Yak app responds to critics","Yik Yak, an anonymous location-based social media app, has gained traction as a fast rising startup. But with that success has come criticism. Yik Yak has come under fire as critics claim the anonymity of the app facilitates cyber bullying. A recent ...","World wide"
"http://www.psmag.com/nature-and-technology/the-folly-of-banning-yik-yak-on-school-campuses","The Folly of Banning Yik Yak on School Campuses","Somewhere in the office complex known as Atlanta Tech Village, the technicians at Yik Yak are teaching computers to recognize bigotry. The good news: their app can now sometimes identify a bomb threat. The bad news: as any commenter on Fox Nation&nbsp;...","World wide"
"http://www.ajc.com/news/business/yik-yaks-frat-bro-founders-shrug-off-growing-pains/nmDbb/","Yik Yak's frat-bro founders shrug off growing pains","The most popular post of all time on Yik Yak is a dirty joke. Less than two years old, the Buckhead-based social network is geared mostly toward college students who access and post unsigned announcements through an app on their smartphones. At best it ...","World wide"
"http://dailyprincetonian.com/news/2015/04/yik-yak-considers-disabling-posts-from-u-s-region/","Yik Yak considers disabling posts from U.'s region","After an unknown individual emailed Yik Yak with a request to showcase posts from the University on the application's Peek feature, a Yik Yak support agent replied that the company is considering banning all future posts in the area. Yik Yak is a ...","World wide"
"http://www.huffingtonpost.com/lindsay-hoffman/yik-yak-the-age-of-destru_b_6979836.html","Yik Yak: The Age of Destructive Anonymity","The second installment of this semester's Blog Blog Project comes from Politics &amp; Media student, Merissa Muller, a Communication Interest Sophomore with minors in Journalism and Political Communication. Yik Yak has captured the attention of many of ...","World wide"
"http://www.washingtonpost.com/news/the-fix/wp/2015/03/23/what-liberty-university-students-had-to-say-on-yik-yak-about-ted-cruz/","Ted Cruz might have forgotten about the gossipy app Yik Yak when he decided to ...","When Ted Cruz took to the stage at Liberty University to announce his presidential candidacy, we were curious what students in the audience had to say. We took a look at what the conversation on Yik Yak looked like before, during and after the speech.","World wide"
"http://www.npr.org/2015/05/07/404994266/students-say-university-of-mary-washington-failed-to-address-yik-yak-threats","Students Say University Of Mary Washington Failed To Address Yik Yak Threats","A feminist group at the University of Mary Washington is suing the school under Title IX for allegedly failing to respond to various threats made against them. Some are tied to the anonymous social messaging app Yik Yak. MELISSA BLOCK, HOST: A ...","World wide"
"http://www.roanoke.com/news/crime/blacksburg/virginia-tech-student-granted-bond-in-yik-yak-case/article_302c4dd4-8755-5c37-8299-6b0ca9ee210a.html","Virginia Tech student granted bond in Yik Yak case","Correction: The name of attorney Tyson Daniel was misspelled in the original version of this story. It has been corrected here. CHRISTIANSBURG  Virginia Tech student Kiung Eddie Moon, charged in a case involving a Yik Yak post threatening another&nbsp;...","World wide"
"http://wric.com/2015/09/11/bullying-signs-parents-can-look-for/","Bullying: Signs parents can look for","They teach kids about all kind of bullying  verbal, physical, social and the ever-growing trend of cyber bullyingTechnology is what people are using now, said instructor Caronda Bond. Periscope, Twitter, Instagram, Facebook, Yik Yak and Kik. There ...","World wide"
"http://dailytrojan.com/2015/04/09/at-usc-get-rid-of-yik-yak-completely/","At USC, get rid of Yik Yak completely","Has Yik Yak ever done anything good for anybody? I ask that question with no sense of sarcasm: I cannot think of a single app with as much downside as Yik Yak, an app that allows users to post anonymous, 200-character messages to a platform accessible&nbsp;...","World wide"
"http://www.upressonline.com/2015/09/video-news-conference-gives-new-details-on-threats/","Video: News conference gives new details on threats","Chief of the Florida Atlantic University Police Department Charles Lowe and Vice President of Student Affairs Corey King held a news conference at 3 p.m., Wednesday afternoon to discuss new details of the Yik Yak shooting threat. Emeil Stewart, 18, of ...","World wide"
"http://www.detroitnews.com/story/news/local/michigan/2015/04/10/yik-yak-catches-flak-mich-universities/25619211/","Yik Yak catches flak from Mich. universities","Gun violence was threatened recently on Yik Yak at Michigan State University, and students using the app harassed professors during a class at Eastern Michigan University. Some students at University of Michigan-Dearborn have even called for Yik Yak to&nbsp;...","World wide"
"http://appadvice.com/appnn/2015/03/7-ways-to-get-your-yik-yak-posts-up-voted-to-the-top-of-the-hot-list","7 ways to get your Yik Yak posts up-voted to the top of the Hot list","Over the past few months, the anonymous location-based social network known as Yik Yak has become quite popular in some cities  just ask any college student. If you're somewhere that is populated with people using smartphones, there's a good chance&nbsp;...","World wide"
"https://www.insidehighered.com/blogs/student-affairs-and-technology/dont-ban-yik-yak","Don't Ban Yik Yak","Yik Yak may at times be a hot mess. However, like every single communication tool in the history of humankind, Yik Yak is what we make of it. Yaks represent us. Posts on the anonymous geolocation mobile-based app run the gamut of good, bad, and ugly.","World wide"
"https://www.washingtonpost.com/news/the-intersect/wp/2015/03/11/what-the-infamous-college-chat-app-yik-yak-looks-like-at-the-university-of-oklahoma-right-now/","What the infamous college chat app Yik Yak looks like at the University of ...","Over the past week (or, really, past year) the Internet has been abuzz with Yik Yak: the current anonymous app of choice for college students. The New York Times worries that the posts on Yik Yak are largely demeaning and crude, that the app is a ...","World wide"
"http://www.businessinsider.com/how-to-use-yik-yak-2015-3","A 22-year-old's guide to Yik Yak, the super-hot anonymous gossip app that ...","We've put together a guide to show you how to use Yik Yak, which has already wreaked havoc on high schools and colleges. It was live my last spring at Syracuse when I was a senior there. Now it has spread to 1,600 colleges across the nation.","World wide"
"http://gokicker.com/2015/06/26/the-racial-divisiveness-of-yik-yak-on-college-campuses/","The Racial Divisiveness of Yik Yak on College Campuses","Yik Yak is an anonymous app where people who are in the same location post yaks that can either be liked or disliked by an up or down rating. Not surprisingly, the application is prominent on college campuses where many young adults are of course ...","World wide"
"http://www.lansingstatejournal.com/story/news/local/2015/03/04/yik-yak-sentence/24373391/","Former MSU student sentenced for Yik Yak shooting threat","MASON -- Matthew Mullen was in his Michigan State University dorm room the morning of Nov. 24, writing a paper and texting with his mother when he saw a post on a social media site. The Yik Yak post read, MSU is better than FSU because we don't shoot&nbsp;...","World wide"
"http://bowdoinorient.com/article/10368","College halts investigation into alleged sexual assault following Taylor's ...","At the time of Taylor's arrest, the College began an independent investigation of the alleged assault. However, as Taylor is no longer a student at the College, Bowdoin's investigation will not continue. Douglas said that the College will continue to ...","World wide"
"http://recode.net/2015/02/25/yik-yak-hires-michael-morrissey-as-engineering-vp/","Yik Yak Hires Former Googler Michael Morrissey as Engineering VP","Yik Yak has hired Michael Morrissey, a former senior engineering director at Google, as its first VP of engineering, Morrissey tells Re/code. He spent the past eight years at Google before joining Yik Yak, an Atlanta-based anonymous messaging app that ...","World wide"
"http://www.oudaily.com/l_and_a/new-yik-yak-feature-basecamp-allows-users-to-stay-connected/article_3f6aed40-edd6-11e4-9317-ef06b134603d.html","New Yik Yak feature Basecamp allows users to stay connected while away","To set up Basecamp, click on 'Set Your Basecamp' from the main page and then select a location. However, Yik Yak warns that basecamp can only be set once and that users should choose wisely when selecting the group they want to remain linked with.","World wide"
"https://nakedsecurity.sophos.com/2015/05/05/police-arrest-virginia-tech-student-over-yik-yak-threat/","Police arrest Virginia Tech student over Yik Yak threat","Virginia Tech and Blacksburg Police said in a statement that they'd arrested a suspect in relation to the Yik Yak threat on Wednesday night, 29 April. The suspect is 21-year-old Kiung Moon, a senior majoring in business information technology at ...","World wide"
"http://www.ibtimes.com/pulse/yik-yaks-baltimore-no-campus-island-1903774","Yik Yak's Baltimore: No Campus Is An Island","But there is another social network that has been largely overlooked: Yik Yak. The anonymous, student-centered app has become so ubiquitous that rival app Secret is shutting down. Far more than a welcome distraction during finals week, the app provides ...","World wide"
"http://www.dailyillini.com/article/2015/02/anonymity-of-yik-yak-causes-nationwide-concern-at-universities","Anonymity of Yik Yak causes nationwide concern at universities","24, 2014 wrote on Yik Yak, I'm gonna (gun symbol) the school at 12:15 p.m. today. With the help of Yik Yak, MSU police tracked Matthew Mullen to his dorm room in less than two hours, after which he was arrested. Patrick Wade, communications ...","World wide"
"http://nymag.com/thecut/2015/05/did-yik-yak-attacks-culminate-in-a-murder.html","Did Yik Yak Attacks Culminate in a Murder?","Subsequent outrage was directed largely at FUC, which received numerous threats via Yik Yak, an anonymous social-media site. One messenger said he'd tie these feminists to a radiator and rape them, another called for euthanizing members, and a third&nbsp;...","World wide"
"http://college.usatoday.com/2015/01/13/campus-police-use-social-media-to-maintain-student-safety/","You might not be on Yik Yak, but your campus police likely are","You may not see campus police checking smartphone apps, but that doesn't meant they're unaware of the latest popular social media platforms. Yik Yak, a social media app that allows users to create anonymous posts using up to 200 characters, has become&nbsp;...","World wide"
"http://mashable.com/2015/07/25/tyler-droll-future-of-yik-yak/","24-year-old Yik Yak CEO: Running a fast-growing startup is 'crazy stuff'","Yik Yak started with colleges, but CEO Tyler Droll has his sights set on creating a product every bit as compelling as Facebook. The anonymous messaging app, created by Furman University graduates Droll and Brooks Buffington in 2013, is now used by&nbsp;...","World wide"
"https://gigaom.com/2015/02/18/yik-yak-gives-a-better-explanation-of-down-voting-allegations/","Yik Yak gives a better explanation of down voting allegations","After talking to the founders, I don't think Yik Yak is trying to censor its competitors through shady tactics. I believe they were just trying to stop spammy ads from appearing on the app, but inadvertently started suppressing competitors and their ...","World wide"
"http://parenting.blogs.nytimes.com/2015/01/11/spying-on-college-life-via-yik-yak/","Spying on College Life, via Yik Yak","Yik Yak is a free app that lets anonymous users write on a scrolling feed that is geofenced, allowing only people within a limited range (say, a college campus) to post. Any time social media is blended with anonymity, trouble and ugliness are inevitable.","World wide"
"http://www.roanoke.com/news/crime/virginia-tech-student-accused-of-yik-yak-post-to-remain/article_71bac161-e490-5aa3-845b-7243e815931d.html","Virginia Tech student accused of Yik Yak post to remain in jail","CHRISTIANSBURG  A Virginia Tech student accused of posting a threatening message on Yik Yak referencing the 2007 campus shootings will remain in jail until his June trial, a judge decided Wednesday. Kiung Eddie Moon made an appearance in&nbsp;...","World wide"
"http://www.huffingtonpost.com/2015/03/25/naspa-yik-yak_n_6942124.html","Naspa's Annual Conference Was Going Well. Then Yik Yak Showed Up.","It's one of the few times of the year they can get away from students and their annoying habits like, say, their use of the anonymous messaging app (and frequent powder keg of vulgarity) Yik Yak. Sounds like a great getaway, right? Foolish student ...","World wide"
"http://upstart.bizjournals.com/companies/startups/2015/03/01/upstart-100-honorees-at-yik-yak-bulk-up-for-run-at.html?page=all","Upstart 100 honorees at Yik Yak bulk up for run at Twitter","The UpTake: Anonymous messaging app Yik Yak has stirred controversy and nailed down boatloads of VC on its way to challenging Twitter. F ueled by $73.5 million in venture capital, Atlanta consumer tech poster child Yik Yak is bulking up to headbutt&nbsp;...","World wide"
