"URL","Title","Description","Region"
"http://www.cbs12.com/news/top-stories/stories/vid_28352.shtml","Man accused of luring mother, young girls for sex","... be his dad; 7-year-old boy shot and killed at his birthday party; PBSO traffic stop turns ugly, driver says 'no wonder you people get shot'; FAU student expelled following social media threat on Yik Yak; Man accused of raping, killing 2-yr-old girl ...","Houston, Texas cityNdx: 3"
"http://www.cbs12.com/news/top-stories/stories/david-beckham-responds-article-daughters-pacifier-use-28247.shtml","David Beckham responds to article about daughter's pacifier use","... gun to mom's head; turned out to be his dad; 7-year-old boy shot and killed at his birthday party; PBSO traffic stop turns ugly, driver says 'no wonder you people get shot'; FAU student expelled following social media threat on Yik Yak; Man accused ...","Houston, Texas cityNdx: 3"
"http://www.cbs12.com/news/top-stories/stories/clinton-propose-350-billion-college-affordability-plan-28193.shtml","Clinton to propose $350 billion college affordability plan","... FAU student expelled following social media threat on Yik Yak; Human remains found in trash can in Lake Worth; Man accused of raping, killing 2-yr-old girl in Oklahoma City; Drowning in West Palm Beach; Apple event to focus on new iPhones, Apple TV ...","Houston, Texas cityNdx: 3"
"http://www.cbs12.com/news/top-stories/stories/police-say-dogs-seeking-cupcakes-caused-small-stove-fire-28229.shtml","Police say dogs seeking cupcakes caused small stove fire","... be his dad; 7-year-old boy shot and killed at his birthday party; PBSO traffic stop turns ugly, driver says 'no wonder you people get shot'; FAU student expelled following social media threat on Yik Yak; Man accused of raping, killing 2-yr-old girl ...","Houston, Texas cityNdx: 3"
"http://www.cbs12.com/news/top-stories/stories/hospital-bends-rules-96yearold-his-92yearold-wife-28227.shtml","Hospital bends rules for 96-year-old to be with his 92-year-old wife","... gun to mom's head; turned out to be his dad; 7-year-old boy shot and killed at his birthday party; PBSO traffic stop turns ugly, driver says 'no wonder you people get shot'; FAU student expelled following social media threat on Yik Yak; Man accused ...","Houston, Texas cityNdx: 3"
"http://www.cbs12.com/news/top-stories/stories/mom-accused-leaving-2-kids-car-while-she-drank-at-bar-28235.shtml","Mom accused of leaving 2 kids in car while she drank at bar","... following social media threat on Yik Yak; Man accused of raping, killing 2-yr-old girl in Oklahoma City; Drowning in West Palm Beach; Apple event to focus on new iPhones, Apple TV and Siri; Jury selection underway in St. Lucie County deputy murder ...","Houston, Texas cityNdx: 3"
"http://www.cbs12.com/news/top-stories/stories/vid_28249.shtml","Beaten Pomeranian found with note: 'We beat it 2 death lol'","... following social media threat on Yik Yak · Man accused of raping, killing 2-yr-old girl in Oklahoma City · Drowning in West Palm Beach · Apple event to focus on new iPhones, Apple TV and Siri · Jury selection underway in St. Lucie County deputy ...","Houston, Texas cityNdx: 3"
"http://www.cbs12.com/news/top-stories/stories/girls-stay-adult-court-slender-man-stabbing-case-28208.shtml","Girls to stay in adult court in Slender Man stabbing case","... following social media threat on Yik Yak; Man accused of raping, killing 2-yr-old girl in Oklahoma City; Drowning in West Palm Beach; Apple event to focus on new iPhones, Apple TV and Siri; Jury selection underway in St. Lucie County deputy murder ...","Houston, Texas cityNdx: 3"
"http://www.cbs12.com/news/top-stories/stories/navy-2-injured-fire-aboard-aircraft-carrier-atlantic-28271.shtml","Navy: 2 injured in fire aboard aircraft carrier in Atlantic","... FAU student expelled following social media threat on Yik Yak; Human remains found in trash can in Lake Worth; Man accused of raping, killing 2-yr-old girl in Oklahoma City; Drowning in West Palm Beach; Apple event to focus on new iPhones, Apple TV ...","Houston, Texas cityNdx: 3"
"http://cbs12.com/news/top-stories/stories/vid_28275.shtml","PBSO: Man arranges to have car stolen to avoid payments","... PBSO traffic stop turns ugly, driver says 'no wonder you people get shot' · FAU student expelled following social media threat on Yik Yak · Man accused of raping, killing 2-yr-old girl in Oklahoma City · Drowning in West Palm Beach · Apple event to ...","Houston, Texas cityNdx: 3"
"http://www.cbs12.com/news/top-stories/stories/west-palm-beach-woman-buys-3m-lottery-ticket-at-publix-28125.shtml","West Palm Beach woman buys $3M lottery ticket at Publix","... FAU student expelled following social media threat on Yik Yak; Human remains found in trash can in Lake Worth; Man accused of raping, killing 2-yr-old girl in Oklahoma City; Drowning in West Palm Beach; Apple event to focus on new iPhones, Apple TV ...","Houston, Texas cityNdx: 3"
"http://www.cbs12.com/news/top-stories/stories/former-police-officer-claims-supervisors-called-her-badge-bunny-28251.shtml","Former police officer claims supervisors called her a badge bunny","... following social media threat on Yik Yak · Man accused of raping, killing 2-yr-old girl in Oklahoma City · Drowning in West Palm Beach · Apple event to focus on new iPhones, Apple TV and Siri · Jury selection underway in St. Lucie County deputy ...","Houston, Texas cityNdx: 3"
"http://www.cbs12.com/news/top-stories/stories/dubois-park-no-swim-advisory-canceled-28257.shtml","DuBois park no swim advisory canceled","... driver says 'no wonder you people get shot' · FAU student expelled following social media threat on Yik Yak · Man accused of raping, killing 2-yr-old girl in Oklahoma City · Drowning in West Palm Beach · Apple event to focus on new iPhones, Apple ...","Houston, Texas cityNdx: 3"
"http://www.cbs12.com/news/top-stories/stories/missing-diver-found-alive-near-vero-beach-28212.shtml","Missing diver found alive near Vero Beach","... be his dad; 7-year-old boy shot and killed at his birthday party; PBSO traffic stop turns ugly, driver says 'no wonder you people get shot'; FAU student expelled following social media threat on Yik Yak; Man accused of raping, killing 2-yr-old girl ...","Houston, Texas cityNdx: 3"
"http://www.cbs12.com/news/top-stories/stories/vid_28264.shtml","Feds: Mississippi newlyweds planned honeymoon to join ISIS in Syria","... following social media threat on Yik Yak · Man accused of raping, killing 2-yr-old girl in Oklahoma City · Drowning in West Palm Beach · Apple event to focus on new iPhones, Apple TV and Siri · Jury selection underway in St. Lucie County deputy ...","Houston, Texas cityNdx: 3"
"http://cbs12.com/news/top-stories/stories/pot-politics-could-cost-rubio-florida-votes-28292.shtml","Pot politics could cost Rubio Florida votes","... be his dad; 7-year-old boy shot and killed at his birthday party; PBSO traffic stop turns ugly, driver says 'no wonder you people get shot'; FAU student expelled following social media threat on Yik Yak; Man accused of raping, killing 2-yr-old girl ...","Houston, Texas cityNdx: 3"
"http://www.cbs12.com/news/top-stories/stories/vid_28308.shtml","Story by Kerrin Jeromin","It will be a stormy day for most of central and south Florida today as a cold front drops in from the north. This will allow rain to fire up, beginning on the west coast in the morning, then translate eastward through the day with locally heavy ...","Houston, Texas cityNdx: 3"
"http://www.cbs12.com/news/top-stories/stories/vid_28248.shtml","Jets' Geno Smith out 6-10 weeks after punched by teammate","... be his dad; 7-year-old boy shot and killed at his birthday party; PBSO traffic stop turns ugly, driver says 'no wonder you people get shot'; FAU student expelled following social media threat on Yik Yak; Man accused of raping, killing 2-yr-old girl ...","Houston, Texas cityNdx: 3"
"http://www.cbs12.com/news/top-stories/stories/vid_28244.shtml","Trump's remarks draw attention to women's issues","WASHINGTON (SINCLAIR BROADCAST GROUP)  First it was immigration. Then it was veteran's affairs. Now, Donald Trump's comments about Fox News Anchor Megyn Kelly are the latest scandal to prompting outrage and causing other Presidential&nbsp;...","Houston, Texas cityNdx: 3"
"http://www.cbs12.com/news/top-stories/stories/vid_28266.shtml","Special needs children ages 11, 8 kept in cages for months; officials","... following social media threat on Yik Yak; Man accused of raping, killing 2-yr-old girl in Oklahoma City; Drowning in West Palm Beach; Apple event to focus on new iPhones, Apple TV and Siri; Jury selection underway in St. Lucie County deputy murder ...","Houston, Texas cityNdx: 3"
"http://www.cbs12.com/news/top-stories/stories/target-move-away-genderbased-signs-28186.shtml","Target to move away from gender-based signs","The big box retailer announced Friday that it will start phasing out gender-based signage in some departments. The shift comes in response to customer feedback that distinguishing between products for girls and boys is unnecessary and maybe even ...","Houston, Texas cityNdx: 3"
"http://www.cbs12.com/news/top-stories/stories/vid_28213.shtml","Pollution from mine spill much worse than feared: EPA","... following social media threat on Yik Yak · Man accused of raping, killing 2-yr-old girl in Oklahoma City · Drowning in West Palm Beach · Apple event to focus on new iPhones, Apple TV and Siri · Jury selection underway in St. Lucie County deputy ...","Houston, Texas cityNdx: 3"
"http://www.cbs12.com/news/top-stories/stories/police-charge-georgia-woman-calling-911-150-times-28153.shtml","Police charge Georgia woman with calling 911 about 150 times","... Shots fired into school bus in Fort Pierce, 2 arrests made; FAU student expelled following social media threat on Yik Yak; Human remains found in trash can in Lake Worth; Man accused of raping, killing 2-yr-old girl in Oklahoma City; Drowning in ...","Houston, Texas cityNdx: 3"
"http://www.cbs12.com/news/top-stories/stories/vid_28217.shtml","Former Disney Animator Creates Art Tribute For 'Cecil The Lion'","... be his dad; 7-year-old boy shot and killed at his birthday party; PBSO traffic stop turns ugly, driver says 'no wonder you people get shot'; FAU student expelled following social media threat on Yik Yak; Man accused of raping, killing 2-yr-old girl ...","Houston, Texas cityNdx: 3"
"http://www.huffingtonpost.com/richard-zombeck/laughing-stock-ted-cruz-w_b_6941700.html","Laughing Stock Ted Cruz Wants to Be President","The first Republican candidate for the office of president announced on Monday that he is running. Foreign-born tea party whacko bird Rafael Edward Cruz made the announcement to a captive audience on Monday, and the response has been nothing&nbsp;...","Houston, Texas cityNdx: 3"
"http://www.cbs12.com/news/top-stories/stories/vid_28339.shtml","South Florida church packs heat on Sundays","... be his dad; 7-year-old boy shot and killed at his birthday party; PBSO traffic stop turns ugly, driver says 'no wonder you people get shot'; FAU student expelled following social media threat on Yik Yak; Man accused of raping, killing 2-yr-old girl ...","Houston, Texas cityNdx: 3"
"http://www.cbs12.com/news/top-stories/stories/vid_28322.shtml","Online bullying hard to control, keeps parents in the dark","WEST PALM BEACH (CBS12) --Often bullying happens online which makes policing tough and keeps parents unaware. The previous school year had 3,819 incidents involving bullying throughout the state of Florida. More than 12 percent of that happened in&nbsp;...","Houston, Texas cityNdx: 3"
"http://www.cbs19.tv/story/28718739/east-texas-fraternity-under-fire-for-alleged-facebook-post","East Texas fraternity under fire for alleged Facebook post","Since the news broke, the social media app Yik Yak has been exploding with talks of an alleged rape by fraternity members, but the college says that's not true. There were no allegations of sexual assault and none have been discovered, said UT Tyler&nbsp;...","Houston, Texas cityNdx: 3"
"http://cbs12.com/news/top-stories/stories/vid_28224.shtml","Jupiter family saves woman whose arm was bitten by alligator","... be his dad; 7-year-old boy shot and killed at his birthday party; PBSO traffic stop turns ugly, driver says 'no wonder you people get shot'; FAU student expelled following social media threat on Yik Yak; Man accused of raping, killing 2-yr-old girl ...","Houston, Texas cityNdx: 3"
"http://alcalde.texasexes.org/2014/12/trending-now-yik-yak-monograms-and-dressed-up-churros/","Trending Now: Yik Yak, Monograms, and Dressed-Up Churros","For an unfiltered look into life on the Forty Acres, download Yik Yak, a proximity-based, fully anonymous message board where pretty much anything goes. A typical day sees UT's board fill up with some uplifting content, a lot of smack talk and venting ...","Houston, Texas cityNdx: 3"
"http://fusion.net/story/129823/josh-lambo-nfl-san-diego-chargers/","Ex-MLS player Josh Lambo signs a contract to kick footballs for the San Diego ...","After a successful two seasons at Texas A&amp;M, Lambo has signed a contract with the San Diego Chargers of the NFL. Once again, he can call himself a ... If Lambo wants to be taken seriously among those of us who cross back and forth over the MLS and NFL ...","Houston, Texas cityNdx: 3"
"http://www.centralfloridafuture.com/story/news/2015/02/20/yik-yak-yakarma-car-ejected-from-ucf/23740951/","Yik Yak truck kicked off UCF campus","After no more than an hour on the Free Speech Lawn, the seven young men and women of the Yik Yak Yakarma Kart were kicked off UCF's campus for commercial solicitation. The Yakarma Kart, a converted ice cream truck, is on a 14-state, 29-campus tour&nbsp;...","Houston, Texas cityNdx: 3"
"http://techcrunch.com/2015/03/16/a-look-inside-lyfts-books/","A Look Inside Lyft's Financial Forecast For 2015 And Beyond","Last week on-demand transportation service Lyft announced that it had raised $530 million in new funding as it seeks to steal market share away from arch-rival Uber and launch services in new markets in the U.S. and internationally. The newly minted&nbsp;...","Houston, Texas cityNdx: 3"
"http://www.npr.org/sections/alltechconsidered/2015/07/13/422620195/on-college-campuses-suicide-intervention-via-anonymous-app","On College Campuses, Suicide Intervention Via Anonymous App","Some are subtle, not explicitly about feelings. Emily Reiling, a student at Villanova, outside Philadelphia, recalls when someone simply posted: If I were to put up my laptop for free or for sale, would anyone buy it? Yik Yak users started responding ...","Philadelphia, Pennsylvania cityNdx: 4"
"http://www.philly.com/philly/blogs/inq-phillydeals/Yik-Yak-helping-FBI-check-shooting-threat-says-Penn-State.html","UPDATE: Penn State cops bust student in YikYak threat to 'kill everyone'","UPDATE: Penn State says it arrested an unnamed 20-year-old student at the school's main campus and plan to charge him for threatening to bring assault rifles to school and kill everyone. Police said the student, who lives off campus, told them it was ...","Philadelphia, Pennsylvania cityNdx: 4"
"http://www.delawareonline.com/story/news/education/2015/07/24/ud-told-improve-student-diversity-now/30645747/","UD told to improve student diversity now","Patrick Harker, UD's president the past eight years, is leaving to lead the Federal Reserve Bank of Philadelphia, putting the university at a crossroads as it selects his replacement. One of the biggest things we need to address is diversity, said ...","Philadelphia, Pennsylvania cityNdx: 4"
"http://onwardstate.com/2015/02/19/penn-state-alumni-battle-yikyak-with-dormchat-the-local-twitter-app/","Penn State Alumni Battling YikYak With New App, DormChat","While immensely popular, YikYak's flaws are certainly no secret, especially at Penn State. With a new app they call a local Twitter, two Penn State alumni are seeking to streamline communication and provide an alternative to YikYak at college ...","Philadelphia, Pennsylvania cityNdx: 4"
"http://www.newsworks.org/index.php/local/the-latest/79561-blurred-lines-and-fuzzy-logic-on-musical-tributes-yikyak-goes-big-time","'Blurred Lines' and fuzzy logic on musical tributes; YikYak goes big time","In other current and former journalism jobs and gigs, Amy has written news and opinion for the Asbury Park Press, the Philadelphia Inquirer, the Philadelphia City Paper and others. She's blogged at her own site, Citizen Mom, on and off since 2004, and ...","Philadelphia, Pennsylvania cityNdx: 4"
"http://www.techrepublic.com/article/how-one-wearable-for-women-is-bringing-self-defense-tools-into-the-modern-age/","How one wearable for women is bringing self defense tools into the modern age","When she returned to her hometown of Philadelphia after the trip, she learned of the brutal rape of a woman just blocks from where she lived. She sat, looking at the paper, and decided someone had to do .... Mustafa and Gold want to reach students by ...","Philadelphia, Pennsylvania cityNdx: 4"
"http://wthitv.com/2015/08/05/changes-taking-place-at-isu-police-department/","Changes taking place at ISU Police Department","Another change will be overnight patrols four nights a week from 6 p.m. to 4 a.m. Both changes aimed at preventing crime like last year's shooting and Yik Yak problem. It's definitely in response to our fall semester last year, Barrett said. We want ...","Philadelphia, Pennsylvania cityNdx: 4"
"http://technical.ly/dc/2015/03/10/ribl-mike-chan-mobile-app/","Ribl, a Yik Yak for adults, is launching ahead of SXSW","... Ribl is more like Reddit and the Facebook News Feed, where users are being connected asynchronously over posts and content. Think lost-and-found, chatter on deals or events, or even crime reporting. (Or Yik Yak but not anonymous and thus less ...","Philadelphia, Pennsylvania cityNdx: 4"
"http://www.delawareonline.com/story/news/education/2015/03/02/ud-president-harker-stepping/24256057/","UD's Harker leaving for Philly Fed","But when you become head of the Philadelphia Federal Reserve, I think that might be stepping up. Harker became UD's 26th president in July 2007, arriving to great acclaim from the Wharton School of the University of Pennsylvania, where he'd served as&nbsp;...","Philadelphia, Pennsylvania cityNdx: 4"
"http://www.nytimes.com/2015/04/28/nyregion/invitation-of-big-sean-to-princeton-festival-brings-protest-and-defense-from-students.html","Invitation of Big Sean to Princeton Festival Brings Debate on Free Speech","Simon Wu, 19, a sophomore from the Philadelphia area and chairman of the committee that selected Big Sean, said nearby colleges have much larger budgets for their festivals. He added that ... Conversation was especially heated on Yik Yak. Mr. Hosie and&nbsp;...","Philadelphia, Pennsylvania cityNdx: 4"
"http://www.nbcphiladelphia.com/news/local/Haverford-School-Threat-287513391.html","Yik Yak Threat Leads to Shelter in Place at Delaware County High School","Officials put students at a Delaware County high school into a shelter-in-place situation Monday morning after an anonymous online threat turned up. A student contacted the principal of Haverford High School at the start of the school week after seeing ...","Philadelphia, Pennsylvania cityNdx: 4"
"http://www.nbcphiladelphia.com/news/local/Haverford-High-Alum-Arrested-for--289648341.html","Haverford High Alum Arrested for Social Media Threat","The threat was posted on January 5 to the social media site Yik-Yak and was directed at students involved with the Best Buddies program which is comprised of students with special needs as well as volunteers, said Haverford Township Police.","Philadelphia, Pennsylvania cityNdx: 4"
"http://www.cbs12.com/news/top-stories/stories/vid_28305.shtml","Uber debate heats up","WEST PALM BEACH (CBS12) - With the ride-sharing service Uber set to come back before Palm Beach County commissioners next week, the debate is heating up. Some commissioners want to treat Uber like cabs and other vehicles-for-hire, requiring&nbsp;...","Philadelphia, Pennsylvania cityNdx: 4"
"http://www.cbs12.com/news/top-stories/stories/vid_28218.shtml","Neighborhood Association fighting to get rid of 45th Street Flea Market","WEST PALM BEACH (CBS12)  It's been called the destination for crime right here in South Florida and some vendors want change, but others want the city to take things a step further and shut it down. Jacqueline Smith is the president for the Westfield&nbsp;...","Philadelphia, Pennsylvania cityNdx: 4"
"http://6abc.com/news/widener-university-freshman-in-custody-after-threat/340401/","Widener University freshman in custody after threat","Yik Yak touts itself as a social media platform allowing users to make anonymous comments that can only be seen by others within a 1.5 mile radius, making it popular with college students. Authorities said today's incident is a good reminder that just ...","Philadelphia, Pennsylvania cityNdx: 4"
"http://www.roanoke.com/news/education/higher_education/virginia_tech/day-of-remembrance-observed-on-virginia-tech-campus-and-beyond/article_60aabd70-2897-50cf-a533-f543c851c048.html","Day of Remembrance observed on Virginia Tech campus and beyond","Sat., April 18, 9 a.m., Jonathan Eshenour Memorial Trail, Hershey, Penn. Open to all members of the community, but attendees are encouraged to wear their favorite maroon and orange. Additional details and a course map can be obtained by emailing Cody&nbsp;...","Philadelphia, Pennsylvania cityNdx: 4"
"http://philadelphia.cbslocal.com/2015/03/17/kyw-at-sxsw-anonymous-app-yik-yak-addressing-cyberbullying-concerns/","KYW at SXSW: Anonymous App 'Yik Yak' Addressing Cyberbullying Concerns","AUSTIN, Tex. (CBS)  Yik Yak has been described as the wild wild west of anonymous social apps. Last year, both Moorestown and Neshaminy high schools had problems with students who were using the app. Now, those concerns are being addressed&nbsp;...","Philadelphia, Pennsylvania cityNdx: 4"
"https://www.washingtonpost.com/news/the-intersect/wp/2015/03/19/the-revenge-pornographers-next-door/","The revenge pornographers next door","Of all the deeply disturbing revelations to emerge from the recent investigation into a Penn State fraternity's secret Facebook page, perhaps none was quite so alarming as this: At least 144 people knew about the page, where Kappa Delta Rho brothers ...","Philadelphia, Pennsylvania cityNdx: 4"
"http://minnesota.cbslocal.com/2015/06/09/protecting-children-from-dangers-online/","How To Protect Kids From Online Danger","Hedinger says three apps that cause concern are Snapchat, Yik Yak and something called Kik. They make it easy to develop relationships with unsuspecting children and teenagers. And then there are the games, where you can chat with your opponents.","Philadelphia, Pennsylvania cityNdx: 4"
"http://arstechnica.com/tech-policy/2015/05/after-derailment-amtrak-finally-to-install-video-cameras-in-locomotives/","After derailment, Amtrak finally to install video cameras in locomotives","The decision comes just weeks after a train derailment outside Philadelphia, which resulted in the deaths of eight people and over 200 injuries. For years, Amtrak has had outward-facing cameras on locomotives, along with sensors for both the locomotive&nbsp;...","Philadelphia, Pennsylvania cityNdx: 4"
"http://www.wptv.com/news/world/zimbabwe-accuses-2nd-american-doctor-jan-casimir-seski-of-illegally-hunting-lion","Zimbabwe accuses 2nd American, Doctor Jan Casimir Seski, of illegally hunting lion","HARARE, Zimbabwe (AP) -- Zimbabwe has accused a Pennsylvania doctor of illegally killing a lion in April, as it seeks to extradite a Minnesota dentist who killed a well-known lion named Cecil in July. Jan Casimir Seski of Murrysville, Pennsylvania ...","Philadelphia, Pennsylvania cityNdx: 4"
"http://www.bizjournals.com/sanjose/news/2015/04/30/social-platform-secretgoes-silent.html","Three reasons why social platform Secret went silent","The secret is out  anonymous social platform Secret is shutting down. But the question now is why? CEO David Byttow spoke about taking his app public last February, but on Wednesday the startup announced it would shut down and return what was left of&nbsp;...","Philadelphia, Pennsylvania cityNdx: 4"
"http://www.wptv.com/news/region-c-palm-beach-county/west-palm-beach/what-you-should-know-about-childrens-heart-surgery-mortality-rates","What you should know about children's heart surgery mortality rates","ATLANTA (CNN) -- CNN's investigation of pediatric open heart mortality rates at St. Mary's Medical Center in West Palm Beach, Florida, showed that the hospital had a much higher death rate than the national average. Both the hospital and state of ...","Philadelphia, Pennsylvania cityNdx: 4"
"http://dfw.cbslocal.com/2015/04/30/tcu-hosts-campus-rally-against-racism/","TCU Hosts Campus Rally Against Racism","It all started when some TCU students began posting offensive comments about the rioting on the social media app, Yik Yak. Other students responded with a call for unity. TCU journalism student, Chloe Coleman got a quick lesson in the reality of racism.","Philadelphia, Pennsylvania cityNdx: 4"
"http://lancasteronline.com/features/together/older-users-loyal-to-original-social-media-sites-like-facebook/article_b7ddbcd2-e9f1-11e4-b328-cbb0bde78b2b.html","Older users loyal to original social media sites, like Facebook; younger users ...","And, though Vine, Snapchat, Yik Yak and other newer social media sites are catching on, older sites, such as Facebook, attract a more mature clientele. Mature category. Terry Ditzler, 61, places himself in that mature category. The Lancaster man has ...","Philadelphia, Pennsylvania cityNdx: 4"
