"URL","Title","Description","Region"
"http://www.reuters.com/article/2014/11/20/us-usa-school-california-idUSKCN0J42CM20141120","Girl questioned over Yik Yak threat that closed California school","LOS ANGELES Police in Southern California have questioned a girl in connection with at least one threatening post made on social media application Yik Yak that led to a two-day closure of a high school in an affluent oceanside community, officials said.","Los Angeles, California cityNdx: 1"
"http://www.laloyolan.com/news/lmu-has-the-yik-yak-fever/article_a1164884-a10d-11e4-9738-c7f7caaf181b.html","LMU has the Yik Yak fever","Recently, the Yik Yak team revealed to the Loyolan that the LMU feed has posts being added to it almost every minute of the day, and it is one of the most popular and active feeds in the state of California. Students are inclined to use Yik Yak for a ...","Los Angeles, California cityNdx: 1"
"http://college.usatoday.com/2015/05/06/racist-yik-yak-posts-considered-hate-speech-by-syracuse/","Racist Yik Yak posts considered 'hate speech' by Syracuse","When JaShel Jones graduates from Syracuse University this weekend, she'll be leaving a campus where she's witnessed racism. Last week, someone posted on Yik Yak  an anonymous social media app  complaining about a step show outside of a&nbsp;...","Los Angeles, California cityNdx: 1"
"http://www.forbes.com/sites/ryanmac/2015/04/14/cofounder-lawsuits-luan-tran-snapchat-yik-yak/","Want To Sue A Startup? Hire This Man","Luan Tran's 39th floor office in downtown Los Angeles is largely inconspicuous. Overlooking busy South Figueroa St. in the city's ... A large part of that is the coverage of the Snapchat and the Yik Yak cases. People went online looking for previous ...","Los Angeles, California cityNdx: 1"
"http://losangeles.cbslocal.com/2015/04/27/man-arrested-for-allegedly-posting-threatening-hoax-online-at-uc-riverside/","Man Arrested For Allegedly Posting Threatening Hoax Online At UC Riverside","RIVERSIDE (CBSLA.com)  A 29-year-old man was in custody Monday for allegedly posting a threatening message online at the University of California, Riverside. According to campus police, Anton Shirokov, of Riverside, posted a threat on Yik Yak Sunday&nbsp;...","Los Angeles, California cityNdx: 1"
"http://www.nbclosangeles.com/news/local/Palisades-High-School-Evacuated-After-Possible-Bomb-Threat-281471111.html","Palisades High School Evacuated After Social Media Threat","The apparent bomb threat was made via social media app Yik Yak, an app that allows users to post anonymously. ... An anonymous bomb threat posted on social media site Yik Yak resulted in students being evacuated at Palisades Charter High School.","Los Angeles, California cityNdx: 1"
"http://www.huffingtonpost.com/2015/06/09/umw-feminist-yik-yak-threats_n_7539264.html","UMW President Strikes Back At Feminist Group Over Complaint About Yik Yak Threats","University of Mary Washington President Richard Hurley issued a letter to the president of a national feminist organization Monday, harshly criticizing a Title IX complaint filed against the school over how it handled harassment against female students.","Los Angeles, California cityNdx: 1"
"http://www.laloyolan.com/news/yik-yak-a-touchy-subject-at-lmu/article_df9edd86-4777-11e4-a255-001a4bcf6878.html","Yik Yak a touchy subject at LMU","Many LMU students have recently taken to a new app called Yik Yak, which allows users to post short statements and opinions that can be viewed by other users within close proximity. Anonymity is at the heart of Yik Yak, which allows students looking ...","Los Angeles, California cityNdx: 1"
"http://www.latimes.com/local/lanow/la-me-ln-school-threats-shooting-arrests-20150422-story.html","3 teens arrested in high school shooting threats, murder plot","On Monday, the Los Angeles County Sheriff's Department said it had detained a person for making threats on Instagram against a fellow middle school student in San Dimas. Two weeks ago, two South Pasadena High School students were sentenced to&nbsp;...","Los Angeles, California cityNdx: 1"
"http://www.newyorker.com/magazine/2015/05/18/tomorrows-advance-man","Tomorrow's Advance Man","If the kids are into Snapchat, fund things like it: Yik Yak, Streetchat, ooVoo. Or, at a .... Arguing that the United States is as fossilized as Microsoft, and that the Valley has become stronger than Boston, New York, Los Angeles, and Washington, D.C ...","Los Angeles, California cityNdx: 1"
"http://www.huffingtonpost.com/2015/05/07/university-mary-washington-yik-yak_n_7233702.html","Complaint Claims University Where Student Was Killed Failed To Act On ...","Documents provided to The Huffington Post show the administration was keenly aware of the continued harassment, which was posted on the anonymous messaging app Yik Yak, but a federal complaint filed Thursday alleges the public university failed to act&nbsp;...","Los Angeles, California cityNdx: 1"
"http://www.latimes.com/local/education/la-me-usc-black-house-20150331-story.html","USC's Black House proposal raises questions about racial tensions","When some USC student government leaders voiced support for creating a cultural house for black students, Ama Amoafo-Yeboah thought that she and other undergraduates were closer to having a space where they could hang out and hold events.","Los Angeles, California cityNdx: 1"
"http://fusion.net/story/174829/heres-why-drake-felt-the-need-to-insult-every-facet-of-meek-mills-existence/","Here's why Drake felt the need to insult every facet of Meek Mill's existence","Here's the thing: Drake won before this even started. Though the feud or beef or whatever it's being called today is being framed as a versus affairas in, Drake versus Meek Millthat implies there was a debate at some point in time as to who ...","Los Angeles, California cityNdx: 1"
"http://www.huffingtonpost.com/2015/06/04/retaliation-sexist-behavior-students-colleges_n_7455556.html","The Bigger Problem Behind Retaliation Students Face For Reporting Sexist Behavior","The Feminists United Club at the University of Mary Washington in Virginia complained for months to university officials that their group's members were being harassed, largely on Yik Yak, an app that allows users in the same vicinity to anonymously ...","Los Angeles, California cityNdx: 1"
"http://www.latimes.com/local/lanow/la-me-ln-san-diego-school-threats-20141121-story.html","2 San Diego teens held in hoax school threats made on Yik Yak","Yik Yak has come under scrutiny after anonymous messages prompted lockdowns and closures at schools in California and around the country. Earlier this week, threats made on Yik Yak against a Manhattan Beach high school prompted administrators to&nbsp;...","Los Angeles, California cityNdx: 1"
"http://www.theatlantic.com/education/archive/2015/05/the-renaissance-of-student-activism/393749/","The Renaissance of Student Activism","Perhaps they see activism as a more effective means of inciting changeparticularly when the change they seek has little to do with politics. Just last week, the entire graduate class of 2016 at the University of Southern California's art and design ...","Los Angeles, California cityNdx: 1"
"http://fusion.net/story/161370/mls-rule-change-galaxy-core-player/","MLS keeps changing its rules for the Galaxy, and that's not a bad thing","David Beckham signs autographs after his Los Angeles Galaxy lost to the New England Revolution, 1-0, in a soccer match Sunday, Aug. 12, 2007, at Gillette Stadium in Foxborough, Mass. Beckham did not play in the game. (AP Photo/Winslow Townson).","Los Angeles, California cityNdx: 1"
"http://www.huffingtonpost.com/tiziana-dearing/heres-an-idea-dont-be-a-jerk_b_7867272.html","Here's an Idea - Don't Be a Jerk","Throughout the absolute cringe-fest that has been coverage of Donald-Trump-the-candidate, a thought has niggled at me. Just because you're up in the polls doesn't make this OK. Not an earth-shattering realization, but then two more things happened.","Los Angeles, California cityNdx: 1"
"http://www.cbs12.com/news/top-stories/stories/paraglider-prompts-strange-sky-chase-after-jail-flyover-28231.shtml","Paraglider prompts strange sky chase after jail flyover","Almost, as a Los Angeles County Sheriff's helicopter pursued a powered paraglider that had just flown past a jail, raising concern. A KABC-TV helicopter captured the brief chase that took place when the man in the paraglider flew near Los Angeles ...","Los Angeles, California cityNdx: 1"
"http://www.latimes.com/business/la-fi-cofounder-disputes-20150322-story.html","Co-founder feuds at LA tech start-ups show how handshake deals can blow up","Two Stanford University undergraduates shook hands in their dormitory in early 2011, agreeing to partner on what they hoped would be the next big technology start-up. But as their dream came true, their simple exercise of trust became a liability when ...","Los Angeles, California cityNdx: 1"
"http://www.huffingtonpost.com/entry/social-media-college-mental-health_55ae6649e4b08f57d5d28845","Social Media Is Changing How College Students Deal With Mental Health, For ...","In April, after someone posted a suicide note on the anonymous social media app Yik Yak at the University of Michigan, the school's social media director Nikki Sunstrum was able to contact campus police and locate the student within 24 hours ...","Los Angeles, California cityNdx: 1"
"http://venturebeat.com/2014/11/24/santa-cruz-school-threatener-says-other-budding-terrorists-should-avoid-using-yik-yak/","Santa Cruz school threatener says other budding terrorists should avoid using ...","If you really want to call in a threat to get attention and get out of school, don't use Yik Yak. Yes, we know it's the school rumor terrorism ... for it; students call them YikYak Days. It's become common enough that it's becoming a problem in the ...","Los Angeles, California cityNdx: 1"
"https://www.insidehighered.com/views/2015/01/26/essay-rhetoric-about-yik-yak-and-college-students","Essay on the rhetoric about Yik Yak and college students","Even former Los Angeles Clippers owner Donald Sterling's private phone conversation becomes a public moment as the recorded discussion is duplicated and circulated to news outlets, blogs, and other sites. College students are hardly the only people&nbsp;...","Los Angeles, California cityNdx: 1"
"http://www.huffingtonpost.com/larry-magid/banning-yik-yak-from-coll_b_6779168.html","Banning Yik Yak from College Campuses Is Counterproductive","Esha Bhandari, a staff attorney at the American Civil Liberties Union, argues that banning Yik Yak on campuses might be unconstitutional, especially at public universities or private colleges in California where the so-called Leonard Law protects ...","Los Angeles, California cityNdx: 1"
"http://www.adweek.com/prnewser/anonymous-messaging-app-secret-is-dead/113465","Anonymous Messaging App Secret Is Dead","Secret, founded by former Square Wallet developer David Byttow, got a whole lot of attention from tech blogs and even scored coverage last February when Gap claimed to be the first brand to launch a promotion on the hottest new social network.","Los Angeles, California cityNdx: 1"
"http://www.cbs12.com/news/top-stories/stories/vid_28256.shtml","Hammerhead shark chases Tarpon in the Keys","... Aso volcano erupts in Japan; FHP investigating hit-and-run crash in Delray Beach; Planes clip each other on ground at Los Angeles airport; California wildfires turn deadly; Alligator visits home in Fort Pierce; California fire destroys 400 homes ...","Los Angeles, California cityNdx: 1"
"http://www.cbs12.com/news/top-stories/stories/vid_28211.shtml","CBS12 Investigates: The most dangerous local schools","... following social media threat on Yik Yak; Man accused of raping, killing 2-yr-old girl in Oklahoma City; Drowning in West Palm Beach; Apple event to focus on new iPhones, Apple TV and Siri; Jury selection underway in St. Lucie County deputy murder ...","Los Angeles, California cityNdx: 1"
"http://www.cbs12.com/news/top-stories/stories/work-release-inmate-escapes-returns-his-own-28325.shtml","Work release inmate escapes, returns on his own","... Victim of child sex abuse moves next to alleged attacker; Mount Aso volcano erupts in Japan; FHP investigating hit-and-run crash in Delray Beach; Planes clip each other on ground at Los Angeles airport; California wildfires turn deadly; Alligator ...","Los Angeles, California cityNdx: 1"
"http://www.usatoday.com/story/opinion/2015/08/12/bernie-sanders-challenges-clinton-column/31481769/","Trump-Sanders 2016: The ticket we deserve - Glenn Reynolds","Lurking around campus Yik Yak networks and similar settings (this is what you do as a pundit nowadays), I see the same thing. Is it odd that Sanders, who is even older than Clinton and who bears a vague resemblance to The Simpsons' Montgomery Burns,&nbsp;...","Los Angeles, California cityNdx: 1"
"http://www.huffingtonpost.com/2015/04/01/yik-yak-photo-campuses_n_6988108.html","Yik Yak Is Testing A Photo Feature On Some Campuses","Yik Yak, the anonymous messaging app, is testing a new feature that would let users share photos, Mashable has learned. Yik Yak is in the early stages of testing the feature on some college campuses for limited periods of time, sometimes as brief as ...","Los Angeles, California cityNdx: 1"
"http://www.nbclosangeles.com/news/local/Yik-Yak-App-249057481.html","SoCal School Latest Victim of Social Media Abuse by Teens","In Los Angeles, a spokeswoman for the Los Angeles Unified School District said the district does not have a specific policy regarding Yik Yak. According to the LAUSD 's Student Parent Handbook the use of cell phones is prohibited on campus during&nbsp;...","Los Angeles, California cityNdx: 1"
"http://techcrunch.com/2015/05/01/meet-the-disrupt-ny-2015-speakers-and-judges/","Meet The Disrupt NY 2015 Speakers And Judges","Tyler Droll is the CEO and co-founder of Yik Yak. Droll will speak at 12:00pm on Tuesday May 5. Tara Feener is an engineer at FiftyThree, makers of Paper for the iPad (Apple's iPad App of the Year 2012) and Pencil (the world's top selling digital stylus).","Los Angeles, California cityNdx: 1"
"http://www.theatlantic.com/education/archive/2015/04/performances-parties-and-parodies-when-do-they-cross-the-line/391308/","Performances, Parties, and Parodies: When Do They Cross The Line?","And one post on Yik Yak, the anonymous social media app, read: If Princeton is so damaging, leave. Good luck finding somewhere that can .... And while it may seem difficult to reconcile racial tolerance and free speech in incidents such as this ...","Los Angeles, California cityNdx: 1"
"http://www.cbs12.com/news/top-stories/stories/vid_28348.shtml","Warehouse burns in Pompano Beach","... Planes clip each other on ground at Los Angeles airport · California wildfires turn deadly · Alligator visits home in Fort Pierce · California fire destroys 400 homes, businesses · Some wiffle ball play that helps little smiles · American Airlines ...","Los Angeles, California cityNdx: 1"
"http://www.huffingtonpost.com/2015/04/07/reply-all-case-western-reserve-university_n_7018282.html","Reply All Email Creates Havoc For Case Western Students' Inboxes","Case Western Reserve University students experienced a nightmare in their inboxes Monday night. Someone hit Reply All to an email sent to all undergraduates at the university, and from there, it became a real Replyallpocalypse. It all started with ...","Los Angeles, California cityNdx: 1"
"http://techcrunch.com/2015/05/06/meerkat-founder-on-getting-the-kill-call-from-twitter/","Meerkat Founder On Getting The Kill Call From Twitter","The way our team looks at it is there is a new medium called one-to-many-synchronous. And the old medium or what we know until now is one-to-many-asynchronous. And in [that] there is Facebook, Twitter, Instagram, YouTube, Yik Yak, Snapchat Stories","Los Angeles, California cityNdx: 1"
"http://www.huffingtonpost.com/2015/04/02/california-black-students_n_6987452.html","California College Students Seek To Dispel Racial Tensions On Their Campuses","The fact is, they don't want people like us, undergraduate Ama Amoafo-Yeboah told the Los Angeles Times about the majority of her white classmates. ... The LA Times reported that a Yik Yak user posted, Why would they open a prison on the Row?.","Los Angeles, California cityNdx: 1"
"http://www.atlantamagazine.com/great-reads/gossip-guys-yik-yaks-founders-protecting-app-biggest-threat-us/","Gossip Guys: How Yik Yak's founders are protecting their app from its biggest ...","Let's see: In March, a high school in Southern California went on lockdown after someone made a bomb threat on Yik Yak. Just a few days later, the app was banned at a Chicago-area high school after a rash of bullying messages. In April, a teenager from&nbsp;...","Los Angeles, California cityNdx: 1"
"http://www.cbs12.com/news/top-stories/stories/vid_28214.shtml","Fraudulent Austin and Perry fundraisers preying on the public's generosity","... following social media threat on Yik Yak · Man accused of raping, killing 2-yr-old girl in Oklahoma City · Drowning in West Palm Beach · Apple event to focus on new iPhones, Apple TV and Siri · Jury selection underway in St. Lucie County deputy ...","Los Angeles, California cityNdx: 1"
"http://www.huffingtonpost.com/2015/05/29/emails-oklahoma-sae-scandal_n_7470972.html","Emails Show How Quickly The Oklahoma SAE Scandal Unfolded","Emails obtained by The Huffington Post show how quickly the University of Oklahoma community responded to a video showing members of the schools' Sigma Alpha Epsilon chapter singing a racist song. | Brett Deering via Getty Images&nbsp;...","Los Angeles, California cityNdx: 1"
"http://www.cbs12.com/news/top-stories/stories/vid_28289.shtml","Tick bite leaves mother a quadruple amputee","... Victim of child sex abuse moves next to alleged attacker; Mount Aso volcano erupts in Japan; FHP investigating hit-and-run crash in Delray Beach; Planes clip each other on ground at Los Angeles airport; California wildfires turn deadly; Alligator ...","Los Angeles, California cityNdx: 1"
"http://www.stanforddaily.com/2015/05/07/this-week-is-the-second-annual-occurrence-of-stanfords-sex-week-a-five-day-long-event-series-organized-by-the-sexual-health-peer-resource-center-shprc-the-week-features-events-ranging-fr/","SHPRC hosts Sex Week","Even Yik Yak is positive about it, Dee added. Which honestly is unheard of for Yik Yak to be positive about something. SHPRC is located on the second floor of Vaden Health Center and they're open from noon6 p.m. Monday through Thursday and noon-5&nbsp;...","Los Angeles, California cityNdx: 1"
"http://www.cbs12.com/news/top-stories/stories/boy-capsized-frigid-water-god-told-me-paddle-back-28267.shtml","Boy who capsized in frigid water: 'God told me to paddle back'","14, 2015 · Gas prices dip below 2 dollars a gallon · Planes clip each other on ground at Los Angeles airport · California wildfires turn deadly · Miss Georgia wins Miss America, Vanessa Williams gets apology · Alligator visits home in Fort Pierce ...","Los Angeles, California cityNdx: 1"
"http://www.armytimes.com/story/military/careers/army/2015/04/14/army-west-point-branding-cadets-black-knights/25770989/","'Army West Point': Experts, readers offer mixed reviews","The U.S. Military Academy's athletics rebranding effort, unveiled Monday, earned acclaim from industry experts, scorn from many Army Times readers, and a bit of both from those at the school, who voiced support at Monday's announcement but took a&nbsp;...","Los Angeles, California cityNdx: 1"
"http://www.cbs12.com/news/top-stories/stories/vid_28343.shtml","Two ways to get to Sesame Street","LOS ANGELES (AP)  The Muppets, longtime residents of PBS, are getting a second home at HBO. The premium cable channel and Sesame Workshop, which produces Sesame Street, on Thursday announced a five-year deal that will expand the Sesame&nbsp;...","Los Angeles, California cityNdx: 1"
"http://www.purdueexponent.org/campus/article_c13d2d33-6412-5196-9079-5d3891b70326.html","Previously unknown Amelia Earhart footage donated to Purdue archives","The film features footage of Earhart being photographed by her official photographer, Albert Bresnik, at Union Air Terminal in Burbank, California (today known as the Bob Hope Airport). The footage is thought to have been taken by Albert's brother ...","Los Angeles, California cityNdx: 1"
"http://www.cbs12.com/news/top-stories/stories/vid_28228.shtml","33-year-old man arrested for the 32nd time","... Victim of child sex abuse moves next to alleged attacker; Mount Aso volcano erupts in Japan; FHP investigating hit-and-run crash in Delray Beach; Planes clip each other on ground at Los Angeles airport; California wildfires turn deadly; Alligator ...","Los Angeles, California cityNdx: 1"
"http://www.cbs12.com/news/top-stories/stories/man-dies-after-diving-incident-jupiter-28128.shtml","Man dies after diving incident in Jupiter","... FAU student expelled following social media threat on Yik Yak; Human remains found in trash can in Lake Worth; Man accused of raping, killing 2-yr-old girl in Oklahoma City; Drowning in West Palm Beach; Apple event to focus on new iPhones, Apple TV ...","Los Angeles, California cityNdx: 1"
"http://www.cbs12.com/news/top-stories/stories/vid_28209.shtml","Masked men rob Verizon Wireless store at gunpoint","... following social media threat on Yik Yak; Man accused of raping, killing 2-yr-old girl in Oklahoma City; Drowning in West Palm Beach; Apple event to focus on new iPhones, Apple TV and Siri; Jury selection underway in St. Lucie County deputy murder ...","Los Angeles, California cityNdx: 1"
"http://www.theverge.com/2015/4/23/8484969/comcast-reportedly-abandons-acquisition-of-time-warner-cable","Comcast reportedly abandons acquisition of Time Warner Cable","Comcast is calling off its $45 billion dollar attempt to buy fellow cable provider Time Warner Cable, according to Bloomberg. The decision comes after recent reports that both the US Department of Justice and Federal Communications Commission were&nbsp;...","Los Angeles, California cityNdx: 1"
"http://www.cbs12.com/news/top-stories/stories/vid_28219.shtml","Bandidos biker gang member busted in bizarre hold up","... following social media threat on Yik Yak · Man accused of raping, killing 2-yr-old girl in Oklahoma City · Drowning in West Palm Beach · Apple event to focus on new iPhones, Apple TV and Siri · Jury selection underway in St. Lucie County deputy ...","Los Angeles, California cityNdx: 1"
"http://www.cbs12.com/news/top-stories/stories/vid_28216.shtml","CAUGHT ON CAM: Cop confronts disabled veteran for not looking 'handicap'","... following social media threat on Yik Yak · Man accused of raping, killing 2-yr-old girl in Oklahoma City · Drowning in West Palm Beach · Apple event to focus on new iPhones, Apple TV and Siri · Jury selection underway in St. Lucie County deputy ...","Los Angeles, California cityNdx: 1"
"http://www.nydailynews.com/news/national/shooting-uc-santara-barbara-campus-article-1.2218736","2 students shot in attack near UC-Santa Barbara  a year after deadly rampage","Two University of California-Santa Barbara students were shot just blocks off campus Monday night  almost a year after a depraved misogynist killed six students in a rampage near the same location. Cops said Monday's attack in Isla Vista ... During ...","Los Angeles, California cityNdx: 1"
"https://reason.com/blog/2015/06/08/umw-president-says-feminist-groups-title","UMW President Says Feminist Group's Title IX Complaint Is Reckless, Misinformed","I previously wrote that the complaint was baseless; there's no evidence that the rugby team, or the Yik Yak comments (which are constitutionally-protected speech), had anything to do with Mann's death. Furthermore, the university did everything it ...","Los Angeles, California cityNdx: 1"
"http://fusion.net/story/195454/florida-college-student-kicked-out-of-school-over-yik-yak-post/","Florida college student expelled over Yik Yak post","In the latest instance of how an errant post on social media can instantly destroy your life, a student at Florida Atlantic University in Boca Raton has been expelled over a Yik Yak post, WPTV's Charles Keegan reports. Emeil Stewart, an 18-year-old ...","Chicago, Illinois cityNdx: 2"
"http://chicagomaroon.com/2014/12/02/yik-yak-still-so-frat/","Yik Yak, still so frat","Chicago, Connecticut, and California schools have all reported major problems and student drama due to Yik Yak's presence on student phones, ranging from classic cyber bullying, name-calling and accusations about students and faculty all the way to ...","Chicago, Illinois cityNdx: 2"
"http://www.uloop.com/for-sale/view.php/305016081/1999-Honda-Accord","1999 Honda Accord","208,800 miles. Clean, but showing some age and wear. Very nice, inexpensive car, and a Honda. - Matching tires with lots of tread left - Has new timing belt and wheel bearings - Cold AC! - Driver side front wheel cover is broken - does not affect drive ...","Chicago, Illinois cityNdx: 2"
"http://articles.chicagotribune.com/2014-03-07/news/ct-yik-yak-schools-met-0307-20140306_1_free-app-chicago-area-middle-school","Yik Yak disabled in Chicago as principals worry","At least four Chicago-area high schools issued warnings about Yik Yak in the past two weeks, with most principals asking parents to remove the app from their children's phones and make sure the teens don't reinstall it. Several districts also have ...","Chicago, Illinois cityNdx: 2"
