"URL","Title","Description","Region"
"http://dailyprincetonian.com/street/2015/07/the-freshman-dictionary-revised-and-updated/","The Freshman Dictionary: Revised and Updated","Past trips have examined arts in Philadelphia, school technology in Boston, immigration in Arizona and other social issues. Bridges ... Week-long pre-orientation activity built around service trips in the Princeton, Trenton and Philadelphia area ...","Philadelphia, Pennsylvania cityNdx: 4"
"http://www.bizjournals.com/portland/blog/techflash/2015/05/portland-entrepreneurwants-to-make-it-easy-to-find.html","Portland entrepreneur wants to make it easy to find software developers","However, it became clear that the juggernaut of YikYak, an college-based anonymous messaging app, was dominating the college social networking space. Hallspot pivoted to a marketing platform for merchants to post coupons and students to find deals, but&nbsp;...","Philadelphia, Pennsylvania cityNdx: 4"
"http://dfw.cbslocal.com/2015/04/29/tcu-responds-to-racist-student-comments-on-social-media/","TCU Responds To Racist Student Comments On Social Media","FORT WORTH (CBS 11 NEWS)  Some TCU students say the Baltimore riots have revealed an ugly side of their school. Racist comments were posted on the app Yik Yak in response to the riots. The app allows users in the same area to share anonymously.","Philadelphia, Pennsylvania cityNdx: 4"
"http://chronicle.com/article/Anonymous-Feedback-Fine/151609/","Anonymous Feedback, Fine. Insults? Not on These Platforms.","The services, which unlike Yik Yak have the support of the colleges using them, allow students to anonymously provide their professors with feedback throughout the course, while giving officials the ability to discover the names of users who are ...","Philadelphia, Pennsylvania cityNdx: 4"
"http://bowdoinorient.com/article/10276","The Bowdoin myth","The three of us spent the rest of the afternoon drinking beers, watching It's Always Sunny in Philadelphia and intermittently checking on the glacial progress of the rink. Just before dinner, a towel-clad Reed resident burst into our room and ...","Philadelphia, Pennsylvania cityNdx: 4"
"http://www.philly.com/philly/business/20150409_Pew_study_tracks_changing_nature_of_teens__online_life.html","Jeff Gelles: Pew tracks changing nature of teens' online life","Girls lead in use of social media, including pinboard sites such as Pinterest and Polyvore, which are used by a third of girls and 11 percent of boys, and secret-sharing sites such as Whisper, Yik Yak, and Ask.FM, where, Pew says, users can ask ...","Philadelphia, Pennsylvania cityNdx: 4"
"http://www.csmonitor.com/USA/Society/2015/0531/Can-tweeters-be-tamed-video","Can tweeters be tamed? (+video)","Digital platforms like Twitter, Yik Yak, and YouTube, with their instant global reach and borderless cross-cultural forums, are blurring the lines between public discourse and private conversation. ... in private or among a group of rowdy friends, but ...","Philadelphia, Pennsylvania cityNdx: 4"
"http://www.philly.com/philly/opinion/20150401_Letters__Lewinsky_s_light_illumines_trolls.html","Letters: Lewinsky's light illumines trolls","Yik Yak is a particularly vile messaging app with no user profiles - affording maximum anonymity for commenters. To what end, I wonder? It's as dark a space as a coward could desire for bellowing hatred. We need to drag them back into the light ...","Philadelphia, Pennsylvania cityNdx: 4"
"http://swarthmorephoenix.com/2015/04/30/worthstock-traditions-decimated-students-say/","Worthstock traditions decimated, students say","When the email was sent out to the student body, students immediately took to social media platforms such as Yik Yak and Facebook to express their dismay and disappointment at the changes to Worthstock Weekend. Several Facebook events, the most&nbsp;...","Philadelphia, Pennsylvania cityNdx: 4"
"http://technical.ly/dc/2015/03/10/rapid-prototyping-design-thinking-technical-ly-podcast/","Where rapid prototyping might take you [Technical.ly Podcast]","First, we heard from Natalie Nixon, who runs an MBA program at Philadelphia University focused on design thinking. For her, it's everything from how food trucks and doughnuts market themselves to efforts made by healthcare companies to help potential&nbsp;...","Philadelphia, Pennsylvania cityNdx: 4"
"http://recode.net/2015/02/11/tech-savvy-boomerangs-coming-back-home-to-rebuild-detroit/","Tech-Savvy 'Boomerangs' Come Back Home to Rebuild Detroit","Founded in 2009, Texts From Last Night predates the current Detroit startup boom, as well as the rise of viral anonymous secrets on apps and sites like Whisper, Yik Yak and BuzzFeed. It continues ... They include Jill Ford, mayor Mike Duggan's head of ...","Philadelphia, Pennsylvania cityNdx: 4"
"http://www.bizjournals.com/washington/news/2015/04/14/want-to-keep-up-on-capitol-hill-gossip-yep-theres.html","Want to keep up on Capitol Hill gossip? Yep, there's an app for that.","TechCrunch says the Capitol Hill crowd now has its very own version of Yik Yak (ask your college-aged kids if you're brave enough, or just read about it here), in Cloakroom, an app that functions as an anonymous forum where Hill insiders can ...","Philadelphia, Pennsylvania cityNdx: 4"
"http://techcrunch.com/2014/12/11/after-school-app-again-pulled-by-apple-after-more-school-shooting-threats/","After School App Again Pulled From The App Store After More School Shooting ...","Earlier this year, popular anonymous posting app Yik Yak took drastic steps to prevent the app from being used on school campuses. With Yik Yak, users can anonymously publish messages viewed by those in their immediate location. Since After School&nbsp;...","Philadelphia, Pennsylvania cityNdx: 4"
"http://college.usatoday.com/2015/03/24/student-newspaper-at-u-of-tennessee-tackles-sexual-violence-survivors-stories-in-special-issue/","Student newspaper at U. of Tennessee tackles sexual violence, survivors ...","With things like Yik Yak and other social media, it's easy to see the negative comments about people who report sexual assault  that's why I wrote about it. So it was awesome to see people who were supportive of survivors reach out and identify with ...","Philadelphia, Pennsylvania cityNdx: 4"
"http://www.azcentral.com/story/news/local/tempe/2014/12/23/yik-yak-asu-tempe-network/20803071/","Controversial Yik Yak 'gossip' app on the rise at ASU","That last one became one of the most popular posts to come out of Arizona State University on an app called Yik Yak. Yik Yak tweeted it in October, where it was favorited more than 1,400 times, likely because it is one of the truest statements ever ...","Phoenix, Arizona cityNdx: 5"
"http://www.azcentral.com/story/news/local/tempe/2015/08/12/top-things-asu-students-do-know-think/31505991/","Top 7 things Arizona State University students do","Yik Yak came out of nowhere last fall and exploded on college campuses. The app lets users post 200-character musings (like Twitter), do so anonymously (like Whisper and Secret), and respond to people within a 10-mile radius (like Tinder), making it a ...","Phoenix, Arizona cityNdx: 5"
"http://www.educationdive.com/news/students-using-yik-yak-to-share-exam-tips/395241/","Students using Yik Yak to share exam tips","The anonymous social media app Yik Yak seems to be students' latest tool for cheating on exams. The Chronicle of Higher Education reports that students are leaving exam rooms and posting test tips on Yik Yak for their peers. While Yik Yak is not the ...","Phoenix, Arizona cityNdx: 5"
"http://www.azcentral.com/story/news/local/tempe/2015/04/30/national-college-decision-day-asu-arizona/26649787/","Friday is College Decision Day - does it matter?","For example, at Northern Arizona University, a late-enrollment fee kicks in on Aug. 31, the first day of classes. At University of Arizona, you can apply to the university through June 1 to attend the fall semester. ASU students must register by Aug ...","Phoenix, Arizona cityNdx: 5"
"http://www.cbs12.com/news/top-stories/stories/bus-50-inmates-crashes-arizona-inmates-driver-hurt-28241.shtml","Bus with 50 inmates crashes in Arizona; inmates, driver hurt","State Trooper Kameron Lee tells The Associated Press that the bus driver was seriously injured and transported to a Phoenix-area hospital. There was no immediate word on the extent of his injuries. Lee said several inmates were hurt in the crash, with&nbsp;...","Phoenix, Arizona cityNdx: 5"
"http://www.cbs12.com/news/top-stories/stories/vid_28284.shtml","Couple accused of sexually abusing teen relative in Port St. Lucie","... Bullets involved in most Phoenix freeway shootings · Landscaping truck crashes on Highway 441 in Wellington · Video: Angry school zone speeder tells PBSO deputy 'no wonder you people get shot' · Trump insults Fiorina's appearance in magazine ...","Phoenix, Arizona cityNdx: 5"
"http://www.azcentral.com/story/news/local/tempe/2015/04/13/asu-university-bees-alert-advisory-campuses/25732663/","ASU abuzz as bees swarm parts of all four campuses","ASU abuzz as bees swarm parts of all four campuses. Kaila White, The Republic | azcentral.com 12:33 p.m. MST April 14, 2015. All four locations of ASU have been affected. Phoenix. Bees have swarmed parts of all four ASU campuses. Don't worry, the&nbsp;...","Phoenix, Arizona cityNdx: 5"
"http://www.purdueexponent.org/opinion/article_dff5679b-218c-52dd-a30a-97ff73949b17.html","Don't change 'Black Lives Matter' to 'All Lives Matter'","This past Saturday, at the Netroots Nation convention in Phoenix, Arizona, democratic presidential candidate Martin O'Malley was speaking onstage, when several dozen activists filed into the room. They recited the names of black women who have recently&nbsp;...","Phoenix, Arizona cityNdx: 5"
"http://www.nytimes.com/aponline/2015/05/07/us/ap-us-university-of-mary-washington-cyberthreats.html","Feminist Group Accuses College of Failing to Act on Threats","Many of the threats against the group were on Yik Yak, a smartphone app that allows users to post and read messages anonymously in real time. The social media company did not immediately respond to an Associated Press request for comment. On its&nbsp;...","Phoenix, Arizona cityNdx: 5"
"http://www.cbs12.com/news/top-stories/stories/jets-geno-smith-out-610-weeks-after-punched-teammate-28248.shtml","Jets' Geno Smith out 6-10 weeks after punched by teammate","... Bullets involved in most Phoenix freeway shootings; Landscaping truck crashes on Highway 441 in Wellington; Video: Angry school zone speeder tells PBSO deputy 'no wonder you people get shot'; Trump insults Fiorina's appearance in magazine profile ...","Phoenix, Arizona cityNdx: 5"
"http://onlineathens.com/sports/2015-03-23/ex-nfl-player-sharper-gets-9-years-arizona-sex-assault","Ex-NFL player Sharper gets 9 years in Arizona sex assault","PHOENIX (AP)  Former NFL All-Pro safety Darren Sharper was sentenced to nine years in federal prison Monday immediately after he pleaded guilty to sexual assault in Arizona, marking the first change of plea of the day for the former safety accused of&nbsp;...","Phoenix, Arizona cityNdx: 5"
"http://www.cbs12.com/news/top-stories/stories/vid_28263.shtml","Gymnastics coach arrest raises concerns about backgound checks","... Bullets involved in most Phoenix freeway shootings; Landscaping truck crashes on Highway 441 in Wellington; Video: Angry school zone speeder tells PBSO deputy 'no wonder you people get shot'; Trump insults Fiorina's appearance in magazine profile ...","Phoenix, Arizona cityNdx: 5"
"http://www.havasunews.com/news/havasu-spring-break-swat-s-opening-week-smooth-looks-to/article_7bb0e902-c938-11e4-839c-a3841e71417f.html","Havasu Spring Break: SWAT's opening week smooth, looks to do it three more times","SWAT's top pipeline school, Arizona State, and the University of New Mexico were the most represented schools present this past week, and the spring break specialists were prepared. We brought in DJs from Arizona and New Mexico, said SWAT ... With a ...","Phoenix, Arizona cityNdx: 5"
"http://www.wildcat.arizona.edu/article/2015/04/internet-centric-replyall-explores-weirdos-on-web","Review: Internet-centric 'ReplyAll' explores weirdos on web","Colgate students took to the anonymous social networking app Yik Yak to counter-protest the ACC. For months, Colgate's Yik Yak was filled with racist, violent posts targeted at the ACC that were up voted by almost 100 students, which is drastic when ...","Phoenix, Arizona cityNdx: 5"
"http://www.educationdive.com/news/5-tips-for-mitigating-bullying-in-schools/387239/","5 tips for mitigating bullying in schools","Bullying is a very real issue in schools, and it is only being exacerbated by the rise of anonymous online platforms such as Yik Yak, an app that allows users to post digital comments viewable by anyone within a set distance. While everyone knows ...","Phoenix, Arizona cityNdx: 5"
"http://www.wptv.com/sports/heat-snag-justise-winslow-at-no-10-in-nba-draft","Miami Heat select Justise Winslow with 10th pick in NBA draft","12 and guard Devin Booker followed one spot later to Phoenix. Booker, at 18 the youngest player in the draft, gave the Wildcats a record-tying four players among the top 14 selections. Duke in 1999 and North Carolina in 2005 also had four lottery picks.","Phoenix, Arizona cityNdx: 5"
"http://fusion.net/story/32988/beware-downloading-the-hacked-sony-pictures-docs-could-bring-the-feds-to-your-door/","Beware: Downloading the hacked Sony Pictures docs could bring the feds to your ...","Phoenix, Arizona. So you are saying the FBI can track down Johnny in his moms basement in Grand Forks North Dakota downloading these files but cannot retrieve emails that the IRS deleted ? Not buying what they are selling. Like  Reply  8  Dec 14 ...","Phoenix, Arizona cityNdx: 5"
"http://www.azcentral.com/story/news/local/tempe/2014/12/23/10-awesome-free-apps-for-college-students/20825543/","10 awesome, free apps for college students","Phoenix, Arizona. 12:16 AM. Icon. 81. Humidity57%; Precip.0.00 in; Winds8 mph. Open settings. Settings. Enter City, State or Zip. Cancel. Set. Close settings. Full Forecast · USA TODAY · Video · Jobs · Cars · Homes · Apartments · Shopping ...","Phoenix, Arizona cityNdx: 5"
"http://wwlp.com/2015/02/04/campus-globe-damaged-in-super-bowl-revelry/","Campus globe damaged in Super Bowl revelry","Our students are the ones that are really upset about this, said Watson and are expressing their disapproval of the apparent vandalism on social media applications such as YikYak and Fade, as well as sites such as Facebook and Instagram. Snippets of&nbsp;...","Phoenix, Arizona cityNdx: 5"
"http://www.depauw.edu/news-media/latest-news/details/31452/","College Roommates Dan Quayle '69 &amp; Mark Rolfing '71 Reminisce, Laugh on TV's ...","The two talked in Scottsdale, Arizona, where the Waste Management Phoenix Open is under way. Didn't you know that he is a political guru?, Quayle said of Rolfing (both played for legendary DePauw coach Ted Katula). He is the one who told me how to&nbsp;...","Phoenix, Arizona cityNdx: 5"
"http://www.educationdive.com/news/combatting-cyber-bullying-more-complex-with-anonymous-social-apps/385215/","Combatting cyber bullying more complex with anonymous social apps","Anonymous social apps that allow students can post and view incognito pose new threats for teachers and parents working to combat cyber bullying. One site causing particular issues is Yik Yak, a digital message-board where students can make anonymous&nbsp;...","Phoenix, Arizona cityNdx: 5"
"http://www.kpho.com/story/27968683/former-osu-student-investigated-for-filming-adult-video-in-campus-library","Former OSU student investigated for filming adult video in campus library","It's all over Yik Yak, which is something you can post anonymously and up-vote or down-vote, and we have a Facebook page called 'Things Overheard At OSU' and there have been a few posts about it on there as well, said OSU senior Kara Beu.","Phoenix, Arizona cityNdx: 5"
"https://stories.illinoisstate.edu/magazine/illinois-state/state-side/meet-student-artist-created-pop-can-reggie/","Meet the student artist who created Pop Can Reggie","Just before 2014's Homecoming weekend, Pop Can Reggie made its debut. It's been popping up all over social media ever since. I got a shoutout on Yik Yak, so that was pretty fulfilling! said Foote, a Presidential Scholar from Frankfort. People like ...","Phoenix, Arizona cityNdx: 5"
"http://www.coloradoan.com/story/news/2015/02/19/colorado-cyberbullying-bill-advances-senate/23705297/","Colorado cyberbullying bill advances to Senate","Rhonda Fields sponsored the bill at a time when some Northern Colorado schools were curbing bullying through a new mobile phone app called Yik Yak. The social media app launched in 2013, giving users the ability to post comments anonymously.","Phoenix, Arizona cityNdx: 5"
"http://www.kpho.com/story/27623216/providence-high-school-students-threatened","Providence High School students threatened","Charlotte-Mecklenburg police and Charlotte Mecklenburg Schools are investigating a message against Providence High School students. The anonymous threat was posted this weekend on a social media site called Yik Yak. Providence is one of those&nbsp;...","Phoenix, Arizona cityNdx: 5"
"https://www.insidehighered.com/news/2014/12/15/professors-turn-yik-yak-happy-space","Professors turn Yik Yak into happy space","In the stressful final days of a long and trying semester, Colgate University professors wanted to spread some love. To get the message across, they turned to a social media scene frequented by students but foreign to many professors. They set out to ...","San Antonio, Texas cityNdx: 6"
"http://www.sacurrent.com/sanantonio/savage-love-girl-party/Content?oid=2457093","Savage Love: Girl Party","Hosting a play party is much like hosting any other party, said Allison Moon, a San Franciscobased writer and sex educator. You want guests to feel welcome and comfortablethis means you provide lube, safer sex supplies, refreshments, and towels&nbsp;...","San Antonio, Texas cityNdx: 6"
"http://www.sacurrent.com/Blogs/archives/2015/03/20/partys-over-for-local-fraternity-chapter-at-trinity-university","Party's Over for Local Fraternity Chapter At Trinity University","On Thursday, March 19, Trinity University conclusively announced its decision to permanently revoke a local San Antonio chapter of Pi Kappa Alpha  an organization popularly recognized as Pike  which formerly was the private liberal arts college's ...","San Antonio, Texas cityNdx: 6"
"http://www.thecollegefix.com/post/20596/","In the footsteps of Yik Yak, photo app Unseen draws scrutiny from campuses","University of Texas-San Antonio student leaders took to Twitter with a delete the app campaign in early November. Many of our fraternity and sorority life leaders believe that Unseen is a destructive app that can be detrimental to university ...","San Antonio, Texas cityNdx: 6"
"http://www.mysanantonio.com/opinion/commentary/article/Anonymous-social-media-attacks-create-wasteland-6258899.php","Anonymous social media attacks create wasteland","Yik Yak lets people post messages that anyone within a 1.5-mile radius can read. And because the authors don't have to reveal their identity, they can say the crudest things without putting themselves at personal risk. It's apparently popular on ...","San Antonio, Texas cityNdx: 6"
"http://www.slate.com/articles/technology/users/2015/03/yik_yak_the_anonymous_messaging_app_with_a_terrible_rep_is_actually_pretty.html","In Praise of Yik Yak. Yes, Yik Yak.","The New York Times finally downloaded Yik Yak this weekend, and it did not like what it saw. Yik Yak is a year-old app that allows people to post random anonymous thoughts to other users within a radius of a couple miles, then up-vote the messages they&nbsp;...","San Antonio, Texas cityNdx: 6"
"http://www.mysanantonio.com/news/education/article/Trinity-University-revokes-Pi-Kappa-Alpha-6152868.php","Trinity University revokes Pi Kappa Alpha chapter, Will Ferrell talks 'getting ...","he said. RELATED: University of Texas fraternity under investigation for 'border patrol' party. The San Antonio Current reported a freshman student publicly posted photographs on Facebook in late January of Pike members smiling against a backdrop of a&nbsp;...","San Antonio, Texas cityNdx: 6"
"http://www.cbs12.com/news/top-stories/stories/gov-scott-declares-state-emergency-severe-weather-flooding-five-counties-28131.shtml","Gov. Scott Declares State of Emergency for Severe Weather and Flooding in Five ...","... Shots fired into school bus in Fort Pierce, 2 arrests made; FAU student expelled following social media threat on Yik Yak; Human remains found in trash can in Lake Worth; Man accused of raping, killing 2-yr-old girl in Oklahoma City; Drowning in ...","San Antonio, Texas cityNdx: 6"
"http://www.cbs19.tv/story/29356612/cbs-19-investigates-how-kappa-sigma-fraternity-got-suspended-from-ut-tyler","CBS 19 Investigates: How Kappa Sigma fraternity got suspended from UT Tyler","Ultimately, the staff member wrote directly to Yik Yak asking for a blanket of censorship on any post mentioning the fraternity. I have reported any post mentioning the group 'Kappa Sig' or 'Kappa Sigma,' but if you could assist me in blocking any ...","San Antonio, Texas cityNdx: 6"
"http://www.slate.com/articles/technology/future_tense/2015/05/micronetworks_mesh_networks_walled_gardens_are_the_internet_s_future.html","The Future of the Internet Isn't Facebook. It's Walled Gardens.","No wonder, then, that some of the most popular messaging apps steer rapidly in the other directionaway from transparency toward anonymity, as in the examples of Yik Yak or Whisper; toward powerful cloaking and encryption, as with Telegram, whose&nbsp;...","San Antonio, Texas cityNdx: 6"
"http://www.cbs12.com/news/top-stories/stories/worker-hurt-30-foot-fall-at-construction-site-boca-28160.shtml","Worker hurt in 30 foot fall at construction site in Boca","... Shots fired into school bus in Fort Pierce, 2 arrests made; FAU student expelled following social media threat on Yik Yak; Human remains found in trash can in Lake Worth; Man accused of raping, killing 2-yr-old girl in Oklahoma City; Drowning in ...","San Antonio, Texas cityNdx: 6"
"http://www.mysanantonio.com/business/technology/article/Google-s-moonshots-gender-bias-at-SXSW-6143557.php","Google's moonshots, gender bias at SXSW","The two 24-year-old founders of Yik Yak, a messaging app wildly popular with college students, are proud to be based in Atlanta. Tyler Droll and Brooks Buffington told a SXSW audience this week that they have no plans to leave for more well-known tech&nbsp;...","San Antonio, Texas cityNdx: 6"
"http://www.slate.com/articles/life/inside_higher_ed/2015/03/connecticut_college_campus_is_aflame_after_professor_wrote_controversial.html","This Is How a Campus Reacts When a Professor Compares Hamas to a Rabid Pit ...","A professor compared Hamas to a rabid pit bull. Free speech couldn't protect him from student vitriol. By Kaitlin Mulhere. Zeena Sabri (L) and Rima Karuf join members of the Society of Arab Students University of CaliforniaIrvine students protest the&nbsp;...","San Antonio, Texas cityNdx: 6"
"http://www.twcnews.com/nc/triangle-sandhills/colleges-universities/2015/04/3/duke-administrators-urge-students-to-stop-rumors-about-who-hanged-noose.html","Duke Administrators Urge Students to Stop Rumors About Who Hanged Noose","Based on what people have shown or told me on Yik Yak, that people have been calling him out. Yik Yak users describe it as a social media app allowing people to post anonymously, trending towards gossip. You really have to be careful about just&nbsp;...","San Antonio, Texas cityNdx: 6"
"http://mashable.com/2014/11/20/yik-yak-threats-lockdown/","Yik Yak threats shut down two California high schools in one week","Torrey Pines High School in San Diego was put on lockdown Thursday morning after school officials were made aware of similar threats made on the app, NBC reported. Police told Reuters that the post that prompted the lockdown at Mira Costa High read,&nbsp;...","San Diego, California cityNdx: 7"
"http://bitcoinist.net/decentralized-messaging-app-yik-yak-announces-anonymous-photo-sharing-collecting-user-data/","Decentralized Messaging App Yik Yak Announces Anonymous Photo Sharing While ...","Photo sharing is one of the most often used tools of our society these days. Whether it's through social media or just sharing pictures with friends and family, we love nothing more than sharing our memories with others. That being said, a lot of ...","San Diego, California cityNdx: 7"
"http://www.nbcsandiego.com/news/local/Violent-Threats-To-Schools-And-Students-On-The-Rise--303009641.html","Violent Threats to Schools and Students on the Rise","The number of San Diego County students expelled or suspended for making a terrorist threat has increased, according to data from the California Department of Education. Facebook, Burnbook, Yik Yak are some of the social media sites where schools and&nbsp;...","San Diego, California cityNdx: 7"
"http://www.cbs8.com/story/27599987/sdsu-sex-assault-suspect-out-on-bail","SDSU sex assault suspect out on bail","SAN DIEGO (CBS 8) - A day after being arrested on suspicion of a sexual assault near campus, an SDSU student is out on bail. CBS News 8 ... Joana Alex says students have been taking to Yikyak, a social media site, to talk about Sousa's arrest. A lot ...","San Diego, California cityNdx: 7"
