"URL","Title","Description","Region"
"http://www.telemundochicago.com/noticias/salud/por-que-todos-los-recien-nacidos-aparecen-en-las-fotos-con-la-misma-sabana-287288541.html","La popular manta que cobija a los bebs","Y este hecho que haba pasado desapercibido sali a la luz gracias a las redes sociales, donde orgullosos paps presumen las imgenes de sus recin nacidos envueltos con esta icnica manta de la lnea Kuddle-Up fabricada por la empresa Medline, que&nbsp;...","Chicago, Illinois cityNdx: 2"
"http://www.techtudo.com.br/noticias/noticia/2014/08/google-science-fair-menina-de-13-anos-cria-projeto-contra-bullying.html","Google Science Fair: Menina de 13 anos cria projeto contra bullying","O bullying se caracteriza pela violncia fsica ou psicolgica intencional, praticada repetidamente por um indivduo ou um grupo. Todos os anos o bullying faz milhares de vtimas, principalmente crianas e adolescentes. Em 2013, uma jovem se suicidou ...","Chicago, Illinois cityNdx: 2"
"http://www.wsfa.com/story/26611475/toddler-continues-to-heal-from-horrific-scalding-incident","Toddler continues to heal from horrific scalding incident","Tramaine Ridgeway Jr., or TJ as he's called, is like every 2-year-old child. He's energetic and loves to play outside and watch for airplanes at his home in Opelika. Nothing stops him from doing anything he wants to do. He's very independent, said ...","Houston, Texas cityNdx: 3"
"http://www.rtl.fr/culture/web-high-tech/l-application-machine-a-ecrire-virtuelle-de-tom-hanks-cartonne-7773984581","L'application machine  crire virtuelle de Tom Hanks cartonne","Aprs nous avoir fait rire dans Forest Gump et pleurer dans Philadelphia, l'acteur amricain Tom Hanks vient de lancer une application pour iPad, baptise Hanx Writer. Cet outil transforme le clavier de votre tablette en machine  crire. Hanx Writer ...","Philadelphia, Pennsylvania cityNdx: 4"
"http://www.cbssports.com/nba/eye-on-basketball/25247500/lakers-center-roy-hibbert-too-tall-for-roller-coasters-at-six-flags","Lakers center Roy Hibbert too tall for roller coasters at Six Flags","Standing a couple inches over seven feet, Roy Hibbert is an imposing figure on a basketball court. However, Hibbert's height is not advantageous at Six Flags. TMZ caught up with the new Lakers center and asked where he would like more appropriate and&nbsp;...","Phoenix, Arizona cityNdx: 5"
"http://www.cbssports.com/nfl/eye-on-football/25250767/ravens-owner-story-circulating-that-i-put-pressure-on-nfl-is-wrong","Ravens owner: Report of him pressuring NFL over Tom Brady is wrong","If you've never experienced a football game at Allen High School in Texas, you need to watch this video. High School Headlines. Video: Another San Antonio ref assaulted · Xcellent 25 Football Scoreboard · Shock continues after 107-90 football... No ...","San Antonio, Texas cityNdx: 6"
"http://www.cbssports.com/nfl/eye-on-football/24779841/report-decision-to-start-robert-griffin-iii-driven-by-ownergm","Report: Decision to start Robert Griffin III driven by owner/GM","Redskins quarterback Robert Griffin III returns to the lineup Sunday against the Vikings for the first time since Week 2 when he suffered a dislocated ankle. In those six games, backup Kirk Cousins played himself out of a job, while backup-to-the ...","San Antonio, Texas cityNdx: 6"
"http://www.ocregister.com/articles/clown-508718-clowns-lucia.html","Training, makeup and a smile: How to be a volunteer clown","Lucia has been clowning for the better part of three decades with volunteer organizations throughout Southern California. She joined ... The organization attends more than 250 events per year, according to one of its officers, Jane Kuddles Martin ...","San Diego, California cityNdx: 7"
"http://www.telemundodallas.com/noticias/salud/por-que-todos-los-recien-nacidos-aparecen-en-las-fotos-con-la-misma-sabana-287288541.html","La popular manta que cobija a los bebs","Y este hecho que haba pasado desapercibido sali a la luz gracias a las redes sociales, donde orgullosos paps presumen las imgenes de sus recin nacidos envueltos con esta icnica manta de la lnea Kuddle-Up fabricada por la empresa Medline, que&nbsp;...","Dallas, Texas cityNdx: 8"
"http://globalgrind.com/2012/07/14/kanye-kim-k-kuddle-dash-la-store-opening-photos/","Kanye &amp; Kim K. Kuddle Up For The DASH LA Store Opening (PHOTOS)","The Kardashian's DASH store reopened in LA yesterday, and tons of fans came out to get a glimpse of the store, the sisters, and a surprise guest by the name of Kanye West. The sisterly trio was without one musketeer as Kourtney is still taking care of ...","San Jose, California cityNdx: 9"