"URL","Title","Description","Region"
"http://www.mobileworldlive.com/apps/news-apps/instagram-kids-kuddle-kicks-funding-drive/","Instagram for Kids Kuddle kicks off funding drive","Kuddle, a Norwegian start-up offering a safe picture-sharing app aimed towards children, took to crowdfunding site Fundable in its efforts to raise $1.35 million. The company said that while it is extremely popular in its home market of Scandinavia ...","World wide"
"http://www.businesswire.com/news/home/20150610006172/en/Lingo-Media-Group-Kuddle-Instagram-Kids-Opened","Lingo Media Group: Kuddle the Instagram for Kids Have Opened up Its 2nd Round ...","The 2nd round of funding values the company at $4.5 million before the issue of new shares, and Kuddle is using the crowdfunding platform Fundable.com (https://www.fundable.com) for this round. This is a great investment opportunity and a low entry ...","World wide"
"http://www.crowdfundinsider.com/2015/01/61070-norway-based-kuddle-announces-new-crowdfunding-campaign-seeks-raise-4-7-million/","Norway-Based Kuddle Announces New Fundable Campaign; Seeking to Raise $4.7M","Explaining the details about the campaign, chief executive of Kuddle, Ole Vidar Hestaas stated, We feel this is an exciting way to raise capital. We have had serious talks with major venture funds but have decided to grow the company somewhere more&nbsp;...","World wide"
"http://www.reuters.com/article/2015/01/14/us-apps-issue-kuddle-idUSKBN0KN1MJ20150114","Norway's Kuddle plans to raise $7.4 million through crowdfunding","Launched last August, Kuddle lets parents monitor what their children publish and keeps access to content restricted. The firm missed a target of attracting one million users by the end of 2014, but says it's on track to hit that number within the next ...","World wide"
"http://www.fredericksburg.com/features/now-everyone-can-have-a-kuddle-up-baby-blanket/article_f9cf590f-baeb-5feb-adea-d6700c1635e6.html","Now everyone can have a Kuddle Up baby blanket","It's kind of taken on this life of its own, said Tim Abate, president of textiles division for Medline Industries, where longtime employees have been tickled by the recent attention lavished on its Kuddle Up blanket, from heartfelt Facebook posts to ...","World wide"
"http://www.fastcompany.com/3034570/fast-feed/this-is-kuddle-the-instagram-for-kids","This Is Kuddle, The Instagram For Kids","Did you know that there is an Instagram for kids? It's called Kuddle, and the photo-sharing application was designed by developers in Norway who built the thing with the noblest of intentions. It's designed, first and foremost, to teach kids manners ...","World wide"
"http://qz.com/280475/why-every-newborn-you-see-on-facebook-is-wrapped-in-the-same-baby-blanket/","Why every newborn you see on Facebook is wrapped in the same baby blanket","The blanket is part of the Kuddle-Up line made by a Mundelein, Illinois-based healthcare supply company called Medline. The company was started in 1910 by A.L. Mills, an Arkansan who moved to Illinois and made his living creating butcher aprons for&nbsp;...","World wide"
"http://www.prnewswire.com/news-releases/introducing-kuddle-a-new-picture-sharing-app-especially-designed-for-kids-270312091.html","Introducing Kuddle, a New Picture Sharing App Especially Designed for Kids","Kuddle offers users features to educate children about things such as inclusion, responsibility, and online etiquette  otherwise known as netiquette. The app features a character  Kodi Kuddle  who befriends all users by default and regularly sends&nbsp;...","World wide"
"http://www.digitaltrends.com/photography/photo-app-news-kuddle-instagram-kids-looksee-brings-photographers-together/","Kuddle is an Instagram for kids, while Looksee brings photographers together","Kuddle is a photo sharing app for kids of all ages, intended to create a safe environment where kids can share their photos without the risk of being bullied. In a sense, Kuddle is a bit of an Instagram for kids, with the difference that it allows the ...","World wide"
"http://www.independent.ie/style/celebrity/a-khristmas-kuddleup-for-bruce-jenner-who-attends-ex-wifes-kris-jenners-festive-party-30862815.html","A Khristmas Kuddle-Up for Bruce Jenner who attends ex wife's Kris Jenner's ...","Former Olympian Bruce (65) was a surprise appearance at Kris' annual Christmas Eve shindig at her Hidden Hill California home. Bruce posed for a picture with daughters Kylie and Kendall at the party, that also saw Kim Kardashian, Kanye West and Khloe&nbsp;...","World wide"
"http://philadelphia.cbslocal.com/2014/08/26/parents-keep-an-eye-on-the-pics-kids-share-with-kuddle/","Parents Keep An Eye On The Pics Kids Share With Kuddle","Kuddle was designed specifically for children but lets parents monitor what their children publish and keeps access to content restricted, preventing strangers from seeing and sharing pictures. If a kid is going to be sharing pictures anyway, this is ...","World wide"
"http://www.arcticstartup.com/article/norways-kuddle-does-safe-social-networking-for-kids-under-13","Norway's Kuddle does safe social networking for kids under 13","While most social media networks have a minimum age requirement of 13, Kuddle provides a safer entry to social media for kids below this age. It aims to create a safer digital environment for children, while enhancing their knowledge about responsible&nbsp;...","World wide"
"http://bits.blogs.nytimes.com/2014/09/13/toward-a-childproof-internet/","Toward a Childproof Internet","Ole Vidar Hests, one of Kuddle's founders and its chief executive, said that he got the idea for the service when his youngest son, then 6, asked to sign up for Instagram after observing his older sisters use the service. Mr. Hests felt his son was ...","World wide"
"http://www.techweekeurope.co.uk/workspace/kuddle-microsoft-child-friendly-tablet-153059","Kuddle To Partner Microsoft For Child Friendly Tablet","A Norwegian company called Kuddle, the creator of a child friendly photo-sharing app, will team up with Microsoft to develop a new tablet device. Kuddle reportedly plans, in conjunction with Redmond, to develop the child safe tablet device in time for&nbsp;...","World wide"
"http://www.chicagotribune.com/suburbs/mundelein/ct-baby-blanket-sensation-met-20150126-story.html","Mundelein-based company to sell iconic hospital blankets on Amazon","It's kind of taken on this life of its own, said Tim Abate, president of textiles division for Medline Industries, where longtime employees have been tickled by the recent attention lavished on its Kuddle Up blanket, from heartfelt Facebook posts to ...","World wide"
"http://www.dn.no/etterBors/2015/05/04/2158/Medier/kuddlegrnder-i-pengetrbbel","Kuddle-grnder i pengetrbbel","Den norske bildedelingsappen Kuddle er blitt omtalt som Instagram for barn, og har golfstjerne Suzann Tutta Pettersen og Schibsted-arving Wibecke Nagell-Erichsen blant eierne. Appen gir imidlertid ikke penger i kassen, og har samlede inkassokrav p&nbsp;...","World wide"
"http://www.aftenposten.no/digital/Reagerer-pa-reklamelignende-bilder-pa-barne-appen-Kuddle-508839_1.snd","Reagerer p reklamelignende bilder p barne-appen Kuddle","Den norske billeddelingstjenesten Kuddle, som gjerne omtaler seg som Instagram for barn, har et uttalt ml om  skape et trygt og lrerikt digitalt milj hvor barn og unge tenringer kan lre om og utforske den stadige voksende verden av sosiale ...","World wide"
"http://www.reuters.com/article/2014/09/29/us-software-kuddle-idUSKCN0HO0WT20140929","Norwegian Instagram rival to launch child safe tablet with Microsoft","OSLO Kuddle, a Norwegian picture sharing app designed for children, plans to launch a child safe tablet with Microsoft on Dec 1, and expects to sign funding deals with several venture capital firms within weeks, its chief executive said on Monday.","World wide"
"http://www.theblaze.com/stories/2014/10/23/ever-notice-that-all-those-newborn-pictures-on-facebook-seem-to-show-the-same-blanket-heres-why/","Ever Notice That All Those Newborn Pictures on Facebook Seem to Show the Same ...","Just as we began to standardize the process of birth, we began to standardize the post-partum experience, too, such that the newborn photo in the Kuddle-Up blanket is, at this point, an instant signifier. Thousands of new parents, and even ...","World wide"
"http://www.sugarscape.com/celebs/news/a964526/kim-kardashian-and-kanye-west-kuddle-up-at-kings-cross-station-london-pics/","Kim Kardashian and Kanye West kuddle up at Kings Cross station, London - PICS","As Kim Kardashian and Kanye West stepped out in Paris to catch their Eurostar train to London, they were looking so cute that we almost forgot that we swore to never forgive Kanye for his Taylor Swift stage storming. The usually pretty grumpy Monsieur ...","World wide"
"http://www.chicagobusiness.com/article/20150128/CRED03/150129815/campus-purchase-lets-medline-blanket-lake-county","Campus purchase lets Medline blanket Lake County","Medline sells thousands of products, including wheelchairs and exam gloves. The company recently disclosed plans to sell its Kuddle Up blanketsknown to parents for the typically blue and pink stripes they first see their newborn wrapped indirectly ...","World wide"
"http://www.deutschlandradiokultur.de/der-rote-jochen-alias-kuddle-schnoeoef-wenn-politiker-die.1001.de.html?dram:article_id=310093","Der rote Jochen alias Kuddle Schnf Wenn Politiker die Wahrheit sagen","Der rote Jochen alias Kuddle SchnfWenn Politiker die Wahrheit sagen. Von Ralf Bei der Kellen. Der Landesvorsitzende der SPD in Schleswig-Holstein, Jochen Steffen, aufgenommen am Tag der schleswig-holsteinischen Landtagswahl am 25. April 1971&nbsp;...","World wide"
"http://www.nydailynews.com/life-style/fashion/baby-blanket-rocks-article-1.1786512","Still perfect for Mother's Day  and their babies: The blanket that wraps ...","All of the blankets are part of the Kuddle Up line from Medline, a medical supply firm based in Mundelein, Ill. The company sells about 200,000 of the blankets annually to the city, where about 125,000 babies are born each year. Clearly, lots of moms ...","World wide"
"http://www.dagbladet.no/2015/01/18/nyheter/okonomi/hegnarno/it/37240086/","Tar kjapp gevinst p instagram for barn","Under ett r etter oppstarten av Kuddle prises Ole Vidar Hestaas bildedelingstjeneste Kuddle til 220 millioner kroner. yvind Lillestrm Knudsen oyvind.lillestrom.knudsen@hegnar.no. sndag 18. januar 2015, kl.11:22&nbsp;...","World wide"
"http://www.techtudo.com.br/dicas-e-tutoriais/noticia/2014/09/como-usar-o-kuddle-o-instagram-para-criancas.html","Como usar o Kuddle, o Instagram para crianas?","O Kuddle, a rede social infantil para compartilhar fotos, j ganhou verso em portugus, simplificando a vida tanto dos pequenos quanto de seus pais e responsveis. Conhea todos os recursos para garantir um ambiente seguro para seus filhos neste guia&nbsp;...","World wide"
"http://nhpr.org/post/12015-fact-checking-sotu-digital-hoarding-baby-blanket-standard","1.20.15: Fact Checking The SOTU, Digital Hoarding, &amp; The Baby Blanket Standard","How the Kuddle-Up Blanket Became the Swaddling Standard. The Kuddle-Up line of baby blankets is made by a healthcare supply company in Illinois, manufactured in Pakistan, and for years, has been swaddling newborns the world over. The writer Lisa&nbsp;...","World wide"
"http://www.dailymail.co.uk/sport/football/article-3187077/Radamel-Falcao-praises-friendly-Chelsea-team-mates-helping-new-home-settles-London-loan-move.html","Radamel Falcao praises 'friendly' Chelsea team-mates","Radamel Falcao believes the good atmosphere within the Chelsea dressing room has helped him adjust to his new surroundings quickly. The Colombia striker, who endured a miserable loan spell at Manchester United last season, joined Jose Mourinho's&nbsp;...","World wide"
"http://www.knoxnews.com/knoxville/life/chicago-company-to-sell-iconic-hospital-blankets-to-public_61444821","Chicago company to sell iconic hospital blankets to public","Longtime employees have been tickled by the recent attention lavished on its Kuddle Up blanket, from heartfelt Facebook posts to its own Twitter handle, https://twitter.com/#kuddleup. The company plans to release its product on Amazon.com and is still&nbsp;...","World wide"
"http://www.innovationexcellence.com/blog/2015/03/09/innovation-psychology-%E2%80%93-6-big-innovation-opportunities-from-life-changes/","Innovation Psychology  6 Big Innovation Opportunities from Life Changes","Or in a majority of new baby photos on Facebook, the newborn is wrapped in the same blanket, supplied by Kuddle Up?2 Is this a missed collaboration or co-branding opportunity for Diaper or Baby Food manufacturers? All of these approaches reinforce and&nbsp;...","World wide"
"http://www.thenational.ae/arts-lifestyle/family/rules-to-follow-when-it-comes-to-children-and-social-media","Rules to follow when it comes to children and social media","The organisation Common Sense Media, which provides information, guidelines and advice on children using social media, recommends sites such as Yoursphere or Fanlala. It also recommends Kuddle as a quality Instagram substitute. It also recommends&nbsp;...","World wide"
"https://www.dn.no/tekno/2014/08/07/1956/Sosiale-medier/norske-kuddle-er-instagram-for-barn","Norske Kuddle er Instagram for barn","I tillegg til Nagell-Erichsen har Kuddle ftt med seg Henning glnd, Suzann Pettersens familieselskap Gat Invest og partner i Reiten &amp; Co., Kathryn M. Baker.  Bde som investor og mor fikk jeg veldig sans for denne ideen, og valgte derfor  bidra ...","World wide"
"http://www.crowdfundinsider.com/2014/12/58755-xoeye-technologies-announces-2-million-series-round-fuel-hiring-company-expansion-enterprise-wearables-market/","XOEye Technologies Announces $2 Million Series A Round to Fuel Hiring ...","XOEye Technologies, a enterprise wearables solutions company that is reshaping industrial business processes, announced on Monday (December 8th) the commitment of $1.5 million towards its $2 million Series A funding round. The financing round, which&nbsp;...","World wide"
"http://www.famili.fr/,kuddle-l-appli-inspiree-d-instagram-speciale-enfant-arrive,450074.asp","Kuddle : l'appli inspire d'Instagram spciale enfant arrive","Pour remdier  cela, des concepteurs ont mis au point Kuddle. Spcialement conu pour les plus jeunes, ce site de partage permet aux enfants de publier leurs photographies  un nombre de contacts limit. Les petits utilisateurs peuvent, comme sur le&nbsp;...","World wide"
"http://www.repubblica.it/tecnologia/2014/09/09/news/kuddle_l_instagram_dei_bambini_e_i_big_del_web_puntano_sugli_under_13-94385360/","Kuddle, l'Instagram dei bambini. E i big del web puntano sugli under 13","Kuddle, l'Instagram dei bambini. E i big del web puntano sugli under LA VERA campagna d'autunno si giocher sui bambini. No, non tanto nell'ambito delle applicazioni generiche, ludiche o formative. Di quel genere ce ne sono moltissime, alcune delle ...","World wide"
"http://chicago.cbslocal.com/2014/10/24/why-you-seen-newborns-wrapped-in-the-same-baby-blanket/","Why You See Newborns Wrapped In The Same Baby Blanket","It's called the Kuddle Upa flannel blanket with both pink and blue stripes in the center. It was designed by a Mundelein, Ill., company called Medline. When the blanket was created in the 1950s, the company was called A.L Mills. It has since morphed ...","World wide"
"http://www.tv2.no/a/6525661","Andreas (8) ble nektet Instagram  det ble starten p en norsk megasuksess","Andreas spurte meg flere ganger, men jeg syntes han var for ung. S begynte jeg  tenke p at det mtte finnes alternativer. Plutselig en kveld poppet bde konseptet og navnet Kuddle ned i hodet p meg, sier grnder og pappa Ole Vidar Hests.","World wide"
"http://noticias.softonic.com.br/instagram-publico-infantil-kuddle","Que tal um Instagram voltado ao pblico infantil? Conheam o Kuddle","Uma desenvolvedora norueguesa chamada Kuddle est chegando ao Brasil com uma novidade interessante aos pais que querem um ambiente mais controlado para os filhos nas redes sociais. Trata-se de um aplicativo que tambm leva o nome de Kuddle&nbsp;...","World wide"
"http://gizmodo.com/who-designed-the-blanket-that-practically-every-newborn-1651287496","Who Designed the Blanket That Practically Every Newborn Gets Wrapped In?","The popularity of the little blue-and-pink striped flannel receiving blanket, from a line called Kuddle-Up, makes sense. It works for both sexes, after all, and avoids any question over what pattern to choose on the part of parents. But where did it ...","World wide"
"http://www.lavanguardia.com/tecnologia/redes-sociales/20140827/54414360786/kuddle-instagram-ninos.html","Kuddle, un Instagram para nios","No hay comentarios ni etiquetas de geolocalizacin. Se trata simplemente de compartir imgenes y evitar que sean visibles para desconocidos. As es Kuddle, una suerte de Instagram para nios ideada en Noruega, que quiere marcar la diferencia respecto&nbsp;...","World wide"
"http://www.abc.es/tecnologia/moviles-aplicaciones/20140820/abci-kuddle-instagram-ninos-201408192120.html","Kuddle, el Instagram para nios","Hace poco se conoca el proyecto de Trisha Prabhu, una nia de 13 aos que concursa en el Google Science Fair 2014, para tratar de bajar el ndice de ciberacoso. Ahora, se conoce una aplicacin real y creada por un equipo noruego que no slo quiere&nbsp;...","World wide"
"http://www.klikk.no/foreldre/barn/article923477.ece","Kuddle er Instagram for barn:","To r senere, nrmere bestemt 8. august 2014, ble appen Kuddle lansert i Norge og USA og gjort tilgjengelig i hele verden. Mindre enn en mned etter lanseringen har appen tusenvis av unge brukere verden over, og vokser med mellom 5 og 13 prosent i&nbsp;...","World wide"
"http://www.crowdfundinsider.com/2014/11/55260-power-rangers-star-amy-jo-johnson-suits-hero-costume-celebrate-indiegogo-campaign/","Power Rangers Star Amy Jo Johnson Suits Up in Hero Costume to Celebrate Her ...","Ready to share her excitement with the world over her crowdfunding campaign on Indiegogo reaching its initial $75,000 goal, Power Rangers star Amy Jo Johnson stepped out as the original pink ranger on Friday (November 7th). Johnson Pink Ranger 3&nbsp;...","World wide"
"http://www.crowdfundinsider.com/2014/12/58876-fitmark-introduces-first-crowdfunding-platform-dedicated-high-quality-gym-bag-creation/","Fitmark Introduces First Crowdfunding Platform Dedicated to High-Quality Gym ...","Fitmark, a leading bag company for fitness and sports enthusiasts, expands their e-commerce website and digital bag creation capabilities by creating new crowdfunding platform, The Playing Field. This new and creative way of utilizing the power of ...","World wide"
"http://www.fastcompany.com/3034588/second-shift/how-i-taught-my-6-year-old-to-use-the-internet-and-not-let-google-take-her-allo","How I Taught My 6&amp;Year&amp;Old To Use The Internet, And Not Let Google Take Her ...","Google is reportedly aiming to build child-friendly versions of its services, and the Instagram-for-kids app Kuddle raised millions in funding. This all suggests a move toward a Nickelodeon-ization of the Internet that allows you to plant your kid and ...","World wide"
"http://www.scriptbrasil.com.br/vida-digital/redes-sociais/kuddle-instagram-criancas.html","Kuddle: o Instagram para crianas","Criado na Noruega, o aplicativo chamado de Kuddle tem como uma de suas principais caractersticas o fato de que ele  voltado quase que exclusivamente para as crianas, o que j representa boa parte do motivo de seu sucesso, com crescimento de 15%&nbsp;...","World wide"
"http://politiken.dk/forbrugogliv/digitalt/internet/ECE2437533/far-lancerer-socialt-medie-til-smaa-boern/","Far lancerer socialt medie til sm brn","FOTOAPP. Kuddle er en ny Instagram-inspireret app til brn under 13 r, der giver mulighed for at dele billeder og lren om god digital adfrd. Den norske ivrkstter Ole Vidar Hestaas mtte skuffe sin syvrige sn, der brndende nskede sig en&nbsp;...","World wide"
"http://g1.globo.com/tecnologia/tem-um-aplicativo/noticia/2014/08/instagram-para-criancas-app-kuddle-planeja-investida-agressiva-nos-eua.html","'Instagram para crianas', app Kuddle planeja investida agressiva nos EUA","O Kuddle, um aplicativo noruegus de compartilhamento de imagens que se apresenta como um Instagram para crianas, planeja uma investida agressiva no mercado norte-americano e pode ter 1 milho de usurios at o final do ano, disse seu&nbsp;...","World wide"
"http://www.techtudo.com.br/noticias/noticia/2014/08/kuddle-o-instagram-para-criancas-chega-ao-brasil-todo-em-portugues.html","Kuddle, o Instagram para crianas, chega ao Brasil todo em portugus","Lanado h cerca de um ms, o Kuddle, Instagram para crianas, chegou em portugus ao Android nesta sexta-feira (29). A previso para os usurios de iPhone  que chegue na prxima quarta-feira (3). Tudo sobre Kuddle: Instagram para crianas usa&nbsp;...","World wide"
"http://www.crowdfundinsider.com/2014/10/53654-watch-marty-mcfly-back-future-inspired-hoverboard-smashes-250000-goal-less-two-days-kickstarter/","Watch Out, Marty McFly! Back to the Future Inspired Hoverboard Smashes ...","It's FINALLY happening! On Tuesday (October 21st), an ACTUAL hoverboard officially hit the crowdfunding giant, Kickstarter! Not only has it become super popular with the Back to the Future fans (myself included), it has also achieved its initial $250 ...","World wide"
"http://www.mimifroufrou.com/scentedsalamander/2015/04/new_french_company_creates_olfactory_links.html","New French Company Creates Olfactory Links with Dearly Departed &amp; Loved Ones ...","For spouses with military service men and women, for instance, it could also be a way of maintaining an affective link - in fact, Kalain, which could be translated as Kuddle in English, define their mission as the creation of olfactory links ...","World wide"
"http://andro4all.com/2014/08/kuddle-red-social-instagram-ninos","Kuddle, la nueva red social al estilo de Instagram pero para nios","Ya son muchas las redes sociales que tenemos disponibles en Internet como por ejemplo Facebook, Twitter, Instagram, Youtube, Linkedin, Google+, Flickr, etc. Para los que utilizis estas aplicaciones, deberis saber que son una forma de contacto entre&nbsp;...","World wide"
"http://www.techtudo.com.br/noticias/noticia/2014/08/kuddle-instagram-para-criancas-usa-curtidas-anonimas-e-corta-hashtags.html","Kuddle, o Instagram para crianas (Foto: Reproduo/Kuddle)","No Kuddle ns acreditamos em assumir a responsabilidade por tudo que  compartilhado online. Ns gostaramos que voc compartilhasse apenas coisas que esto diretamente associadas a voc, explicam os desenvolvedores no site do aplicativo.","World wide"
"http://www.z24.nl/ondernemen/kindvriendelijk-kuddle-bindt-strijd-aan-met-instagram-489075","'Kindvriendelijk' Kuddle bindt strijd aan met Instagram","Kuddle werft op het moment personeel in Silicon Valley. We zijn erg blij met de groei tot nu toe, zei oprichtster en topvrouw Kathryn Baker tegen Reuters. Per dag groeien we 10 tot 15 procent en de respons is goed. De app is gratis. Baker hoopt ...","World wide"
"http://www.crowdfundinsider.com/2014/09/48483-education-device-osmo-launches-new-online-platform-design-new-game-content/","Innovative iPad Game Device Osmo Launches MyOsmo so Anyone Can Create Games","Osmo launched their cool hardware gaming device for kids earlier this year. Created by ex-Googlers, Osmo paired slick technology with the Apple iPad to engender an educational and interactive gaming device for kids (and adults). Osmo is an alternative ...","World wide"
"http://www.techtimes.com/articles/13447/20140819/google-prepping-a-google-just-for-kids.htm","Google may be prepping Gmail service just for kids","It follows the successful Instagram for kids, or Kuddle, that allows parents oversight and better control of what their children are viewing on the photo sharing service. The company has raised $2 million for expansion across the U.S. recently ...","World wide"
"http://fr.ubergizmo.com/2014/08/21/kuddle-est-instagram-pour-les-enfants.html","Kuddle est Instagram pour les enfants","Kuddle est en fait une app de mdia social comme Instagram, sauf qu'elle a t spcialement conue pour les enfants. L'ide a germ dans la tte du co-fondateur dont les deux enfants voulaient tre sur Instagram, mais leur pre pense qu'ils taient un ...","World wide"
"http://www.europapress.es/portaltic/software/noticia-red-social-kuddle-ensena-ninos-combatir-ciberacoso-20140820111318.html","La red social Kuddle ensea a los nios a combatir el ciberacoso","Kuddle, considerada como el Instagram de los ms pequeos, es la nueva aplicacin gratuita para nios creada por un equipo de desarrolladores noruegos con la que pretenden evitar el ciberacoso y de paso inculcar buenos modales en las redes.","World wide"
"http://www.crowdfundinsider.com/2014/09/50167-philadelphia-company-launches-indiegogo-campaign-first-smart-patch-thermometer-reaches-34000-two-days/","Philadelphia Company Launches Indiegogo Campaign For First Smart Patch ...","Ready to create a new way to check for fevers, Philadelphia-based company Fever Smart launched a $40,000 Indiegogo crowdfunding campaign for a thermometer for children. The device is considered a smart patch that will keep an eye on any child's&nbsp;...","World wide"
"http://www.huffingtonpost.ca/2015/05/01/baby-blankets-hospital_n_7027732.html","Baby Blankets: Why Every Newborn Is Wrapped In The Same Blanket","It's soft. It's cottony. It's primarily a creamy white colour and sports thin stripes in blue and pink. You've seen this receiving blanket in hospitals. You've seen friends' babies swaddled in it on Facebook and Instagram. Maybe a maternity-ward nurse ...","World wide"
