"URL","Title","Description","Region"
"http://www.cnn.com/2015/03/25/us/california-woman-kidnapped-ransom/","California woman found safe two days after alleged kidnapping","About 48 hours later, she was located an hour south of Los Angeles. Officers from the Huntington ... And one thing that people know about me is that I went to my first concert, me and my mom, to Blink 182 (last word is inaudible): The editor in chief ...","Los Angeles, California cityNdx: 1"
"https://www.whitehouse.gov/the-press-office/2014/10/09/remarks-president-town-hall-innovation-los-angeles-california","Remarks by the President in a Town Hall on Innovation -- Los Angeles, CA","There are a couple of people here who I want to acknowledge because they are encouraging this kind of startup culture here in the Los Angeles, which has really gotten going. We've got Mayor Eric Garcetti in the house. Where did he go? (Applause.) There ...","Los Angeles, California cityNdx: 1"
"http://www.latimes.com/local/politics/la-me-pol-california-politics-20150301-story.html","Jerry Brown's popularity as governor doesn't extend to a presidential race","In a new USC Dornsife-Los Angeles Times poll, Brown has zoomed in popularity. He is now ... I don't care what you say about me.... But you ... Overall, California voters sided with Hillary Clinton over Brown 49% to 26%, and 20% sided with neither ...","Los Angeles, California cityNdx: 1"
"http://www.latimes.com/local/california/la-me-0124-banks-medical-woes-20150124-column.html","Readers weigh in on the sad state of medical care","Another reader told me he doesn't mind making the two-hour drive from Ventura to Long Beach for an appointment with his doctor because he knows everything about me, and we just like talking golf and hiking. I heard from a woman visiting from Hawaii ...","Los Angeles, California cityNdx: 1"
"http://www.forbes.com/sites/davidhochman/2015/03/19/rogers-and-hammersteins-cinderella-takes-stage-in-los-angeles/","Rodgers And Hammerstein's Cinderella Takes Stage in Los Angeles","Rodgers &amp; Hammerstein &amp; Drescher? Not exactly a classic trio but then the musical stage version of Cinderella that opened last night at the Center Theatre Group/Ahmanson Theatre is unconventional all around. Nasal-toned comedian Fran Drescher reprises&nbsp;...","Los Angeles, California cityNdx: 1"
"http://www.kirotv.com/news/news/marshawn-lynch-turkish-media-i-was-expecting-ball/nkLws/","Marshawn Lynch to Turkish media: 'I was expecting the ball'","LOS ANGELES, CA - MAY 19: Running back, Marshawn Lynch #23 of the Buffalo Bills poses for a portrait at the 2007 NFL Players Rookie Premiere on May 19, 2007 at the Los Angeles Memorial Coliseum in Los Angeles, California. (Photo by Nick&nbsp;...","Los Angeles, California cityNdx: 1"
"http://www.latimes.com/local/california/la-me-beat-holocaust-friendship-20141207-story.html","Holocaust survivor's chilling tale prompts bond with young German mom","It is Burkhardt's first visit to Los Angeles, but leave the city's sights for others. She and Lebovics prefer to drink tea and share stories ... Somebody caring about me, it was overwhelming, Lebovics said in the video. Burkhardt felt a need to ...","Los Angeles, California cityNdx: 1"
"http://www.thedailybeast.com/articles/2015/04/24/preach-chris-rock-why-black-people-can-t-get-into-baseball.html","Preach, Chris Rock: Why Black People Cant Get Into Baseball","Host Chris Rock speaks during the 2014 BET Awards in Los Angeles, California June 29. Mario Anzuoni/Reuters .... This has never been about me, this is about the pain of the families, Jones told The Daily Beast. He said he had been in contact with ...","Los Angeles, California cityNdx: 1"
"http://www.nbclosangeles.com/news/local/cal-state-northridge-csun-student-missing-car-craigslist-276201881.html","Bring My Brother Back: SoCal Student Missing After Craigslist Car Deal","... continued to search for him Monday, days after he made a deal to sell his car on Craigslist, family members and police said. Abdullah Abdullatif Alkadi, a student at California State University, Northridge, was last seen Sept. 17 at his home in the ...","Los Angeles, California cityNdx: 1"
"http://www.latimes.com/sports/clippers/clippersnow/la-sp-cn-chris-paul-doubtful-rockets-game-2-20150506-story.html","Chris Paul considered doubtful to play in Game 2 against Rockets","Chris Paul said his strained left hamstring was feeling better Wednesday, but Clippers Coach Doc Rivers said he doubted that his star point guard would play in Game 2 of the Western Conference semifinals. lRelated Houston Rockets say they'll be ready ...","Los Angeles, California cityNdx: 1"
"http://www.nbclosangeles.com/news/local/McDonnell-Wins-Sheriffs-Race-281552491.html","McDonnell Wins Sheriff's Race","Jim McDonnell, the Long Beach chief of police, was projected to win the race for Los Angeles County sheriff, marking the first time in a century that a sheriff was elected from outside the department. Beverly White reports from downtown Los Angeles for ...","Los Angeles, California cityNdx: 1"
"http://www.nbclosangeles.com/news/local/Dad-Charged-After-Son-Takes-Unsecured-Gun-284922561.html","Dad Charged After Son Takes Unsecured Gun","The prosecution stems from an incident in September when City Attorney Mike Feuer said a 14-year-old boy took his dad's gun and brandished it in front of three teens he had recently had a conflict with near Carver Middle School in South Los Angeles.","Los Angeles, California cityNdx: 1"
"http://www.timesunion.com/news/article/EXCHANGE-Artistic-director-encourages-diversity-6325455.php","EXCHANGE: Artistic director encourages diversity with ballet","I used to want the same roles as other dancers, he said, but as I went along in my career, I realized that this production offered that pinnacle role for me. Anderson, 38, started dancing when ... Anderson became a member of Columbia City in 2007 ...","Chicago, Illinois cityNdx: 2"
"http://www.chicagotribune.com/sports/highschool/ct-spt-0609-prep-football-jones-panasiuk-msu-20150608-story.html","Football: Evanston's Naquan Jones, Lake Park's Mike Panasiuk pick Michigan ...","I think it played out well. Jones added his name to a rapidly growing list of Chicago-area juniors to commit orally to the Spartans during a ceremony Monday outside Evanston Township High School. Panasiuk committed to Michigan State on Monday morning ...","Chicago, Illinois cityNdx: 2"
"http://www.news-gazette.com/sports/prep-sports/boys-basketball/2015-06-13/college-basketball-extra-williams-regaining-focus.html","College basketball extra: Williams regaining focus","I don't look for the criticism. If somehow it reaches me and I see it, it'll pop up on my screen or something, I use that as motivation, of course, he said. At the end of the day I've got to worry about me, work on my game and just keep getting ...","Chicago, Illinois cityNdx: 2"
"http://chicago.suntimes.com/blackhawks-hockey/7/71/678413/blackhawks-havent-led-stanley-cup-final","Blackhawks haven't led much of the Stanley Cup Final","Jonathan Toews #19 of the Chicago Blackhawks crahes into the net against Ben Bishop #30 of the Tampa Bay Lightning during Game Three of the 2015 NHL Stanley Cup Final at the United Center on June 8, 2015 in Chicago, Illinois. (Photo by .... I'm living ...","Chicago, Illinois cityNdx: 2"
"http://www.freep.com/story/life/advice/2015/06/09/amy-dickinson-hurt-daughter-must-accept-dads-limitations/28750587/","Hurt daughter must accept dad's limitations","He comes to my home, takes me to dinner every couple of months and then seems to forget about me until I call and ask how he's doing. I've always had to put in the effort and forgive and forget, but he's always told me that if ever I needed him, he ...","Chicago, Illinois cityNdx: 2"
"http://www.chicagotribune.com/sports/highschool/ct-spt-0607-prep-athlete-of-month-kahmari-20150606-story.html","Tribune/WGN-9 Athlete of the Month: Plainfield Central's Kahmari Montgomery","But his main thought was of his mother, LaShawn Payton, and where to locate her among the crowd at O'Brien Stadium. I wanted to find my mom, said Montgomery, the Tribune/WGN-9 Preps Plus Athlete of the Month for May. When I saw the tears of joy on&nbsp;...","Chicago, Illinois cityNdx: 2"
"http://herald-review.com/high-school/mf/kreps-will-take-over-at-maroa/article_5dae4418-67f5-5285-be9d-9632d9e565c1.html","Kreps will take over at Maroa","It's not about me anymore. I've had so many people invested in me my whole life. Now I get a chance to invest in the kids, to be a good role model. The hiring ends a long replacement process for Maroa. The school board voted down the administration's ...","Chicago, Illinois cityNdx: 2"
"http://www.chicagonow.com/public-affairs-with-jeff-berkowitz/2015/06/the-five-things-you-should-know-about-speaker-hasterts-arraignment-the-players-hastert-avoid-prison-hastert-overcharged-a-trial-judge-durkin-disqualified/","The five things you should know about Speaker Hastert's arraignment: The ...","1. The man who put Yorkville, IL, population 18,000, on the map: The Coach and accidental Speaker, Denny Hastert, flanked by his lawyers, local counsel John Gallo, 55, (Senior Litigation /White Collar Partner at Sidley Austin's Chicago office; 24 ...","Chicago, Illinois cityNdx: 2"
"http://www.chicagotribune.com/sports/basketball/ct-nba-combine-spt-0517-20150516-story.html","Frank Kaminsky and Cliff Alexander are years and worlds apart","Before this week's NBA draft combine, the clumsy-turned-savvy Kaminsky determined  because it's hard to top being National Player of the Year  it was in his best interest to skip the combine workouts at the Quest Multisport Complex on Chicago's ...","Chicago, Illinois cityNdx: 2"
"http://chicagoinno.streetwise.co/2015/05/19/chicago-inno-beat-519-chip-heist-uberespanol-grubhub-comedy/","Chicago Inno Beat 5/19 - Chip Heist, UberESPAOL, GrubHub Comedy ...","From Founder Equity's Joe Dwyer (professor at Northwestern University's Kellogg School of Management) to Adeptia CEO Lou Ennuso (adjunct lecturer at University of Illinois-Chicago's school of business), these Chicago innovators are helping cultivate ...","Chicago, Illinois cityNdx: 2"
"http://www.denverpost.com/askamy/ci_28245937/ask-amy-will-family-tag-sale-turn-into","Ask Amy: Will family tag sale turn into greedy grab fest? (06/04)","Dear Amy: My husband and I are scaling back on our personal possessions. We plan to have an estate sale in a month. My wish is to donate the proceeds from the sale to a local charity or to our late son's alma mater. We want to invite our many cherished&nbsp;...","Chicago, Illinois cityNdx: 2"
"http://www.goupstate.com/article/20150607/PSPORTS02/150609787","Gamecock basketball adds 6-7 forward","Doby picked the Gamecocks over the University of Illinois at Chicago, Bradley and DePaul. He also took an official visit to Bradley and ... Being able to play inside and out I think really sticks out about me, he said. And being my size, 6-8, 6-7 ...","Chicago, Illinois cityNdx: 2"
"http://qctimes.com/high-school/rock-island/rocky-senior-s-spirit-transcends-tumultuous-year/article_12d7bcde-7b7e-5b91-9190-1a68bdde571d.html","Rocky senior's spirit transcends tumultuous year","But at least I have my foot, Gbeddeh said as the smile reappeared across his face. The injury has taken away Gbeddeh's explosive athletic ability, but his .... After Gbeddeh returned to Rock Island, his mother went to a Chicago-area hospital for a ...","Chicago, Illinois cityNdx: 2"
"http://www.freep.com/story/life/advice/2015/05/21/controlling-mother-versus-controlling-spouse/27720815/","Don't trade controlling mother for a controlling spouse","Dear Amy: Ever since my fianc proposed to me, my mother has let it be known that if she had it her way, I wouldn't be marrying him. We both work in the nonprofit field. We will not be wealthy, but I feel that we will be able to have a financially ...","Chicago, Illinois cityNdx: 2"
"http://patch.com/illinois/evanston/transgender-series-focused-evanston-teens-parent-debuts-monday-0/","Transgender Series Focused on Evanston Teen's Parent Debuts Monday","The first episode puts awkward situations in the forefront, according to the Chicago Tribune. The teenagers take their parents bra shopping and Lehwald's stepdaughter Sutton Crawford wonders what role Lehwald will have in her upcoming wedding now&nbsp;...","Chicago, Illinois cityNdx: 2"
"http://www.chicagotribune.com/suburbs/post-tribune/opinion/quickly/ct-ptb-quickly-st-0608-20150608-story.html","Quickly: 'I have reached my limit with these hatemongers'","His broadcasts with Steve Stone have brought home how bad it is to listen to Ken it's all about me Harrelson. This should be a wake-up call to Comcast. I am pretty sure that you don't get to speak for God. Keep your distorted views to yourself. I ...","Chicago, Illinois cityNdx: 2"
"http://www.mercurynews.com/bay-area-living/ci_28099086/ask-amy","Ask Amy: My mom doesn't enjoy my kids. Should I stop trying?","It hurts a lot that she does not care about me or her brother. It has been months since she has spoken ... You two could use a fresh start. Send questions to askamy@tribune.com or Ask Amy, Chicago Tribune, TT500, 435 N. Michigan Ave., Chicago, IL 60611.","Chicago, Illinois cityNdx: 2"
"http://patch.com/illinois/libertyville/transgender-series-focused-teens-parent-debuts-monday-0/","Transgender Series Focused on Teen's Parent Debuts Monday","The first episode puts awkward situations in the forefront, according to the Chicago Tribune. The teenagers take their parents bra shopping and Lehwald's stepdaughter Sutton Crawford wonders what role Lehwald will have in her upcoming wedding now&nbsp;...","Chicago, Illinois cityNdx: 2"
"http://www.forbes.com/sites/brianrashid/2015/06/03/how-to-become-a-ted-speaker/","How To Become A TED Speaker","Every year, we would meet for dinner in New York City and then again in Chicago. We meet on Christmas night at the Taylor's house. I spent ... They did not care about me. They did not care about my success. At all. One night in New York City, a group ...","Chicago, Illinois cityNdx: 2"
"http://www.boxinginsider.com/headlines/boxing-insider-notebook-khan-tyson-pacquiao-mayweather-froch-and-more/","Boxing Insider Notebook: Khan, Tyson, Pacquiao, Mayweather, Froch, and more","On Friday, June 12th at the UIC Pavilion in Chicago, Illinois Cuban boxer Erislandy Lara (20-2) will face Delvin Rodriguez (28-7-4) on Premier Boxing Champions (PBC) on Spike in the main event of the evening. The undercard will feature Artur Beterbiev&nbsp;...","Chicago, Illinois cityNdx: 2"
"http://www.nola.com/crime/index.ssf/2015/05/will_new_focus_on_rape_kit_tes.html","Will new focus on rape kit tests put thousands behind bars?","I was very young and naive. Nearly a decade had passed when the prosecutor's office called to notify Alexenko her rape kit would be tested. I waited nine-and-half years for someone to tell me I mattered and they were still thinking about me, she ...","Chicago, Illinois cityNdx: 2"
"http://www.mercurynews.com/bay-area-living/ci_28051297/ask-amy-committed-open-relationship","Ask Amy: He says a relationship can be committed and open","However, when I pushed for more of a commitment, he informed me that he has been in open relationships with friends regularly. ... Send questions to askamy@tribune.com or Ask Amy, Chicago Tribune, TT500, 435 N. Michigan Ave., Chicago, IL 60611.","Chicago, Illinois cityNdx: 2"
"http://wtop.com/politics/2015/05/photo-shows-chicago-cops-posing-over-black-man-with-antlers/","Photo shows Chicago cops posing over black man with antlers","This photo, believed to have been taken between 1999 and 2003, provided by the Cook County Court, in Illinois, shows an image of Chicago Police Officers Jerome Finnigan, left, and Timothy McDermott, right, with an unidentified man, that was made public&nbsp;...","Chicago, Illinois cityNdx: 2"
"http://www.chicagonow.com/mom-think-poignant/2015/05/guest-post-by-jim-borman-lengthening-the-payments-paying-more-interest-kicking-chicagos-money-can-down-the-road/","Guest Post by Jim Borman: lengthening the payments, paying more interest ...","I felt that I'd just pulled the clip from the Think Tank of Mayor Emanuel who was working with his staff to resolve the ongoing budget and pension crisis in the city of Chicago. As related in today's Chicago Tribune, the mayor proposes lengthening the ...","Chicago, Illinois cityNdx: 2"
"http://www.latinopost.com/articles/18607/20150528/demi-lovato-nick-jonas-new-record-label-announced-heart-attack.htm","Demi Lovato &amp; Nick Jonas New Record Label Announced! 'Heart Attack' Singer ...","CHICAGO, IL - DECEMBER 18: Singer Demi Lovato attends 103.5 KISS FM's Jingle Ball 2014 at Allstate Arena on December 18, 2014 in Chicago, Illinois. (Photo by ... He told me he cared too much about me to watch me self-destruct. Therefore at the very&nbsp;...","Chicago, Illinois cityNdx: 2"
"http://patch.com/illinois/hinsdale/high-school-senior-skips-prom-help-homeless-starts-nonprofit","High School Senior Skips Prom to Help the Homeless, Starts Nonprofit","Many people would talk about me behind my back, saying I just did it for attention. I did do it for attention, but not attention for myself. I want to bring attention to the fact that Chicago is one of the most homeless-populated cities in America. I ...","Chicago, Illinois cityNdx: 2"
"http://pippenainteasy.com/2015/05/20/bulls-sign-jimmy-butler-maintain-core/","Chicago Bulls Can Sign Jimmy Butler To Max Contract; Maintain Core of Team","The Chicago Bulls have $58,901,869 committed to these seven players meaning they have $8,198,131 to distribute across five other contracts to fill out the roster before violating the salary cap. (I realize I'm excluding Jimmy Butler, but this is only ...","Chicago, Illinois cityNdx: 2"
"http://www.chicagonow.com/medium-rare/2015/06/dmv-survival-guide-so-you-havent-updated-your-license/","DMV Survival Guide - So You Haven't Updated your License","You can get by with an expired license for awhile in Chicago. It's a surprisingly non inhibiting problem. Sure, you'll get the occasional bouncer who calls you out, but if necessary you can always pull out the passport ego trip. For me, I only go to ...","Chicago, Illinois cityNdx: 2"
"http://www.chicagotribune.com/sports/smackblog/ct-anthony-rizzo-marky-mark-kris-bryant-2-chainz-20150517-column.html","Around town: Anthony Rizzo explains Marky Mark walk-up song; Kris Bryant on 2 ...","Heads up: The Miami Heat's Dwyane Wade and the Chicago Sky will host a basketball and cheerleading academy July 8 and 9 at Lincoln-Way Central High School in New Lenox, IL. The Sky's Elena Delle Donne and Cappie Pondexter are scheduled to&nbsp;...","Chicago, Illinois cityNdx: 2"
"http://www.chicagonow.com/open-heart/2015/05/hope-for-sale-my-first-writers-workshop-part-2/","Hope for sale: My first writer's workshop, part two","The two and a half hour drive home from my first Writer's Workshop in rush hour traffic a couple of Fridays ago gave me a lot of time to think. If I had any hope of ever becoming a novel writer before I entered that nondescript hotel meeting room in ...","Chicago, Illinois cityNdx: 2"
"http://www.theguardian.com/us-news/2015/may/17/medicaid-prisoners-healthcare-access","Ex-inmates navigate access to healthcare as many remain in Medicaid limbo","He was living in Chicago's Lincoln Park when, in 2004, he met a caseworker from Thresholds, an Illinois-based care provider for people with mental illnesses. Eventually he was coaxed ... I seen that he really cared about me, Ali said. Eleven years ...","Chicago, Illinois cityNdx: 2"
"http://www.contracostatimes.com/walnut-creek/ci_28164168/walnut-creek-kristin-anderson-leaves-strong-foundation-library","Walnut Creek: Kristin Anderson leaves strong foundation for Library Foundation","Anderson is leaving her job to move to Chicago in September. Photographed in Walnut Creek, Calif., on Tuesday, May 12, 2015. ... I don't want this article to be about me, Anderson said. I've loved collaborating with the elected people in the city ...","Chicago, Illinois cityNdx: 2"
"http://www.oakridger.com/article/ZZ/20150602/BLOGS/306029996","Here's a liberal who thinks Denny Hastert is getting a raw deal from federal ...","Tim Schenck is an Episcopal priest, husband to Bryna, father to Benedict and Zachary, and \x34master\x34 to Delilah (about 50 in dog years). Since 2009 I've been the rector of the Episcopal Parish of St. John the Evangelist in Hingham, Mass. (on the .","Chicago, Illinois cityNdx: 2"
"http://publicradioeast.org/post/my-mothers-lover","My Mother's Lover","And what about me? I want her. She's the kind of gal I'd consider marrying if I weren't already, and I haven't seen many of those. This all may seem to be written very calmly. It is fairly so, but it was not arrived at calmly. There has been a ...","Chicago, Illinois cityNdx: 2"
"http://www.chicagotribune.com/news/opinion/commentary/chi-please-dont-tell-me-i-was-lucky-to-be-adopted-20150109-story.html","Please don't tell me I was lucky to be adopted","But I was also always wondering where I came from, who I looked like, when my real birthday was and if my mother was thinking about me when I was thinking about her. Did my mother love me? And if she didn't, why not? What was wrong with me?","Chicago, Illinois cityNdx: 2"
"http://www.examiner.com/article/taylor-swift-fan-dies-emily-beazley-loses-cancer-battle-at-12","Taylor Swift fan dies: Emily Beazley loses cancer battle at 12","Taylor Swift's phone call meant the world to her young fan, who spoke about their conversation last month, telling the Chicago Tribune, She knew all about me, my favorite color, the street naming. She told me about her tour starting in Tokyo, and she ...","Chicago, Illinois cityNdx: 2"
"http://www.chicagotribune.com/entertainment/music/kot/ct-prince-pete-townshend-rolling-stones-paul-natkin-20150430-column.html","Paul Natkin's lens didn't miss a beat on Chicago concert scene","So I'd hand him cameras while I was shooting. First time I met him (when Pearl Jam first played Lollapalooza in 1992) we talked for 15 minutes. He was raving about me. 'I used to see you in front of the stage at all the shows,' and I said, 'Oh, great ...","Chicago, Illinois cityNdx: 2"
"http://www.chicagonow.com/city-me/2015/05/from-chicago-to-chebanse/","From Chicago to Chebanse","I like to live my life in the City. Everything I like to do, I can find in the City. So when circumstances present themselves, and I have to leave the City, it makes me a little nervous. I haven't always been this way. Actually, it used to be that the ...","Chicago, Illinois cityNdx: 2"
"http://www.chicagonow.com/city-me/2015/05/im-amy-ill-be-your-chicago-tour-guide/","I'm Amy, I'll be your Chicago Tour Guide!","There aren't too many things in the world better (in my opinion) than to give someone a tour of the city that you love. I had that wonderful opportunity to do that this week when there was a Graphic Artist Conference at the Hyatt Regency. Let me give ...","Chicago, Illinois cityNdx: 2"
"http://www.chicagonow.com/city-me/2015/05/22-spectacular-finds-underground-chicago/","22 spectacular things found underground Chicago","Today did not turn out like it was suppose to at all. Nope, not at all. I had wonderful plans with my God-daughter to go to the Art Institute. I was going to show her the hallowed halls of some of the greatest artists to ever live. We were going to ...","Chicago, Illinois cityNdx: 2"
"http://chicago.suntimes.com/news-chicago/7/71/437997/new-head-ohare-noise-commission-confronts-reservations","New head of O'Hare noise commission confronts reservations about her","I am fully aware  of the reservations about me because Mount Prospect is receiving less jet noise since flight paths changed in 2013 and is due for even less once the O'Hare runway overhaul is completed, Juracek said. However, she assured ...","Chicago, Illinois cityNdx: 2"
"http://www.chicagotribune.com/news/local/breaking/ct-kristin-cavallari-jay-cutler-met-20150430-story.html","Kristin Cavallari gets order of protection against Chicago man","Cavallari also said in the court filing that, the previous week, the same man was waiting in his car next to me when I left the gym and was staring at me. He asked my Pilates instructor about me and knew ... when I worked out. He had been showing up&nbsp;...","Chicago, Illinois cityNdx: 2"
"http://www.chicagotribune.com/lifestyles/books/ct-prj-miriam-ezenwa-reader-of-the-week-20150205-story.html","Reader of the Week: Miriam O. Ezenwa","... Nigeria, but now lives in Chicago by way of New York City and Madison, Wis. Miriam O. Ezenwa, Ph.D., R.N., is originally from Akokwa, Imo State, Nigeria, but now lives in Chicago by way of New York City and Madison, Wis. (By Patricia Andrews-Keenan).","Chicago, Illinois cityNdx: 2"
"http://www.chicagotribune.com/lifestyles/books/ct-prj-toni-preckwinkle-reader-of-the-week-20150129-story.html","Reader of the Week: County Board President Toni Preckwinkle","I grew up in St. Paul, Minn., and moved to Chicago in 1965 to attend the University of Chicago. I've lived here ever since. ... The issues she addresses are the same ones I deal with as president of a county government with a large jail system. I'm ...","Chicago, Illinois cityNdx: 2"
"http://www.chicagotribune.com/sports/basketball/bulls/ct-taj-gibson-bulls-spt-0222-20150221-story.html","Taj Gibson gives Bulls a charge during and after game","'There was a lot of speculation I'm frustrated (behind Pau Gasol). I'm not that kind of guy.' -- Taj Gibson. Taj Gibson: 'I'm team-first.  I've never been a guy focused on minutes. I'm about winning ' Taj Gibson might have re-charged the Bulls' up ...","Chicago, Illinois cityNdx: 2"
