"URL","Title","Description","Region"
"http://blog.mysanantonio.com/spursnation/2015/02/26/tony-parker-takes-the-heat/","Tony Parker takes the heat","TP: I can't even worry just about me. I have to worry about the team, too. That's the tough part. Because at the same time I'm trying to get my game back and trying to get teammates off, but like I said, we're not making shots and it's not really ...","San Antonio, Texas cityNdx: 6"
"http://www.mysanantonio.com/sports/article/San-Antonio-Spurs-Tim-Duncan-lands-on-ESPN-s-20-6173404.php","San Antonio Spurs' Tim Duncan lands on ESPN's 20 best athletes of the last 20 ...","ESPN.com has included Spurs legend Tim Duncan in its selection of the 20 best athletes over the past 20 years in honor of its 20th anniversary. Duncan was chosen 14th, an honor considering he placed ahead of such luminaries as Usain Bolt (16th) and&nbsp;...","San Antonio, Texas cityNdx: 6"
"http://www.mysanantonio.com/opinion/commentary/article/GOP-right-to-distrust-Univision-6041479.php","GOP right to distrust Univision","This network doesn't care about me, and  as a Hispanic who primarily watches English-language television  it doesn't speak to me. Or for me. Have Republicans really decided not to communicate with Hispanic voters? That's how Univision officials are&nbsp;...","San Antonio, Texas cityNdx: 6"
"http://www.sacurrent.com/sanantonio/can-sas-booze-scene-reach-higher-ground/Content?oid=2430077","Can SA's Booze Scene Reach Higher Ground?","Unlike San Antonio's restaurant scene, attention from the James Beard Foundation has been scant in terms of the city's drinking domain. The sole local semifinalist, Jeret ... with ops and business development. People ask about me, and I want to get there.","San Antonio, Texas cityNdx: 6"
"http://blog.mysanantonio.com/weekender/2015/02/frankie-valli-is-jersey-boys-in-the-flesh-at-majestic/","Frankie Valli is 'Jersey Boys' in the flesh at Majestic","SAN ANTONIO  Two years ago, early in the season, Diana Ross delivered one of the concerts of the year at the Majestic Theatre. On Monday, another legendary '60s singer showed that such lightning can strike twice and transcend sheer nostalgia. Frankie&nbsp;...","San Antonio, Texas cityNdx: 6"
"http://blog.mysanantonio.com/hssports/2014/11/steele-ex-texas-rb-malcolm-brown-returned-for-brennan-game/","Steele-ex, Texas RB Malcolm Brown returned for Brennan game","Now we're used to media being around and doing lots of interviews, but we weren't at that time, Lehnhoff said. He could have been a guy that said, 'Hey, this is all about me,' but he wasn't. It was always deflected. The way he handled that kind of ...","San Antonio, Texas cityNdx: 6"
"http://www.expressnews.com/news/local/article/After-fall-of-Corregidor-Aggies-mustered-to-6212646.php","After fall of Corregidor, Aggies mustered to salute the fallen","Robert Epstein, photographed with a photo of the 1946 Texas A&amp;M muster at Corregidor a day before he flies to the Philippines to dedicate a memorial to Aggies who fought on Bataan and Corregidor in 1942. ... On San Jacinto Day today, when Aggies around ...","San Antonio, Texas cityNdx: 6"
"http://www.mysanantonio.com/sports/article/Jaguars-Fowler-remains-upbeat-after-6253078.php","Jaguars' Fowler remains upbeat after season-ending injury","In the future, a year from now, we'll be all smiling again and talking about me sacking people, Fowler said. Fowler had 14  sacks in three years at Florida, including 8  last season, and was the best player on a solid defense. He didn't miss a game ...","San Antonio, Texas cityNdx: 6"
"http://www.mysanantonio.com/sports/colleges/article/Duke-s-Krzyzewski-adapts-to-1-and-done-world-6173651.php","Duke's Krzyzewski adapts to '1-and-done' world","Duke coach Mike Krzyzewski speaks with Austin Rivers during the first half against Florida State in Durham, N.C., in 2012. There was a time when Krzyzewski led Final Four teams built around players who stayed for years to grow into tournament-tested&nbsp;...","San Antonio, Texas cityNdx: 6"
"http://blog.mysanantonio.com/weekender/2015/02/diana-ross-reigns-supreme/","Diana Ross reigns supreme","Come See About Me and My World Is Empty Without You came in joyous, rapid succession. I want you to sing along with me if you know the words, said Ross before cooing the opening notes to Baby Love. Her voice still cuts through the mix ...","San Antonio, Texas cityNdx: 6"
"http://smmercury.com/2014/12/18/qa-fujimoto-blazes-trail-with-san-antonio-symphony-orchestra/","Q&amp;A: Akiko Fujimoto blazes trail with San Antonio Symphony Orchestra","For Reporting Texas. The San Antonio Symphony Orchestra grabbed headlines in October 2011 when it announced it would hire Akiko Fujimoto as its assistant conductor, the first woman to officially pick up a baton for the 75-year-old organization. ... A ...","San Antonio, Texas cityNdx: 6"
"http://gawker.com/a-letter-from-arnold-prieto-who-was-executed-in-texas-1684933658","A Letter From Arnold Prieto, Who Was Executed in Texas on January 21","During that time I was living in Carrollton Texas and the murders were commited in San Antonio Texas, some 4 hours away from where I lived. The 3 elderly people ... I could not understand as to why this was being said to about me. There were some ...","San Antonio, Texas cityNdx: 6"
"http://www.sacurrent.com/sanantonio/savage-love-only-the-lonely/Content?oid=2361971","Savage Love: Only the Lonely","I am a straight male who has never been in a romantic relationship. I am not a virgin, but every romantic relationship I've tried to pursue has ended in disaster. A few things you should know about me: While I am not a full-on clinical psychopath by a ...","San Antonio, Texas cityNdx: 6"
"http://www.cheatsheet.com/sports/ncaam-5-potential-replacements-for-rick-barnes-at-texas.html/?a=viewall","NCAAM: 5 Potential Replacements for Rick Barnes at Texas","Rick Barnes may have wanted to remain at Texas, but after 17 seasons as the men's head basketball coach, the school decided it was time to move on. The University of Texas released ... That would be me saying this is about me. I've been carried by a ...","San Antonio, Texas cityNdx: 6"
"http://www.mysanantonio.com/entertainment/celebrities/article/First-openly-gay-NFL-player-engaged-to-boyfriend-6004301.php","First openly gay NFL player, Texan Michael Sam engaged to boyfriend: reports","Gay marriage is now legal in 36 states and Washington, D.C. The 5th Circuit Court of Appeals in New Orleans will hold oral arguments Friday in challenges to same sex marriage bans in Texas, Louisiana and Mississippi. Friday is also the first day the U ...","San Antonio, Texas cityNdx: 6"
"http://blog.mysanantonio.com/jakle06/2015/03/hit-tv-comedy-recognizes-duncans-fundamentals/","Hit TV comedy recognizes Duncan's 'fundamentals'","He suddenly becomes worried that turning 40 was affecting the thing that made him special: his swagger. This is a real crisis, this isn't just about me getting old, it's about me losing my swag, you know, Dre moans to his wife, Bow, played by Traci ...","San Antonio, Texas cityNdx: 6"
"http://www.expressnews.com/sports/college_sports/longhorns/article/UT-s-Barnes-sticking-to-selective-vision-6121190.php","UT's Barnes sticking to selective vision","I went through a point in my life when I thought everything was about me, he said. Now I know better. He also knows no part of his ... San Antonio billionaire Red McCombs said he didn't want to get into that. There's a lot of talent out there, and ...","San Antonio, Texas cityNdx: 6"
"http://www.bizjournals.com/sanantonio/news/2015/04/03/the-rookie-star-partners-with-bcfs-to-inspire.html","The Rookie star partners with BCFS to inspire troubled youth","Former Major League Baseball pitcher Jimmy Morris, whose story inspired the 2002 Disney film The Rookie, is teaming with San Antonio-based BCFS to help inspire children struggling with problems of poverty, homelessness and abuse. BCFS Health and ...","San Antonio, Texas cityNdx: 6"
"http://www.kens5.com/story/news/2015/05/08/pay-hike-san-antonio-city-council-mayor/27003291/","Local leaders: Vote yes for 'Sensible Pay S.A.'","Fine / Jail incumbants who violated the Texas Open Meeting Act and held 45 months of illegal city council meetings in an effort to silence reports of public/police corruption.......follow the money........San Antonio TX city attorney Michael Bernard ...","San Antonio, Texas cityNdx: 6"
"http://www.mysanantonio.com/news/local/article/First-openly-gay-NFL-player-to-Oprah-I-m-not-5977619.php","First openly gay NFL player to Oprah: 'I'm not the only one'","LOS ANGELES, CA - DECEMBER 04: Football player Michael Sam attends the 2014 GQ Men Of The Year party at Chateau Marmont on December 4, 2014 in Los Angeles, California. (Photo by Jason Merritt/Getty Images for GQ). American football player&nbsp;...","San Antonio, Texas cityNdx: 6"
"http://www.expressnews.com/sports/college_sports/longhorns/article/Barnes-gracious-during-emotional-UT-exit-6166977.php","Barnes gracious during emotional UT exit","During 17 years at Texas, he rarely finished telling a story without interrupting it for the sake of a better one. But it also ... That would be me saying this is about me. Even so ... No one can ever diminish what I feel about the University of ...","San Antonio, Texas cityNdx: 6"
"http://www.mysanantonio.com/news/crime/article/Key-players-in-New-Jersey-lane-closure-scandal-6235727.php","Key players in New Jersey lane-closure scandal","Bridget Anne Kelly, New Jersey Gov. Chris Christie's former deputy chief of staff, speaks at a news conference where she denies any wrongdoing in the George Washington Bridge traffic scandal, Friday, May 1, 2015, in Livingston, N.J. Earlier Friday ...","San Antonio, Texas cityNdx: 6"
"http://news4sanantonio.com/news/features/top-stories/stories/Family-mourns-young-woman-killed-in-crash-106252.shtml","Family mourns young woman killed in crash","He was driving his girlfriend Raven Hernandez's SUV Sunday afternoon and they were on their way to visit her mother. Their SUV swerved to the left because of a tire blowout and they stopped on the narrow left shoulder of Interstate 10 West near Wurzbach.","San Antonio, Texas cityNdx: 6"
"http://www.foxsports.com/southwest/story/texas-tech-red-raiders-kliff-kingsbury-042915","Texas Tech coach Kliff Kingsbury focused only on winning","I'm not big into reading into that [entertainment] stuff about me, Kingsbury told FOX Sports Southwest. I'll have people forward me things and I just find it funny. I'm pretty indifferent to it. At this point, it's just about winning games and ...","San Antonio, Texas cityNdx: 6"
"http://www.dallasnews.com/business/columnists/cheryl-hall/20150407-texas-rangers-sink-into-the-cellar-of-fan-loyalty.ece","Texas Rangers sink into the cellar of fan loyalty","Rangers fans were disappointed in the moments immediately after Texas lost to San Francisco in the 2010 World Series, but a loyalty firm says cultivating a deep bond with fans involves much more than wins and losses.","San Antonio, Texas cityNdx: 6"
"http://www.mysanantonio.com/news/article/Casino-project-owners-investors-vetted-by-6246058.php","Casino project owners, investors vetted by regulators","It's one less administrative hurdle, Kelly said after the vote. You can't imagine the work involved. It's an incredibly intrusive process. I'm completely bleached-bones. There's nothing left to find out about me. The Brockton developers propose a ...","San Antonio, Texas cityNdx: 6"
"http://www.expressnews.com/news/news_columnists/brian_chasnoff/article/Van-de-Putte-flexing-status-as-senator-6071699.php","Van de Putte flexing status as senator","Two days earlier, Villarreal had effectively resigned his seat in the Texas House because running for mayor, he said, was his first, highest and only commitment. ... But it's not about me. It's about the people. It's been quite difficult, quite ...","San Antonio, Texas cityNdx: 6"
"http://www.mysanantonio.com/news/science/article/News-briefs-from-around-Tennessee-at-1-58-a-m-EDT-6259340.php","News briefs from around Tennessee at 1:58 a.m. EDT","NASHVILLE, Tenn. (AP)  A bill passed by Tennessee lawmakers could give parents of severely disabled children more than $6,000 a year to spend on education and therapies that they choose, though critics say the measure hands the money to parents&nbsp;...","San Antonio, Texas cityNdx: 6"
"http://www.expressnews.com/sports/colleges/article/Dausin-has-delivered-for-St-Mary-s-6258429.php","Dausin has delivered for St. Mary's","The doctor wasn't real wild about me coaching because your immune system is completely wiped out, said Dausin, who also received an infusion of another drug every Monday morning. With her white blood cell count at a frighteningly low level, Dausin ...","San Antonio, Texas cityNdx: 6"
"http://www.woai.com/onair/dubhub-55062/six-flags-fiesta-texas-kicksoff-2015-13317822/","Six Flags Fiesta Texas Kicks-Off 2015 Season &amp; Prepare For Thrilling New ...","San Antonio, Texas  Six Flags Fiesta Texas started their 2015 season while preparing for thrilling new additions to its park. Located right off i10 ... If you like the post, feel free to share and add your commentary to the article. www.about.me ...","San Antonio, Texas cityNdx: 6"
"http://www.sacurrent.com/sanantonio/hank-lee-builds-the-world/Content?oid=2347693","Hank Lee Builds the World","When Hank Lee moved to San Antonio in 1989, he opened San Angel Folk Art Gallery; today, the small space is a world-renowned institution for outsider art. ... As the interview draws to a close Lee quips, and we got through it without anything about me.","San Antonio, Texas cityNdx: 6"
"http://www.motherjones.com/politics/2015/06/edward-peruta-san-diego-concealed-carry","Meet the F-Bomb-Spewing Ex-Cop Behind the NRA's Move to Topple ...","County of San Diego, a federal lawsuit that seeks to overturn California's system of issuing concealed-weapon permits. Currently, the state's police chiefs ... Then California Attorney General Kamala Harris successfully petitioned the court to ...","San Diego, California cityNdx: 7"
"https://www.numberfire.com/nfl/news/5471/a-look-at-ladainian-tomlinson-s-legendary-career-in-san-diego","A Look at LaDainian Tomlinson's Legendary Career in San Diego","This season, the Chargers will give LaDainian Tomlinson the highest honor a team can bestow by retiring his number. Let's take a trip down memory lane and look back at his career in San Diego.","San Diego, California cityNdx: 7"
"http://www.kpbs.org/news/2015/jun/11/roberts-staffer-sues-2-former-staffers-civil-right/","County Supervisor Dave Roberts' Aide Sues 2 Former Colleagues","The recent allegations made about me by two former San Diego County employees are false. They have hurt me deeply, said Meza, who was hired nearly a year ago as Roberts' policy adviser and community representative. Diane Porter and Glynnis&nbsp;...","San Diego, California cityNdx: 7"
"http://timesofsandiego.com/education/2015/06/11/at-96-oldest-teacher-plays-piano-does-macarena/","At 96, Oldest Teacher Plays Piano, Does Macarena","Ken Stone photo But her San Diego Continuing Education students  all in wheelchairs  barely moved and didn't sing along during her hourlong class last week. ... We've become very close and tease about me being her adopted working daughter.","San Diego, California cityNdx: 7"
"http://www.utsandiego.com/news/2015/jun/12/french-airport-police-detain-6-year-old-girl-in/","French airport police detain 6-year-old girl in ID crackdown","... Europe-1 radio, said her daughter cried a lot after the incident. She doesn't stop talking about it, said the mother, who was identified only by her first name Isabelle to protect her daughter's identity. She asks each time 'but why are they ...","San Diego, California cityNdx: 7"
"http://timesofsandiego.com/opinion/2015/05/21/let-me-be-perfectly-clear-i-am-a-heterosexual-male/","Let Me Be Perfectly Clear . . . I Am a Heterosexual Male","My name is Harold A. Meza, and I am the providing this statement under oath in order to provide the truth in response to false statements and reporting made about me. I am a private person. I have been fasely portrayed by a former fellow County ...","San Diego, California cityNdx: 7"
"http://www.ibtimes.co.uk/arrow-season-4-first-trailer-release-comic-con-2015-leaked-audition-script-reveals-main-villain-1505979","Arrow season 4: First trailer to release at Comic-Con 2015? Leaked audition ...","All eyes will be on DC Entertainment and Warner Bros presentations at the upcoming San Diego Comic-Con, to be held in July. After reports teasing some big reveals at ... Villain: I'm sure Ra's has told you many things about me. He was quite the ...","San Diego, California cityNdx: 7"
"http://www.cbs8.com/story/29297529/aide-to-supervisor-roberts-announces-counter-claim-filed-in-supervisor-scandal","Aide to Supervisor Roberts announces counter-claim filed in supervisor scandal","SAN DIEGO (CBS 8) - The man accused of having an inappropriate relationship with embattled Supervisor Dave Roberts fired back on Thursday by filing a hostile work environment lawsuit against Roberts' former Chief of Staff Glynnis Vaughan and former&nbsp;...","San Diego, California cityNdx: 7"
"http://www.utsandiego.com/news/2015/jun/10/jimmy-fallon-wants-to-give-dads-a-win-with-his/","Jimmy Fallon wants to give dads a win with his new book","3, no one will care about me anymore. I'm gonna get an e-card from my wife that says, 'I saw on Facebook that it was Father's Day.' I'll get a Starbucks gift card. The first year you actually celebrate and that's the one that matters so I'm lucky to ...","San Diego, California cityNdx: 7"
"http://www.utsandiego.com/news/2015/jun/10/clinton-building-vast-network-of-campaign-staff/","Clinton building vast network of campaign staff, volunteers","Steph Luger, 25, right, of Minneapolis, photographs the group of future volunteers at the end of the meeting at the Minnesota DemocraticFarmerLabor Party (DFL) headquarters in Mankato, Minn., Tuesday, June 9, 2015. (AP Photo/Craig Lassig) The&nbsp;...","San Diego, California cityNdx: 7"
"http://www.ogemawherald.com/stories/Cross-country-cyclist-finds-resting-spot-in-Horton-Township,101730","Cross country cyclist finds resting spot in Horton Township","At nearly the halfway point of his cross country bicycle trip to start anew, Adrian Stewart of San Diego, Calif., found a place to rest in Ogemaw County May 20. He was inspired to take the adventure after his ex-fiance cheated on him and left him for ...","San Diego, California cityNdx: 7"
"http://www.mercedsunstar.com/sports/article23681254.html","Cardinals' Brown looks to make bigger impact in second year","Everyone knows about me now, I just have to perform and produce to be better than I was last year. The Cardinals ... Brown intends to go to San Diego with quarterback Carson Palmer to continue working out before training camp opens. We've had a lot ...","San Diego, California cityNdx: 7"
"http://www.utsandiego.com/news/2015/jun/09/christie-says-his-family-is-now-on-board-with/","Christie says his family is now on board with potential bid","This is about me now, Christie told reporters of his decision-making process. Mary Pat and the children are completely supportive if this is something I want to do. His wife, Mary Pat, stood by his side. Earlier Tuesday, he addressed a Politics ...","San Diego, California cityNdx: 7"
"http://www.dailymail.co.uk/news/article-3119362/Lawyer-Sledgehammer-alleged-quadruple-killing-weapon.html","Prosecutors 'to allege sledgehammer was used to kill McStay family'","Charles 'Chase' Merritt, 58, has a scheduled preliminary hearing Monday on charges that he murdered his business partner, Joseph McStay, the man's wife and their two young sons in their Fallbrook home in northern San Diego County. Merritt has pleaded ...","San Diego, California cityNdx: 7"
"http://www.myfoxatlanta.com/story/29229075/georgia-woman-talks-about-life-with-schizophrenia","Georgia woman talks about life with schizophrenia","Sitting in a group session at Community Friendship, Inc. in downtown Atlanta, Smith says, I've really come a long way from where I was to now. I feel more confident in myself; more able to share my diagnosis with others because of the support and my&nbsp;...","San Diego, California cityNdx: 7"
"http://www.prweb.com/releases/bestinbackyards/2015bullburgerbattle/prweb12778171.htm","Westchester Man Headed to World Food Championships","When he heard that, Saccente thought to himself, He can't be talking about me. I thought middle of the road, Saccente said when asked where he was think he'd place. Saccente's first-place prize is a Lonestar Grill Cart, valued at $2,300, from Bull ...","San Diego, California cityNdx: 7"
"http://www.northjersey.com/news/internet-prank-left-young-woman-scared-for-life-1.1351035?page=all","Internet prank left young woman scared for life","He knew everything about me, and I've never met him. It's terrifying. Through a .... We don't know a lot, said Brian H. Spitzberg, a professor of communication at San Diego State University who has studied the topic extensively. In his research ...","San Diego, California cityNdx: 7"
"http://ktla.com/2015/06/02/teen-posts-craigslist-ad-to-rent-a-family-for-her-birthday/","Colorado Teen Posts Craigslist Ad to Rent a Family for Her Birthday","... she'll finally have the birthday she's always dreamed of. I felt like having one day of where it's OK this about me and it's my birthday. said Natalie Carson. Carson says she was inspired to post on Craigslist after she saw a girl in California ...","San Diego, California cityNdx: 7"
"http://www.utsandiego.com/news/2015/jun/04/dodgers-closer-jansen-cleared-to-pitch-after/","Dodgers closer Jansen cleared to pitch after being held out","We had just lost a game, so I didn't want to talk about me in that situation. When you see how the ninth inning was going, you feel like you let all your teammates down. Jansen avoided arbitration last January by signing a one-year, $7.4 million ...","San Diego, California cityNdx: 7"
"http://kticradio.com/abc_world/woman-meets-another-doppelganger-in-italy-abcid35372611/","Woman Meets Another Doppelganger in Italy","From there, I was just kind of like, 'Hey, what do you think about me flying over there?' and she was super excited about it, so it was easy to set up, Geaney said. She added that she wanted to get a sense of what Guizzardi was like before meeting ...","San Diego, California cityNdx: 7"
"http://www.utsandiego.com/news/2015/jun/04/family-of-man-shot-by-terror-investigators/","Family of man shot by terror investigators shocked by claims","This is not about me. This is about whether the US will stand for freedom or submit and cower before violent intimidation. The FBI said Rahim and his nephew, David Wright, plotted to commit some kind of attack, and Rahim ordered three large knives on&nbsp;...","San Diego, California cityNdx: 7"
"http://www.10news.com/news/caitlyn-jenners-later-age-transition-after-marriage-kids-familiar-to-san-diego-trans-woman-060115","Caitlyn Jenner's later-age transition after marriage, kids, familiar to San ...","SAN DIEGO - Like Caitlyn Jenner, Vicki Estrada of San Diego was born with a boy's body, but always felt like a girl on the inside. Also like Jenner, Estrada was married ... I could hear them laugh and talk about me, Estrada said. So, Vicki got facial ...","San Diego, California cityNdx: 7"
"http://www.cosmopolitan.com/lifestyle/a39971/amanda-oleander-internets-most-fascinating/","Amanda Oleander Is Periscope's Breakout Star","When she hit 100,000 Periscope followers, Oleander decided to kick off a world tour in Los Angeles, with definite plans to hit San Francisco and San Diego, and the ultimate goal of visiting cities outside the country. I've never really had time to ...","San Diego, California cityNdx: 7"
"http://www.comicmix.com/2015/06/12/martha-thomases-cat-con/","Martha Thomases: Cat Con?","(Side note: Just like when I miss a family dinner, I worry that everyone was talking about me.) And then I found out about this ... Because I wasn't there, I don't know how much CatCon was like the San Diego Comic Con. I mean, there were panels and ...","San Diego, California cityNdx: 7"
"http://www.cincinnati.com/story/sports/nfl/bengals/2015/06/06/cincinnati-bengals-veterans-one-year-deals/28500743/","Bengals vets out to prove worth on 1-year deals","Cornerback Brandon Ghee was a third-round pick of the Bengals in 2010, and after four seasons in orange and black he signed a two-year deal in San Diego in March of 2014. ... All I can do is worry about me. I don't care about nobody else. You feel me ...","San Diego, California cityNdx: 7"
"http://www.theherald-news.com/2015/05/22/hendricks-5-hitter-bryants-2-run-homer-carry-cubs/ahs3rmm/","Hendricks' 5-hitter, Bryant's 2-run homer carry Cubs","That all changed Thursday night, when he dominated the San Diego Padres with a five-hitter that carried the Chicago Cubs to a 3-0 victory. Kris Bryant, who starred at the University of San Diego, hit a two-run homer on the game's seventh pitch. I'm ...","San Diego, California cityNdx: 7"
"http://www.utsandiego.com/news/2015/jun/04/next-man-up-for-cavs-but-do-they-have-enough-next/","'Next man up' for Cavs, but do they have enough next men?","But with no Love, potentially no Irving and no reliable backups to speak of, there may be no other way for the Cavs to win the series. It's not about me. It's not about the next guy. It's about all of us, James said. We're going to watch the film ...","San Diego, California cityNdx: 7"
