"URL","Title","Description","Region"
"http://www.inquisitr.com/2154162/anthony-riley-suicide-talented-voice-contestant-dead-at-28-video/","Anthony Riley Suicide: Talented 'Voice' Contestant Dead At 28 [Video]","For me it's tough, because everyone's just finding out [about me leaving the show], and I've been moving forwardThe Voice has ... Prior to seeking additional fame through televised singing competitions, Anthony was a fixture on the streets of ...","Philadelphia, Pennsylvania cityNdx: 4"
"http://espn.go.com/blog/nhl/post/_/id/38007/timonen-putting-team-stanley-cup-before-himself","Timonen putting team, Stanley Cup before himself","Timonen was acquired by the Blackhawks from the Philadelphia Flyers on Feb. 27 after not playing all season due to blood clots. He made his season debut March 2. ... But this is not about me. This is about the team and winning the Stanley Cup. I'm ...","Philadelphia, Pennsylvania cityNdx: 4"
"http://www.chestnuthilllocal.com/2015/06/11/colorful-dishes-produced-by-green-local-female-pioneer/","Colorful dishes produced by Green, local female pioneer","Acknowledged as one of the pioneer chefs who helped make Philadelphia a national dining destination, Green was also one of the first female chefs to make a name for herself in the region. She credits that to hard work, persistence and resourcefulness.","Philadelphia, Pennsylvania cityNdx: 4"
"http://www.marketwatch.com/story/me-ality-is-oversubscribed-for-15-million-equity-private-placement-and-welcomes-seasoned-executive-and-international-economics-expert-to-its-board-of-directors-2015-06-08","Me-Ality is Oversubscribed for $15 Million Equity Private Placement and ...","SANTA CLARA, Calif., Jun 08, 2015 (BUSINESS WIRE) -- Unique Solutions Design Ltd., (Me-Ality), developer of the only scanner technology able to take precise body measurements while a person is fully clothed, and owner of the world's largest database of&nbsp;...","Philadelphia, Pennsylvania cityNdx: 4"
"http://www.philly.com/philly/news/politics/mayor/20150529_Democratic_ward_leaders_hold_unity_breakfast_for_Kenney_-_but_where_s_Williams_.html","Building bridges: Kenney forgives Williams' absence at Democratic unity breakfast","Jim Kenney, Mayor Nutter and U.S. Rep. Bob Brady, chairman of the city's Democratic Party, speak at a unity breakfast Thursday morning at the Sheet Metal Union Hall. (DAVID SWANSON / Staff Photographer)&nbsp;...","Philadelphia, Pennsylvania cityNdx: 4"
"http://www.smh.com.au/world/ingeborg-syllmrapoport-102-completes-degree-denied-her-by-nazis-77-years-ago-20150610-ghke0k.html","Ingeborg Syllm-Rapoport, 102, completes degree denied her by Nazis 77 years ...","It was about the principle, not about me, Dr Syllm-Rapoport said in an interview published online with Germany's Tagesspiegel daily last month. The Berlin resident ... Without her official PhD, she had to undertake a further two years of study in ...","Philadelphia, Pennsylvania cityNdx: 4"
"http://www.chestnuthilllocal.com/2015/06/11/life-saved-by-fast-thinking-er-doctor-at-ch-hospital/","Life saved by fast-thinking ER doctor at CH Hospital","It has been one of the worst allergy seasons in Philadelphia history, exacerbating the asthma I have suffered from since I was a child. But Friday is a deadline day, so I worked through, even as I started to feel sicker, even as it became harder to ...","Philadelphia, Pennsylvania cityNdx: 4"
"http://probasketballtalk.nbcsports.com/2015/06/04/pbt-finals-prediction-post-not-all-of-us-pick-golden-state/","PBT Finals prediction post, not all of us pick Golden State","What about me?! Make that 4 out of 5 pick the Warriors! Initially I said Warriors in 6 but if Kyrie is still hobbled it will not go past 5. But I'm even going two steps further than the PBT writersChef Curry will average 30 and will win the MVP. He's ...","Philadelphia, Pennsylvania cityNdx: 4"
"http://6abc.com/news/girl-13-hit-by-stray-bullet-in-port-richmond;-2-gunmen-at-large/756032/","Girl, 13, hit by stray bullet in Port Richmond; 2 gunmen at large","At the end of the day, it's not about me being a rat, being a snitch - it's not about that. It's about being a hero because, at the ... There is a vague description of the suspects but anyone with information is urged to contact Philadelphia Police ...","Philadelphia, Pennsylvania cityNdx: 4"
"http://www.chicagonow.com/affirmed-mom/2015/06/transgender-people-greatest-world/","Transgender People are the Greatest in the World","We just returned home from the 14th Annual Philadelphia Trans-Health Conference, a three day conference whose mission is to educate and empower trans* individuals and allies. The first time I heard it was at the pool, talking with other parents. We ...","Philadelphia, Pennsylvania cityNdx: 4"
"http://philadelphia.cbslocal.com/2015/05/20/chris-stigall-goodbye-mr-letterman/","Chris Stigall: Goodbye, Mr. Letterman","It became a sort of accepted peculiarity about me. I admired this guy, and I just didn't care what anyone thought. My college girlfriend (now wife), Christine likely wondered if I was being honest about my sexuality, as she would later tell me she ...","Philadelphia, Pennsylvania cityNdx: 4"
"http://www.cityofbasketballlove.com/news_article/show/522010?referrer_id=1566508","Arcadia's Scott gets FIBA coaching opportunity","These players don't know much about me, Scott said. I'm 31. I'm a younger coach, and a lot of these guys I'm going to be coaching are going to be around my age. I think I'm going to make up it up with my professionalism and hard work. They will see ...","Philadelphia, Pennsylvania cityNdx: 4"
"https://www.yahoo.com/health/an-incest-survivor-shares-her-perspective-on-the-120565931098.html","An Incest Survivor Shares Her Perspective on the Josh Duggar Sex Abuse ...","Here, Rachel, a 32-year-old sexual abuse survivor from the Philadelphia area, explains what she wants everyone to know about assault in light of the controversy. . My first and foremost thought when I hear about cases like this is that I feel very ...","Philadelphia, Pennsylvania cityNdx: 4"
"http://www.philly.com/philly/news/20150607_City_worker__nationally_treasured.html","The Interview: City worker, nationally treasured","Your background? I live in West Philly, right across from Malcolm X Park, and I grew up in Southwest Philly. I went to Central High, in Olney. It literally took me an hour to get to high school every day. ... I think what drives me is that not only is ...","Philadelphia, Pennsylvania cityNdx: 4"
"http://www.deseretnews.com/article/865630049/Elder-L-Tom-Perry-was-always-so-good-to-me.html?pg=all","Elder L. Tom Perry 'was always so good to me'","Frankly, I didn't know who he was, which tells you all you need to know about me as an 18-year-old. He didn't know me either, but because I was wearing a BYU football T-shirt, he asked me if I was on the team as we waited in line in the gift shop of ...","Philadelphia, Pennsylvania cityNdx: 4"
"http://www.myfoxphilly.com/story/29235385/police-confirm-pam-geller-was-initial-target-of-terror-plot","Police confirm Pam Geller was initial target of terror plot","This is not about me. This is about whether the US will stand for freedom or submit and cower before violent intimidation. Authorities invited Rahim's family to see the police video of the shooting that they already showed to Faaruuq and other ...","Philadelphia, Pennsylvania cityNdx: 4"
"http://espn.go.com/blog/philadelphia-eagles/post/_/id/12109/qa-nelson-agholor-trying-to-get-better","Q&amp;A: Nelson Agholor trying to get better","PHILADELPHIA -- With the Philadelphia Eagles poised for this week's full-squad practices, here's a Q&amp;A with rookie wide receiver Nelson Agholor from earlier this month. The first-round ... It's not about me going out there and catching 10 passes in a game.","Philadelphia, Pennsylvania cityNdx: 4"
"http://www.csnphilly.com/article/kyrie-irving-crutches-next-man-cavs","With Kyrie Irving on crutches, 'next man up' for Cavs","But with no Love, potentially no Irving and no reliable backups to speak of, there may be no other way for the Cavs to win the series. It's not about me. It's not about the next guy. It's about all of us, James said. We're going to watch the film ...","Philadelphia, Pennsylvania cityNdx: 4"
"http://espn.go.com/college-sports/story/_/id/12943153/national-championship-matchup-win-college-lacrosse","National championship matchup a win for college lacrosse","PHILADELPHIA -- They will throw their gloves, sticks and helmets in the air and crash together into a celebratory dog pile. There will be high-fives, pictures and interviews and eventually, the winners will take their brand-new national championship ...","Philadelphia, Pennsylvania cityNdx: 4"
"http://www.chestnuthilllocal.com/2015/05/28/smartphone-politics/","Smartphone politics","My phone drives me nuts. I don't really need a smartphone, since I spend most of my time in front of a desktop computer. I might switch back to a flip phone when the contract expires and allow the 21st century to proceed without me. What I didn't ...","Philadelphia, Pennsylvania cityNdx: 4"
"http://bleacherreport.com/articles/2485564-surprise-scenarios-that-could-alter-the-course-of-the-2015-nba-draft","Surprise Scenarios That Could Alter the Course of the 2015 NBA Draft","You don't have to look back very far in the annals of NBA draft history to realize unpredictability often rules the day. Even with years to scout talent, months to organize it on draft boards and spread sheets, and weeks to scrutinize it in person ...","Philadelphia, Pennsylvania cityNdx: 4"
"http://www.chestnuthilllocal.com/2015/05/21/living-with-lies/","Living with lies","A recent article on ESPN by Kate Fagan (formerly the Sixers beat writer for the Philadelphia Inquirer) profiled Madison Holleran. Madison was a promising young runner who enrolled at Penn. Just a few months into her freshman year, she killed herself.","Philadelphia, Pennsylvania cityNdx: 4"
"http://www.delcotimes.com/sports/20150515/sylvestre-looks-like-hes-worth-keeping-by-the-union-for-a-while","Sylvestre looks like he's worth keeping by the Union for a while","Brian Sylvestre, right, didn't have much of a chance to stop Vancouver's Pedro Morales on this point-blank shot, but the on-looan Union goalkeeper didn't do badly while being strafed by a relenteless Whitecaps attack. The Union is working on extending&nbsp;...","Philadelphia, Pennsylvania cityNdx: 4"
"http://www.washingtonpost.com/news/post-nation/wp/2015/05/30/hundreds-gather-in-arizona-for-armed-anti-muslim-protest/","Hundreds gather in Arizona for armed anti-Muslim protest","PHOENIX About 250 mostly armed anti-Muslim demonstrators  many wearing T-shirts bearing a profanity-laced message denouncing Islam  faced-off against a crowd of roughly the same size defending the faith in front of a Phoenix mosque Friday night ...","Phoenix, Arizona cityNdx: 5"
"http://www.abc15.com/sports/sports-blogs-local/arizona-cardinals-wr-john-brown-looks-to-make-bigger-impact-in-2nd-year","Arizona Cardinals WR John Brown looks to make bigger impact in 2nd year","This year I know a lot more than I did last year, Brown said. That helps me out on the field. It's also become easier. Everyone knows about me now, I just have to perform and produce to be better than I was last year. The Cardinals sought to limit ...","Phoenix, Arizona cityNdx: 5"
"http://www.azcentral.com/story/ejmontini/2015/06/07/islamic-community-center-phoenix-jon-ritzheimer-protest-arizona-faith-network/28490117/","Time for us to thank the anti-Islam protesters","He led a crowd of roughly 250 like-minded anti-Muslim demonstrators, many of them also armed, many of them also wearing T-shirts that profanely denounced Islam, as part of a nasty, name-calling rally at the Islamic Community Center of Phoenix. And for ...","Phoenix, Arizona cityNdx: 5"
"http://arizonasports.com/41/1838140/Intriguing-Notre-Dame-PG-Jerian-Grant-highlights-Phoenix-Suns-predraft-workout","'Intriguing' Notre Dame PG Jerian Grant highlights Phoenix Suns pre-draft workout","Notre Dame guard Jerian Grant speaks to reporters following a pre-draft workout with the Phoenix Suns. (Photo by Craig ... I got a couple of teams interested in me, got people talking about me, buzzing about me, he said. I definitely benefited from ...","Phoenix, Arizona cityNdx: 5"
"http://www.foxsports.com/arizona/story/d-backs-jake-lamb-disabled-list-return-jordan-pacheco-060615","D-backs' Jake Lamb returns from DL stint","PHOENIX -- The Arizona Diamondbacks on Saturday activated third baseman Jake Lamb from the 15-day disabled list before the D-backs faced the Mets. Lamb's return from a stress reaction in his foot required Arizona to make a corresponding roster move&nbsp;...","Phoenix, Arizona cityNdx: 5"
"http://philboxing.com/news/story-109546.html","Arizona Boxing News &amp; Notes with Don Smith: BMBP Boss Lady, Boxer Chris ...","I found out that she might have been hesitant to answer questions from me because her former boxing ring announcer Ralph Velez Jr. said some malicious things about me and unfortunately we can't repeat his comments because we don't print x rated ...","Phoenix, Arizona cityNdx: 5"
"http://www.usatoday.com/story/sports/mlb/2015/05/22/hendricks-5-hitter-bryants-2-run-homer-carry-cubs-3-0/27759485/","Bryant homer backs Hendricks shutout in Cubs win","UP NEXT: Cubs  LHP Jon Lester (4-2, 3.70) tries to improve to 5-0 in May when he faces the Arizona Diamondbacks in the opener of a three-game series starting Friday night in Phoenix. He has a 1.67 ERA this month. The Diamondbacks counter with Josh&nbsp;...","Phoenix, Arizona cityNdx: 5"
"http://www.azcentral.com/story/news/local/phoenix/2015/05/19/phoenix-police-help-homeless-abrk/27590381/","Phoenix officer finds kindred spirit in homeless man","But that all changed when Phoenix Police Officer Richard Dicarlo took notice. I got to a point where I said, 'You know what, this is where I'm gonna be; I'm gonna be out on the street,' Goodwin, 61, said Tuesday morning. Then the Officer Dicarlo ...","Phoenix, Arizona cityNdx: 5"
"http://www.thenewsstar.com/story/sports/college/louisiana-tech/2015/05/28/speedy-smiths-nba-workout-tour-underway/28079357/","Speedy Smith's NBA workout tour under way","Smith's NBA audition tour kicked off in Dallas on Tuesday for a workout with the Mavericks before working out for the Phoenix Suns on Wednesday. It felt good to be able to compete on a good level, Smith told The News-Star on Wednesday night. Not ...","Phoenix, Arizona cityNdx: 5"
"https://asunews.asu.edu/20150527-schmidt-music-education-awards","ASU faculty member recognized for work in music education","Marg Schmidt, associate professor of music education in the School of Music at Arizona State University, was recently honored with two prestigious awards: the 2015 national String Researcher Award by the American String Teachers Association (ASTA) and ...","Phoenix, Arizona cityNdx: 5"
"http://www.midwestproducer.com/news/opinion/terry_anderson/terry-anderson-ag-college-in-the-desert/article_9d454f9a-049d-11e5-b6e2-a7ffe4733bf4.html","Terry Anderson: Ag college in the desert","We didn't eat at any fast-food outlets until we were waiting for our flight home in the Phoenix airport. If we ate at a chain restaurant, it wasn't as well-known as most.  It's extremely dry in Arizona, but unlike Nebraska and Kansas, it's supposed to ...","Phoenix, Arizona cityNdx: 5"
"http://www.gospelherald.com/articles/55600/20150519/mark-driscoll-preaches-first-church-sermon-since-resignation-from-mars-hill-receives-standing-ovation.htm","Mark Driscoll Preaches First Church Sermon Since Resignation From Mars Hill ...","Meanwhile, Patheos blogger Warren Throckmorton has revealed that Driscoll may be returning to the ministry, this time in Phoenix, Arizona. Throckmorton notes that from his observation, the reaction has been mixed, with some expressing anger over a&nbsp;...","Phoenix, Arizona cityNdx: 5"
"http://www.christianpost.com/news/former-mars-hill-pastor-mark-driscoll-returns-to-seattle-to-preach-at-gold-creek-community-church-139226/","Former Mars Hill Pastor Mark Driscoll Returns to Seattle to Preach at Gold ...","In recent weeks, several individuals have contacted me with tips that Driscoll is preparing to plant a church in Phoenix, Arizona, he wrote on May 4. In recent days, the buzz has intensified from several independent sources which leads me to believe ...","Phoenix, Arizona cityNdx: 5"
"http://www.dailymail.co.uk/femail/article-3088003/HIV-positive-father-three-Andrew-Pulsipher-shares-inspirational-image-HIV-negative-wife-children-hopes-changing-way-society-views-illness.html","HIV positive father Andrew Pulsipher shares image of HIV negative family","Andrew Pulsipher, from Phoenix, Arizona, shared an image of himself, his wife Victoria, and his three children, aged five, three, and one, on his Facebook page earlier this month, showing that, while he is HIV-positive, his wife, and his children, are not.","Phoenix, Arizona cityNdx: 5"
"http://desertmessenger.blogspot.com/2015/05/judge-dismisses-jennifer-jones-free.html","Federal Judge dismisses Jennifer Jones' Quartzsite Free-Speech case","Quartzsite, AZ - Jennifer Jones, a local dog groomer, political activist, and former state candidate, lost her infamous Civil Rights case against the Town of Quartzsite in U.S. District Court Phoenix Division Tuesday, May 26th, 2015. (Jones was also ...","Phoenix, Arizona cityNdx: 5"
"http://phoenix.about.com/od/babynames/fl/Top-10-Arizona-Baby-Names-2014.htm","Top 10 Arizona Baby Names 2014","Well, enough about me. Did I mention that my middle name is a very popular name? It was in the top 15 in 2014. Well, enough about me. Again. When I went to school there was a preponderance of people named Michael, James, John, Robert, Debbie,&nbsp;...","Phoenix, Arizona cityNdx: 5"
"http://arizonasports.com/41/1798865/Phoenix-Suns-Markieff-Morris-on-ducking-media-It-was-me-being-childish","Phoenix Suns' Markieff Morris on ducking media: 'It was me being childish'","It definitely wasn't about me; it was about the team's success, the organization. We definitely put together a big win last night, the fans were great, everybody was great, he said. I've just got to take more responsibility, be a professional about ...","Phoenix, Arizona cityNdx: 5"
"http://arizonasports.com/41/1802599/Clippers-Matt-Barnes-blames-Phoenix-Suns-owner-Robert-Sarver-for-25K-fine","Clippers' Matt Barnes blames Phoenix Suns owner Robert Sarver for $25K fine","He's said some stuff about me before that fueled a few of my old teammates that were there from the Clippers, Barnes said. I've never liked him, and as soon as he said that to me, it got me going. But if players are held to a high standard, owners ...","Phoenix, Arizona cityNdx: 5"
"http://www.nytimes.com/2015/01/04/travel/abandoning-doubt-in-sedona-arizona-.html","Abandoning Doubt in Sedona, Arizona","As we made our way from Phoenix Sky Harbor International Airport to Sedona on State Route 179 with our 2-year-old son, Marceau, and daughter Djali, 17, in the back seat, it felt as if nature coiled herself around our rental. The route, also known as ...","Phoenix, Arizona cityNdx: 5"
"http://www.phoenixnewtimes.com/music/john-5-loves-the-arizona-heat-and-vintage-telecasters-6587069","John 5 Loves the Arizona Heat and Vintage Telecasters","In the Phoenix metal scene, there's obviously a ton of Latin and Spanish influence, so you always fit right in. Yes. You're so on the ... It's really strange looking. So that first track is about my parents being concerned about me being a recluse with ...","Phoenix, Arizona cityNdx: 5"
"http://www.azcentral.com/story/news/local/phoenix/2015/04/15/phoenix-cave-creek-kids-kidney-walk-cbt/25782715/","Game on for Phoenix and Cave Creek kids in Kidney Walk","Fortunately, that wasn't the case for a group of students from Kyrene de la Colina Elementary School in Phoenix and Lone Mountain Elementary School in Cave Creek, who were volunteering last November at the annual luncheon benefiting Arizona kidney ...","Phoenix, Arizona cityNdx: 5"
"http://arizonasports.com/74/1821980/Duke-assistant-Jeff-Capel-vague-when-asked-about-head-coaching-opportunities","Duke assistant Jeff Capel vague when asked about head coaching opportunities","To be completely honest, it's a lot better than what was written four years ago about me, so I feel good about that. Capel was referring to the treatment he received from the media when he was dismissed as Oklahoma's head coach in 2011 after back-to ...","Phoenix, Arizona cityNdx: 5"
"http://www.azcentral.com/story/entertainment/events/2015/04/07/phoenix-pride-festival-parade/25366983/","What to expect at Phoenix Pride Festival","phoenix pride 2001. James Sorrell joins other festivalgoers in paying tribute to American patriots at the 2001 Phoenix Pride Festival. ... Jeff Andringa (left) and Travis Edwards blow bubbles on the Nu Towne Saloon Float in Phoenix Pride Parade in 1999.","Phoenix, Arizona cityNdx: 5"
"http://www.foxsports.com/arizona/story/phoenix-open-pro-am-phil-mickelson-age-amateur-hole-in-one-012815","Phoenix Open Pro-Am: Phil Mickelson fights feeling old, amateur hits hole-in-one","Don't get too worked up about it. Mickelson claimed Bradley outdrove him by only 11 yards as the two loosened up at the Waste Management Phoenix Open Pro-Am. I had not played the hole before, Mickelson said. If that's what it takes to stroke his ...","Phoenix, Arizona cityNdx: 5"
"http://www.azcentral.com/story/sports/ncaaf/asu/2015/04/30/ucla-wr-devin-lucien-ready-for-new-start-at-asu/26664601/","UCLA WR Devin Lucien ready for new start at ASU","We really think we could make history, and I'm just not talking about me and him as individuals. I'm talking about the team -- period. I've done my research. I know their offensive-line situation. ... It's a good thing. What did ASU tell you about how ...","Phoenix, Arizona cityNdx: 5"
"http://www.gospelherald.com/articles/55499/20150513/mark-driscoll-to-make-ministry-return-in-phoenix-pastor-urges-christians-to-extend-grace-forgiveness.htm","Mark Driscoll to Make Ministry Return in Phoenix, Pastor Urges Christians To ...","''Those Christians who still want to disagree might want to think about who the Apostle Paul really was. And honestly, we might want to think about whether or not we really do believe in forgiveness,'' Pastor Miller writes. ''Because no one is beyond ...","Phoenix, Arizona cityNdx: 5"
"http://www.azcentral.com/story/entertainment/events/2014/12/22/top-things-to-do-metro-phoenix/19899067/","No excuse for bored: Metro Phoenix's top 10 things to do","Kids will enjoy All About Me, a permanent exhibit that will explores the systems of the human body, including a working stomach that's large enough to walk through. |Details: 600 E. Washington St., Phoenix. $11-$14.95. 602-716-2000, azscience.org.","Phoenix, Arizona cityNdx: 5"
"http://www.courant.com/sports/football/hc-patriots-seahawks-super-bowl-daily-0126-20150126-story.html","Super Bowl Today: Patriots Arrive, Available In Arizona At 8 Tonight","The Courant's Paul Doyle is in Arizona this week covering the Patriots, Seahawls and everything Super Bowl XLIX. Follow along through each day's activities leading up to the game as he sets the scene from Phoenix. Belichick Says He's Done Talking&nbsp;...","Phoenix, Arizona cityNdx: 5"
"http://www.foxsports.com/arizona/story/brandon-knight-phoenix-suns-struggling-offense-040115","Brandon Knight's rise could determine future of Suns' offense","It's a different team, man, Phoenix's power forward said following last month's loss to the Golden State Warriors. After the trade, we lost 30 points. You can count 30 for those two guys every game. Now we just got to find a way to score, it's ...","Phoenix, Arizona cityNdx: 5"
"http://www.azcentral.com/story/entertainment/music/2015/01/07/phoenix-local-music-american-longspurs-trailer-queen/21389205/","Plugging into Phoenix: American Longspurs, Swapmeat","Seriously, this is a pretty busy week for yours truly. I got a lot going on, which I will let you in on at the end of this week's column in one big, self-promoting serving. Normally, I like to take things nice and easy and just let people miss me not ...","Phoenix, Arizona cityNdx: 5"
"http://www.foxsports.com/arizona/story/tiger-woods-confident-comedic-waste-management-phoenix-open-012715","Tiger Woods confident and comedic as he preps for Waste Management ...","SCOTTSDALE, Ariz. -- Despite a flu-caused weight loss, a freak accident that caused two broken teeth and a change in swing coaches, it's hard to imagine Tiger Woods being more upbeat heading into the 2015 Waste Management Phoenix Open. Woods was&nbsp;...","Phoenix, Arizona cityNdx: 5"
"http://www.azcentral.com/story/entertainment/dining/2015/03/31/howard-seftel-retirement-questions/70724274/","Restaurant critic Howard Seftel is retiring","Nobody wants to read about me, my wife, my family, my friends, my political views, etc., which suits me fine, since I have no interest in broadcasting anything personal. Really, I'm ... Where: Herberger Theatre, Stage West, 222 E. Monroe Street, Phoenix.","Phoenix, Arizona cityNdx: 5"
"http://www.king5.com/story/sports/nfl/seahawks/2015/03/13/jimmy-graham-on-seahawks-trade-it-definitely-put-a-grin-on-my-face/70255018/","Graham on Seahawks trade: 'It definitely put a grin on my face'","Literally, when he [Carroll] sat me down just talking about my basketball career and going back and talking about all these things he's heard about me, I could tell that he's a detail-oriented person. He knew so much about mehalf the stuff I forgot ...","Phoenix, Arizona cityNdx: 5"
